user@mention,user_id,No of tweets,tweet_id,retweet_count,local influence score,Tweet
CoachBBuchanan,901463098061619201,1,1009909419134603266,5,5.0,Thank you @maruccisoftball for being such an amazing sponsor to me! Im blessed to be apart of the #MarucciFamily! Cant wait to sport the gear.#HonorTheGamepic.twitter.com/RmCpiuxmFC
ashandgas,2224346775,1,1009908719700848641,5,5.0,dear producers stop adding police sirens in your music I was just about to put it in sport
madisoncarnes9,3229959091,1,1003785009222881287,5,5.0,Wow. What a sport where so many little girls look up to many young ladies and adore their passion for the game today. I love this. https://twitter.com/ncaasoftball/status/1003783836210089984 …
BobSlovak13,18497532,2,1003741147871760384,10,5.0,Houston Sports Hall of Fame Plaque unveiling @DR34M Hakeem Olajuwon. @abc13houstonpic.twitter.com/iYnUmy4DZf
gregblood,243448188,1,1003775372809285632,5,5.0,Congrats to @KimmyJCrow on a fantastic rowing career.  Look forward to your future involvement in sport - former athletes have a great deal to contribute and must be embraced by sports organisations https://twitter.com/TimGavel/status/1003773771667259394 …
GraemeKelly1,335841301,1,1003774276833554433,5,5.0,I was with a sports science lad for another club and I didn’t see Ramos do him. He did and said he’d take him off! https://twitter.com/oliver__bond/status/1003753181124481026 …
GeeseLV,2971677040,1,1003772646264209409,5,5.0,To this day it’s the single greatest sports moment I’ve ever witnessed. “The Catch.” Condolences to the Clark family. pic.twitter.com/7yYq10Xo2e
A_Flawed_King,310035155,1,1003771270922579972,5,5.0,One of the greatest plays in 49er NFL and sports history. “The Catch” R.I.P Dwight Clark.
MarchTownFC,601782298,1,1003766422785359872,5,5.0,SPONSOR CONFIRMED  A2Z Sports have today purchased one of our pitch side advertising boards. #welcomeonboardpic.twitter.com/YiQqAfjD9G
odsteve,170775294,1,1003766378510381056,5,5.0,Wonder why we don’t do this for every other racing series or sport?  Always seemed odd to me but maybe I don’t follow those who do it https://twitter.com/jeff_gluck/status/1003626328023818240 …
JMBpreps,54341264,1,1003756870425866243,5,5.0,COACHES: need your #nandoallmetro (N&O All-Metro) nominations no later than Wednesday for the following sports:-Baseball-Softball-Girls Soccer-Boys Lacrosse-Girls Lacrosse
RSS0004,20095609,1,1003741745455271936,5,5.0,@TownMallingSwa1  welcome to social media. Love the work you are doing. #westmalling at the forefront of ladies sport. Have fun ! https://twitter.com/townmallingswa1/status/1003719350556164096 …
SECfootball,235181669,2,1013564328484753408,10,5.0,Athlon Sports predicts complete SEC standings for 2018 includes two SEC Playoff teamshttps://www.saturdaydownsouth.com/sec-football/athlon-sports-predicts-complete-sec-standings-2018-includes-two-sec-playoff-teams/ …
MSURadio_WMSV,256661085,1,1008820924303503366,5,5.0,Look what came in today!!! You can sport one of these new WMSV t-shirts for only $10! Come by the station and pick one up today! pic.twitter.com/FVOH1sPfu9
K8_Brown68,844709885107425282,1,1010665961509269504,5,5.0,Excited 2 b @ Des Moines Register #alliowa Sports Award presentation! @livbrown22 4  Player of the year is here in spirit! Proud of you baby!!!pic.twitter.com/n8dGgBdbf0
clashboy23,217580625,1,1010650572226285568,5,5.0,The self importance these sports journalists regard themselves with is quite astonishing. https://twitter.com/matt_lawton_dm/status/1010541658620952576 …
NDN_PrepZone,16339614,1,1010648963421106176,5,5.0,.@FHSAA presents power rankings proposal with drastic changes for seven sports https://newspr.es/2KfivfQ  via @ndn
jet79,145878521,1,1010648938209165312,5,5.0,Postol is the finest malnourished fighter in the sport.
CosmicRiptide,2772586872,1,1010646304178032640,5,5.0,People who hunt for “sport” are the same people that preach pro-life. Stick to your argument Janet! https://twitter.com/rickygervais/status/1009519816762372096 …
Arlenv1,170053807,1,1010637878349578240,5,5.0,Happy #OlympicDay I’m beyond blessed to have had the honor of representing my country with the sport I love for the people I love.  pic.twitter.com/vXyMhDLXgu
NPNBlythNPT,4868759416,1,1010632757524008960,5,5.0,Thanks to the @Lightning_Seeds for being such good sports! Hopefully we’ll see you back in Blyth again!  #NorthumberlandLivepic.twitter.com/VEMMs9UtNi
Gianaaaa,39594670,1,1010632665513553920,5,5.0,Last year I was interviewing her for my Women in Fantasy Sports series this year she’s guest starring writing and producing in @therushyahoo. Check out @LizLoza_FF killing it as always!! #wedemgirlshttps://sports.yahoo.com/rush-summer-heats-nba-draft-060426298.html …
5liveSport,425989199,1,1010621012982018049,5,5.0,Have you been using @BBCSports Take Me to the #WorldCup smart speaker service? Heres a look behind the scenes recording an episode with @ConorMcNamaraIE and @DionDublinsDube More : http://bbc.in/2KbemcN #bbcworldcuppic.twitter.com/KLESzBVsGG
HimaHeathensRFC,3044803229,1,1010620450672726019,5,5.0,No we weren’t cursing. In sports you win some you lose some. Congratulations to @piratesrugbyUG on the second win
AlemanyFootball,1379055704,1,1012840892669952000,5,5.0,Great article about HC Casey Clausen and great moments in Tennessee sports!!                                                       https://www.seccountry.com/tennessee/tennessee-football-basketball-phillip-fulmer-bruce-pearl-al-wilson/amp?__twitter_impression=true …
CPyles8,51500651,2,1004848476373618688,10,5.0,Love Fix.  One of my favorite competitors in the sport and an eventual Olympic Champion in my opinion. But this weekend I got Gilman.
tineo148,2432192351,1,1012822137206460416,5,5.0,I love streaming #Football matches on my phone! Upgrade to #Telenor4GSpeed to stream your favorite sport!https://cards.twitter.com/cards/18ce54icwwv/5whzb …
Tineo1Hector,2992486217,1,1012817551179567104,5,5.0,I love streaming #Football matches on my phone! Upgrade to #Telenor4GSpeed to stream your favorite sport!https://cards.twitter.com/cards/18ce54icwwv/5whzb …
shane_riordan,208322515,1,1012811347527192576,5,5.0,You clickbait motherbleepers need to delete your organization as a whole. Sports Mockery is trash. https://twitter.com/sportsmockery/status/1012686120444940288 …
muscle_fitness,17244973,1,1012810468505870336,5,5.0,Thinking of becoming a trainer? Heres what you should know about the International Sports Sciences Association—one of the worlds leading fitness education organizations. @ISSAonlinehttp://ow.ly/GTao30kJtEv
iClevedon,481550476,1,1012806251602903041,5,5.0,Our Digital Leaders will be creating @AppleEDU Clips from all the @ClevedonSchool sports day events on Tuesday and sharing via @trilbytv around school and on @fireflyteampic.twitter.com/4hJBTBDhBd
ForresDee,195012248,1,1012800704820449280,5,5.0,Not really. Pretty standard up here the standard of our sports journalists seems to have transferred over to the rest of our media.
Si_Roach,2282074120,1,1012797514632835072,5,5.0,A fantastic day spent @Pembrokeshire InSport Well done @sportpembs team & @AngelaMiles4 extremely well organised. So many enjoying a great day trying new Sports with opportunities open to all @GOGAPembs @sport_wales @dsw_newsThank you @oddjob72 @WW_RDOpembs @WelshWeightlift
_NMAA,64325542,1,1012797430440570880,5,5.0,La Cueva’s @austindenton_7 recognized at the @NFHS_Org annual meetings as the Section 6 Spirit of Sport winner pic.twitter.com/8oT068FibY
EquiSpace,17914750,1,1012797246050627584,5,5.0,Excited to announce I’ve been appointed to the Board of Directors of the Greater Buffalo Sports Hall of Fame @BuffSportsHall @TBNSports
Ballstate_ATC,984527951667527681,1,1012796318044033025,5,5.0,@NATA1950 @D4updates @BallStateSports @BSU_AT@INAthletic The Cardinal Sports Medicine Society Ring of Honor tradition continues...  #60yearsofATexcellence #WeFlypic.twitter.com/1wI5qICr2r
bethannd19,1084732100,1,1012794698044465153,5,5.0,If you are graduated. And you still affiliate your popularity and social status with high school sports. You need to stop. Immediately. Thank you.
1love_ball,829358977582505984,1,1011028590828322817,5,5.0,@kidsandpros GREAT CAMP !! I enjoyed helping the building of character skill and hardwork in our kids. Especially through the sport we all love!   pic.twitter.com/MGZXeOkSm5
spicker123,339670412,1,1011021184660590595,5,5.0,via Vintage Wonder Wheels1927 Bugatti T44 Sport Touring pic.twitter.com/ecTmBwLvVN
kennanaiono_DE,902327523781967873,1,1011008931542360064,5,5.0,Had a great time at @All_Poly_Sports camp yesterday. Thankful for the coaches for recognizing me as one of the top D Lineman there! Great experience pic.twitter.com/rp18ZD1Vfv
CollegeHoopNews,469447891,1,1011003625559285760,5,5.0,Congratulations to @HoopsWeiss for being inducted into the National Sports Media Association Hall of Fame. One of the best and nicest people in the business.
UPSLsoccer,2927087454,1,1010999661912514560,5,5.0,Look who made an appearance at last nights @UPSLsoccer @CalUtdFCII-@LaMaquinaUPSL match at Lake Forest Sports Park!!Photo courtesy @TmesisFCpic.twitter.com/mMBYHMJuYR
BeachWrtrCindy,15822690,1,1010992951877603328,5,5.0,@tickles_thecat Tell Daddy we know hes disappointed   but he DID NOT let us down!  He never does - because he loves the sport and always tries!  Well always be behind him!
ErhsBBoosters17,893923185091002369,1,1010992817282248704,5,5.0,Ladies n gents lets not forget that Band is also a sport. You need physicals to participate. https://twitter.com/lgonzales11/status/1007719537620340737 …
DarlingSpectrum,20119578,1,1012118691599663105,5,5.0,OMG But imagine if we did this to a group we were up against for mama awards or something... like. no. way. Only sports fans can get away with this level of savagery  https://twitter.com/thattguyali/status/1012090164389318656 …
Tnsports360,276151090,1,1012112506133901314,5,5.0,Samuels two shots off lead at Junior Amateur -TN Sports 360 http://tnsports360.com/samuels-two-shots-off-lead-junior-amateur/ … via @tnsports360
LSEgirlsBball,893522924707119104,1,1012111946668101633,5,5.0,This is a huge win for @LSEVolleyball . Paige is one of the great competitors and multi-sport athletes we have ever had. 12 varsity letters and a great basketball player! Go Knights! https://twitter.com/lseathletics/status/1012075171413397506 …
KCSpeedway,3056425175,1,1012110142496804865,5,5.0,Wyffels hybrids 1000 to win sport mods on as scheduled track is good !
VoiceOfIslamUK,3650610317,1,1012107995348652032,5,5.0,#VOIdrivetime pollOf these sports which is your childs most favourite?
Paul5Robbo,347125356,1,1012100555542552576,5,5.0,Lovely evening at @DAOSPEDept Sports Awards always amazing going back there it brings back so many fantastic memories
SimCityBuildIt,2800506649,1,1012096723827605504,5,5.0,Its the summer of sports in SimCity! Celebrate with exclusive new buildings available for a limited time. pic.twitter.com/a9ptwSwDHY
fspielman,1337268391,1,1012095325883064321,5,5.0,Aldermen seek to legalize new sport - pigeon racing(Via Sun-Times) https://chicago.suntimes.com/news/aldermen-seek-to-legalize-new-sport-pigeon-racing/ …
DionDublinsDube,93663135,1,1012088537037115393,5,5.0,It’s the @BBCSport World Cup Highlights  Show tonight live from Red Square in Moscowwith @markchapman and the 140 lady (as I like to call her) @AlexScott @5liveSport @bbc5live #ONNOW!pic.twitter.com/WlbxKSnLRd
STARMedical_01,2813603862,1,1012088330945777664,5,5.0,We are excited to announce our new partnership with @GCAFCofficial for 18-19 season. @chloelees94 is Head Graduate Sports Therapist. We are looking forward to the new season! #STARMedicalWiltspic.twitter.com/gB2vTL6ke9
CopiusGroup,132161953,1,1012082165943799810,5,5.0,Out tonight with @BelfastGiants as part of our @SEUPB @lisburnccc Understanding Cultures Through Sport #peaceIV #crosscommunity #mentoringpic.twitter.com/pxFjlF6gZ5
SophiaHEwing,935009024403296256,1,1012080866909196289,5,5.0,if you’re in sports clubs an officer or anything else just remember what you tweet respresents that organization & our school
nballaccess,1463217606,1,1012078991669387266,5,5.0,Every player other American sports really make poverty money compared to the nba
Deadspin,13213122,1,1007765959464177670,5,5.0,You can’t bet on Rutgers to win the national title: The first day of sports gambling in New Jersey http://deadsp.in/ndm1cYU pic.twitter.com/xVjCx2nDDr
WaseemDaDream,4143523227,1,1007763492575895552,5,5.0,Yall remember when BMR kids thought band was a sport
arabnews,69172612,1,1007763450955694080,5,5.0,Fitness meets fashion as #Saudi designer launches first sports #abaya https://goo.gl/WJsfbC  #SaudiArabia #ArabNewspic.twitter.com/MoWpW9BR1K
FredParvaneh,18341475,1,1007757576505737216,5,5.0,“The games remind him of his late father who shared with his son an abiding love for the sport.” https://twitter.com/fredparvaneh/status/1007757173693091840 …
UCBSportDC,4068121702,1,1007756761422532610,5,5.0,Class @UCB_SPSTT HE Sport Awards Evening tonight. Thanks for all staff and students who attended and congratulations to all the winners. Special thanks to @CoreyHurley98 & @CoachJohnson71 for making it happen. Enjoy the rest of your evenings. All the best. DC and the Sport team.
iluv_sponqebob,4616877918,1,1007754437941710848,5,5.0,Throwing ass in basketball shorts and a sports bra #TPFP2K18
talia_eastwood,726537011444760576,1,1007745391398473728,5,5.0,Hunting is the most vile disgusting “sport” it should be illegal everywhere
TheCryptoMonk,576519811,1,1007729015426297857,5,5.0,Competing against the market requires many training sessions rigorous strategies and a healthy way of living. Thats not far from top-level sport.
pls_spartans,705933922518089728,1,1003416311077265408,5,5.0,Reminder about our FREE Sports Physicals sponsored by @AvitaSports at Pleasant HS on THIS TUESDAY. MS starts at 4 PM and 9-12 from 5-8 PM.pic.twitter.com/IyOJgzM2rV
NBCSCapitals,2319349099,1,1003410766958034944,5,5.0,RIGHT NOWWatch the replay of Washingtons Game 3 Stanley Cup Final win on NBC Sports Washington  pic.twitter.com/P1Ivu5ahr4
TheRealDisco,343549833,1,1003402464161218560,5,5.0,There is a reason guys that used to play the games discuss it on pregame sports shows... as opposed to the guy that won your fantasy league.
coachTRroarty,2740143635,1,1003402366207610880,5,5.0,Football Parent meeting June 5th  Tuesday evening at 630 in cafeteria 1. Players are asked to have a parent or guardian present. @Coloniafootball @SPORTS_CMS @avenelmiddle @AvenelHoops @ColoniaMiddle
lividinij81,2769952630,1,1003398924873490435,5,5.0,Wrestling is by far the hardest most demanding sport there is by far. Don’t tweet at me if you’ve never done or watched it either lol https://twitter.com/_tyrik12/status/1000495965139296260 …
nron10,15173077,1,1003392714417819648,5,5.0,Nothing to see here but a major Star Wars podcast saying its cool to send death threats to a child actor because sports fans do it. https://twitter.com/RebelForceRadio/status/1003326860896489474 …
whs_unified,837406964246269953,1,1003392633404878849,5,5.0,Spring sports awards tomorrow at 6:30 in the auditorium. Dress nice. See you tomorrow!
JasonBelzer,37556052,1,1003389863423594504,5,5.0,Big thanks to @KevinaBlue for helping put this together. An absolute must read for anyone currently working (or interested) in marketing and revenue generation in collegiate sports. https://twitter.com/AD_University/status/1003389325730566144 …
LucyTriesSports,1967926602,1,1003388474844590080,5,5.0,1 of my favourite sports stores is @Unitedsport1928 in #Edmonton #Alberta..More than 30 #sports under one roof AND they are big supporters of @KidSport  #YEG @KSEdmonton @kell_coachpic.twitter.com/KwIuQVgTh4
Champaign_Room,830190378,1,1003385879904374790,5,5.0,Absolute congrats to Purdue Baseball who had maybe the most surprising season of any Big Ten team in any sport this season. https://twitter.com/hammerandrails/status/1003383940625858561 …
MREC4U,1378422974,1,1003383197026193414,5,5.0,Schools OUT for SUMMER! Still looking for summer activities and sport camps for your child? Check out this newsletter with lots to do for all. Dont delay register today! http://ow.ly/Wz7h30kjA15
ADouglasPhotos,1453262671,1,1003381926265098240,5,5.0,#Kamloops may be the Tournament Capital of Canada but theres more here than sports. No matter what your interest youll find it here. #exploreBCpic.twitter.com/jfqmLt9SGx
presidentwagner,2904036094,1,1003379695088488453,5,5.0,Be sure to catch @NTVNEWS at 5:30pm... before you settle in for @cavs and @warriors ... followed by more @NTVNEWS after the game! @NTVAshiaAubrey @ReginaBirdWX and @NTVScott have your news weather and sports covered. #NBAFinals
Henry_Walker24,4580399486,1,1003378592468946945,5,5.0,Anyone wanna start a petition to make gaga ball a Olympic sport
Terry_NRT,72804734,1,1003377428293734406,5,5.0,Look!Staying alive and sane is an extreme sport ok!??
LHSBlueDevils,2155096720,1,1003376305423962119,5,5.0,Congratulations to Coach Anita Murphy who was inducted into Maine Sports Hall of Fame ... much deserved honor for her 40 years of coaching!
PowerGotGame,868346755519320064,1,1003374485377044480,5,5.0,I liked a @YouTube video http://youtu.be/81uEoke3q_g?a  EXPOSING SPORTS TNB FOR SCAMMING SAY GOODBYE  #CLEANTHECOMMUNITY
SportClipsTeam,553025218,1,1013565471663247361,5,5.0,Read about how Gordon Logan started Sport Clips and lead it to become one of Forbes Americas Best Franchises in 2018. https://buff.ly/2lL48FA pic.twitter.com/ogHsOtazga
Sbrad72,438665611,1,1013540056324366343,5,5.0,This is a great blog from Tom (@MidlandMencapUK no 9!) about what being part of a team means to him! Not winning or losing but friendship fun and enjoying a sport! #Flyerz #parahockey @AccessSport @FlyerzHockey @eurohockeyorg @TheHockeyPaper @EHMidlandshttps://twitter.com/midlandmencapuk/status/1013362847102001153 …
IrlEmbCroatia,2790155502,1,1013529210793746432,5,5.0,It was a very good day for #CRO sports. The national basketball team also moved onto the next qualification stage with a win. There are plenty of celebrations here!  https://twitter.com/CbfHks/status/1013476802667470849 …
adrianscustoms,914687732273659904,1,1013528064230223872,5,5.0,This #WorldCup is full of surprises and will keep you entertained till the last minute. Soccer hands down the Best sport in the world. Bringing people and families together
ssprospects,3253098384,1,1013525976419045376,5,5.0,Congratulations to 15u Black on their championship victory in the Diamond Sports All American Classic in STL this weekend! pic.twitter.com/DzsbEtijbs
sickolia_,178007542,1,1013525809926168576,5,5.0,Hamilton shitshow Spain back home Croatia throughToday has been a good day for sports.
PenrithPanthers,30840927,1,1004874193530335232,5,5.0,COMPETITION TIME Win a signed 2018 Panthers jersey thanks to @Classic_Sports  http://bit.ly/SignedJersey18 #pantherpride pic.twitter.com/GyB201X5LB
maggie_buettner,954552539432841216,1,1004874070482186241,5,5.0,Girl’s sports are actually fun to watch. You can’t say you have school spirit and then only go watch the boys https://twitter.com/maxpreps/status/1002618864520196096 …
MARCAinENGLISH,579889059,1,1004870640577466368,5,5.0,The @Forbes rich list is in...For the 50 best paid sports stars in the world. Where do @Cristiano and Messi rank? https://buff.ly/2M0EuIB pic.twitter.com/qqs9PL7K7R
BGISDgaryfields,3254730017,1,1004866125367259136,5,5.0,Great reminder to young athletes that success in high school sports is not determined or defined by anything that happens before high school. Good luck tomorrow @WillGarske #excellenceisworththeefforthttps://twitter.com/bgdailynews/status/1004862088819499010 …
WB_on_TV,867733746459521024,1,1004860588902830080,5,5.0,WBONTVs Sports Director Michael Watkins Talks To Some MCHS Baseball Players - https://wbontv.com/2018/06/07/wbontvs-sports-director-michael-watkins-talks-to-some-mchs-baseball-players/ …pic.twitter.com/91isgMOro6
MsVivicaFox,191504048,1,1004853178376978432,5,5.0,OMG!! Gurl if I wasnt an actress I would definitely be a sports commentator!! LOVES IT!! GO WARRIORS!!  https://twitter.com/Marlatalks/status/1004755398627229698 …
Anna_Kessel,707780618,1,1004853132927684609,5,5.0,Ah wow!! Huge congratulations @martine_wright so happy to see a powerful story about womens sport winning such a prominent category! Great work to you and @SueMott1 https://twitter.com/sportbookawards/status/1004845267244535808 …
BWMcGair03,364614876,1,1004852595947704320,5,5.0,Getting set to jump on 98.5 The Sports Hub to talk about the guy whos making his MLB debut for the #RedSox tonight. From earlier today:https://twitter.com/BWMcGair03/status/1004710143047688192 …
kymstyle7,165167429,1,1004851269276782592,5,5.0,Great day in school with @IrelandLacrosse thanks to Len for introducing the fab sport to all in @HansfieldETNS Great day had by all!!pic.twitter.com/HXxbhuuut7
TheMIAA,57652732,1,1004847361745674240,5,5.0,AWARD ALERT! The MIAA has announced the Academic Awards for the Spring Sports! http://bit.ly/2M1FaO5  #BringYourAGamepic.twitter.com/pslklFJckR
ALL_EN_SPORTS,788879304423714816,1,1004843557226569728,5,5.0,Summer training starts Monday! Open to all sports and ages! For more information contact Justin at (281) 772-7895 or justin@allensportsperformance.com pic.twitter.com/iIicm5nY1J
PAHOWHO_BAH_TCI,2851470723,1,1004842938801647617,5,5.0,Popular ways to be physically active are through dance sports and running. How do you keep active? pic.twitter.com/eOmW98yJWo
stamfordcricket,452845240,1,1004841838359076867,5,5.0,Super sevens draw will take place this Saturday evening (9th June) #stamfordsupersevens @sport_local @thegrainy @Deepingcc @BarnackClub @MoultonHarroxCC @UffordParkCC @UTCC_ @Uff_Cricket @KettonCC1905#over40s
philplaymakers,730957698544631808,1,1004840758455820288,5,5.0,THREAD: A must read on how athletes give of their time money energy and resources. Athletes need to use their platform and do more than just stick to sports #SportsDoingGoodhttps://twitter.com/NFLPA/status/1004818484675653634 …
FlyingEagleBets,925434675086143489,1,1004839248414085126,5,5.0,RT FOR TONIGHTS MLB MAX PLAYS!! #1 HANDICAPPER ALL SPORTS 4-0 SWEEP TONIGHT! #FREEPICKSpic.twitter.com/Kg2nLZKzkW
ForzaJuve2017,799617898847281153,1,1004837895969140737,5,5.0,Joao Cancelo would prefer to join Juventus. [Premium Sport] pic.twitter.com/9RG7XDrGG3
mwoodwardCCT,715233948998176769,1,1004836619428524033,5,5.0,.@jalenstanton6 the @carrollvarsity Boys Outdoor Track Athlete of the Year is our last of eight spring sports photo shoots! #CVTrackpic.twitter.com/U3fVjhE4wp
RBJRON,1601937732,1,1004834081677275137,5,5.0,Hey @SenatorFifield Senator if you give me $30 million I promise to talk and tweet about womens sport and even spend most of the money here and not send it overseas
chappaqua_csd,930541923403788291,1,1004832369025511424,5,5.0,The Horace Greeley High School Strongman Competition is this Saturday June 9th at 3pm. @greeleyfootball @GreeleyStrength @GreeleySports @Quaker_Sports @ExaminerMedia @ChapKiscoPatch @ChappaquaDV @lohudsports @News12WC @FiOS1NewsLHVpic.twitter.com/w6PczAV7ZQ
NickCoit,39071061,6,1003770002103775238,29,4.833333333333333,A LOT of great games to choose from this week! Here are the nominees for @ABC6 Sports Play of the Week. Voting is now OPEN: http://www.abc6.com/story/38345649/abc6-sports-play-of-the-week-nominees-may-28-june-3 …pic.twitter.com/8cuE35Vki6
Nedsfeed,957097344998215680,3,1007734339541577730,14,4.666666666666667,ill provide my own sports knowledge chief run along off the feed
StreetwearFiend,877918273920262144,3,1007772243731144705,14,4.666666666666667,Stussy Sport Nylon Short in Orange is now available to purchase with Free Shipping! BUY HERE: http://bit.ly/2MvQrqb
AllenVaughanDMR,166318986,6,1010622170983227392,28,4.666666666666667,Stage looks beautiful! Soon @Hassel_Chris @MatthewBain_  @Dargan_Southard @JohnNaughton and @codygoodwin will be sharing the stage with Iowa’s best HS athletes for the @DMRegister Sports Awards. #AllIowapic.twitter.com/Srs8afwBuC
WildfireDeal,938888373434974210,10,1007736542708760577,46,4.6,Plantronics BackBeat FIT 500 On-Ear Sport Headphones Wirele  ONLY $79.24   Save 21% today! Click here: https://amzn.to/2LTtOKV @FlyRts@GFXCoach@DNRRTs@Demented_RTs@Mighty_RTs@LaZy_RTs@BlazedCodes@Turbo_RTs@TTurtles_RTs@GamerGrowthHQpic.twitter.com/nLynXuSwta
ADarkLovelyRose,57664141,2,1010646922770690048,9,4.5,It’s crazy how I can’t find s female to do a sports show with. Been seriously looking for over a week and NOTHING. Y’all hoes basic
TheNerveAfrica,863418446,2,1005568422221111296,9,4.5,@WiebeB_Africa: How the coloniser’s tool became Nigeria’s unifying sport https://thenerveafrica.com/19386/football-history-nigeria-wiebe-boer/ … via @TheNerveAfrica
VU_All_Access,2814208911,2,1008822954136875015,9,4.5,God bless Johnny Norwood. The single most clutch play in Vandy Sports history. https://twitter.com/marlinmaniac/status/1008757278294577154 …
FlaHSFootball,110065495,2,1004479023303610368,9,4.5,Congratulations to host school @sports_CHSLC for winning the @FHS7v7A Northwest Regional Qualifier today! #flhsfb @FACACoachpic.twitter.com/q5zcVM2J0D
michaelflorek,186658543,2,1006641861363163136,9,4.5,Fox Sports Southwest to broadcast bigger better Texas Football Days this year http://p.d-news.co/rrmx
Ethan_Booker,19955411,2,1003779381809111040,9,4.5,Trump will continue being owned by jocks until he bans sports altogether.
