user@mention,user_id,No of tweets,tweet_id,retweet_count,local influence score,Tweet
IndianCharlie1,125666734,1,1010657347121885185,20,20.0,A lot of people in the Churchill Downs jocks room and throughout the sport from coast to coast are deeply saddened by the sudden passing of Shantel Lanerie.  She is in Gods hands now and in a better place. But we need to pray for those left behind dealing with this sadness.
orwellguy,287982242,1,1008462841794519041,19,19.0,George Orwell: Serious sport has nothing to do with fair play. It is bound up with hatred jealousy boastfulness disregard of all rules and sadistic pleasure in witnessing violence: in other words it is war minus the shooting.  - The Sporting Spirit Tribune (Dec. 1945)
PitchingNinja,2911095315,1,1005952101258756096,19,19.0,Keone Kela Messing With Timing/Quick Pitch.  Ninja Tip: Quick pitches can be effective. Just be sure there are no runners on base. The dual balk call was a nice touch.  Look for those guys on the US team when Synchronized Umpiring becomes an Olympic Sport. pic.twitter.com/zmpgEtxc8Y
mattlyynch,131501674,1,1011710796106256384,19,19.0,We live in an age where people think money solves others mental wellbeing. It simply doesnt.These comments are infuriating & why the stigma needs breaking especially in sport. Mental Health doesnt discriminate against wealth. Mental health can impact anyone in life. pic.twitter.com/4OJVRNodxS
kcg__,61705587,1,1009576138438467586,19,19.0,I will NEVER understand the pleasure of killing animals for sport.These exotic creatures could potentially go extinct and for what?You flew to THEIR home 1000s miles away just to kill them?For what purpose?Their lives have more value than to be your target practice. Whack asf https://twitter.com/crawfordkacee/status/997652033665683457 …
PeteSampson_,29513470,1,1009937887729766400,19,19.0,Notre Dame picks up its first offensive skill player in this class in three-star back Kyren Williams. Ranked as the nation’s No. 19 back on 247 Sports and No. 343 overall. He’ll likely be the second-highest rated back on the roster in ’19 behind Jafar Armstrong. https://twitter.com/TomLoy247/status/1009934793436516352 …
BulawayoChiefs,973485314663682048,1,1009906130544361474,19,19.0,We got an inbox message from a Ngezi Platnum fan saying Byo Chiefs if you guys are feeling the pain of Messi and Argentina being beaten by Croatia today THEN NOW U KNOW HOW WE FELT WHEN U BEAT USKkk ngama Sports. GOOD nyt football lovers@yvonnemangunda
_pivx,4020178512,1,1008497845253570560,18,18.0,#PIVX + KKS Rawa Katowice - Champions! They won against the current champions of Poland. Now headed to Warsaw to represent the City. Congrats guys! Way to represent the sport and PIVX! #PIVXsports #community #PIVXambassadors https://www.facebook.com/KKSRawa pic.twitter.com/Rh4iMSSRdX
KingsTheBrand,2614583281,1,1008836130647748609,18,18.0,PSA ALL Savage Swimwear and Sport Gear is on preorder right now! To preorder please DM us! You can also place orders on our IG pages @ KingsTheBrand & SavageAngels4Life. “Don’t Be Average Be Savage!” pic.twitter.com/H2ILNe8DHm
notesfrompoland,919246321898401792,2,1013535486445608960,36,18.0,Meir Bulka who lives in an Israeli West Bank settlement is leading an effort to protect or restore former Jewish cemeteries in Poland including one that has been turned into a school sports field with a Hasidic rabbi buried under the centre circle https://www.haaretz.com/world-news/europe/.premium-in-this-polish-city-schoolkids-play-soccer-on-top-of-a-rebbe-s-grave-1.6224381 …
_HelenHollywood,1559783886,1,1012099187914301440,18,18.0,A couple little Explores today.... here’s some shots from this beautiful overgrown graveyard  #exploring #abandonedplaces #graveyard #nature #photography #church #portrait #england #youtuber #vlogging #OOTD #sports #fashionpic.twitter.com/YidccdcI6v
SufferBall,1017383114405015552,1,1012093192639049733,18,18.0,NEW INFO ON SARRI TO CHELSEA ; On the first of July by registering Ancelotti Napoli will free Sarri but the right day to see the coach at Stamford Bridge can be even earlier on Friday concludes the colleague. (A.P via Sport Italia) #cfc @AlfredoPedulla
YordenisUgas,487283932,1,1004862619696558080,18,18.0,Yesterday I went to greet my friend @budcrawford402 We fought 10 years ago and I always knew that this guy had something special. Im not wrong hes a great champion and hes among the best pound for pound sport. He makes his debut at 147 becoming champion. Bless Champ! pic.twitter.com/HzGg3Wv1dz
FCBarcelonaFl,130154420,6,1007727675614683136,106,17.666666666666668,Inter Milan are interested in signing Barça player Aleix Vidal this summer. Inter want to negotiate a loan deal with a buy option and would be ready to pay 10 million euros in the future [la gazzetta dello sport]
andrew_ruscoe,1583415068,1,1002680396327383043,17,17.0,PLEASE RT  NEWFA 5S LEAGUE ! ~ Pleased to announce that the NEWFA Adult 5 a Side Sunday League is starting June 24th at @WrexhamFL Clywedog Sports ComplexTo get hold of an Application form please contact Paul Hooson on 07718049098 or via E-mail on Hooson9@aol.com pic.twitter.com/Z5xxbA92jl
GracelandU_MBB,991736759296905224,1,1007022389723652099,17,17.0,This time featured in #YellowJacketCommits is Thomas Conn. Thomas joins us from Underwood HS in SW Iowa where he was a multi-sport athlete & a multi-year All-Conference performer in basketball. Thomas is a great athlete who will bring a lot to the table in the coming years. pic.twitter.com/7vkdBVVsRI
TheNavajoNinja,181718043,1,1006686988999806976,17,17.0,Youth Sports &  Wellness Camp FREE for ages 7-18 years old. I am setting up a kids ninja course for this camp happening Shiprock NM. #impactshiprock2018 #impactshiprock #navajo #nativeamerican #nativeyouth #NavajoNation #diné #NavajoReservationpic.twitter.com/qkEr1sJnqA
Morgan_Swoboda,961524204,1,1011757802329657344,17,17.0,Why are sports bras with removable pads even a thing?? And also why are they advertised as a plus?“LOOK! Removable pads!”No girl in the history of like ever has preferred removable pads.
dev9t9ok,951563980702699520,1,1010667956114731018,17,17.0,#WorldCupWithSeele Seele isnt just a blockchain its the blockchain of the Next Generation 4.0! Seele will become the leader in the industry as the same as Football is the most popular and best sport on our planet! @SeeleTech https://seele.pro/  #Seelepic.twitter.com/vWB47S9uXO
DRFLivingston,1278867548,1,1012080584145768448,17,17.0,One of our sports greatest broodmares - the remarkable and unique TOUSSAUD at @JuddmonteFarms in 2003 with her first goat friend Liz.  Information about Toussaud as a race and broodmare in a 2009 DRF article about her passing: http://www.drf.com/news/toussaud-dam-four-grade-1-winners-dies …pic.twitter.com/RTqOWxrOn0
NevilleSouthall,264129295,1,1003374420596060161,17,17.0,Asha from @_socialdrone when i took up boxing instead of self harming it became my outlet! I was getting out my frustration and anger i felt. Instead of picking up blades i picked up my boxing gloves. What sports would you guys recommend for alteratives? pic.twitter.com/9lZWRwwWRR
Tiger_Balm_US,152405875,1,1013571213677989888,17,17.0,When you need more Balm - look for Tiger Balm Ultra in the same economically-sized 1.7 oz. tin used by massage therapists chiropractors sports trainers sports teams across the country. #TigerBalm #PainRelief #RoarBack pic.twitter.com/Vso3CVDYvx
BoogSciambi,82225170,1,1002673204933091328,16,16.0,I love sports but narratives can get stupid at times. Let’s be clear: The Cavs probability of winning that game was affected FAR more by George Hill than by JR Smith as dumb as that play was. Kill Chris Webber all ya want...they were LOSING.I guess creating goats is part of it..
MostafaMe4,2343557479,2,1007733108307873792,31,15.5,#IranLets remember the captain of the Iranian national footbal team Martyr Habib Khabiri executed on June 31 just for suporting #PMOIThe #champion not only in sports but also in resistance#WorldCup #WorldCupRussia2018 #ايران #جام_جهانی @emilia_suze @JeanieVisionpic.twitter.com/e0LdUrcCX4
Mac734Man,2923106378,1,1008479564308213760,15,15.0,#tessthompsontalley Example of the stupidity of our species.Only humans kill for sportor for trophies. Only humans kill just because they can. At a time when the world grieves that ONE HALF of all #wildlife remaining on this planet is GONE!Vacuous acts like this?UNFORGIVABLE!https://twitter.com/IndivisibleNet/status/1008435083223576576 …
cjponyparts,89528523,1,1007044078301827073,15,15.0,Have you heard about the new #2019GT350 updates? Recalibrated MagneRide Suspension revised 19 wheels sticky Pilot Sport Cup 2 tires a new spoiler with optional Gurney flap and much more!RT if you want one in your driveway!GT350 vs GT500 --> https://cjpony.parts/2LJDJTp pic.twitter.com/h2T1pAVKDl
KCJHoop,17106279,1,1004490918836269057,15,15.0,Deep in this story is info on Michael Porter Jr. and his medicals from Porters father. Porter Jr. has been based in Chicago where his agency Priority Sports is located. https://twitter.com/Dave_Matter/status/1004482944222810112 …
EdLatimore,459692778,1,1006679383946465285,15,15.0,This means you dont REALLY have to solve problems. Only distract people from them and they will pay you a handsome sum. Repeatedly.The entertainment industry is built on this concept. So are sports.This is why anthem protest got axed. They REMINDED people of problems.
Trojanpak_2019,1658422242,1,1006636495132905473,15,15.0,Dear class of 2018...PEACE OUT y’all will be missed but #thelegacycontinues and it’s time to show the valley how it’s really done Waddup 2019’s Everyone showin out to every game this year fall sports already grindin bouta catch a #7peat #watchout #soon2b7 #19’s
webfashioner,60297891,1,1010655120894386178,15,15.0,US Immigration is in chaos thanks to Donald Trump. Thyre detaining immigrants who follow the rules & present themselves at points of entry. FOX lies & now Sinclair poses a danger to the average Joe who watches local news sports & weather.Interment camphttps://www.politico.com/story/2018/06/20/immigration-asylum-seekers-zero-tolerance-641181 …
ReadMoreBible,2353221863,1,1012823885912342529,15,15.0,Entertaining people in church DOES NOT WORK!Entertainment gets BORING & people will move along back to their Netflix & Sports.Church needs to FOCUS like a laser beam on Jesus. He said ”learn of me.”Helping people to LEARN through #scripture about Christ NEVER gets boring.
howcomeyousmell,33433773,1,1012098183613296640,15,15.0,Idk why dudes dont believe Terry Crews. A lot of times dudes grope each other and play it off as a joke... If youve been on sports teams theres a good chance youve seen this in some form. In his case this was a dude in a position of power over him
NadiaSinghNews,1594615184,1,1012075789481889792,15,15.0,It’s the first Blind Soccer Development camp in the US!  The Maryland School For The Blind is playing host to players and coaches from all over the world to foster the athletic spirit and show that sports is for everyone to enjoy. @WMAR2Newspic.twitter.com/TEWtCGSYUe – at The Maryland School For The Blind
bet365,221769011,1,1003394749812953092,15,15.0,6 days until Englands tour of South Africa. 11 days until World Cup 2018. 17 days until Royal Ascot. 30 days until Wimbledon. 36 days until British GP. 47 days until The Open. 60 days until England vs India. Summer of sport. pic.twitter.com/Cx8KXoZiqS
WillStewNeuro,2432455896,1,1004843872105717760,15,15.0,This is pretty poor. Rugby folk @BBCSport now pretty well informed but seems some football pundits and commentators missed #concussion messageNo pressure to resolve. Not like theres major tournie round corner where ill informed comment might do some harmhttps://twitter.com/5liveSport/status/1004435002090668032 …
WrstleLikeAGirl,729490042385633280,1,1008486161235537924,14,14.0,Wow wow wow Wrestle Like a Girl has put on 3 different camps back & forth between states in a matter of 10 days! We  wrestling we  educating on nutrition/sports psychology & most importantly we  empowering young females to become our future leaders!  pic.twitter.com/VUApfEi73L
CoachWertz12,1008013032,1,1004502817418117120,14,14.0,Bay City HS is looking for Varsity Coaches we currently need a WR DB and DL coaches. Various 2nd sport options available as well!!! Teaching fields include Math Science English. No PE SPED or Health. Send a DM if interested / email resume to pmatthews@baycityisd.org https://twitter.com/coachwertz12/status/1001559641388736512 …
KyleRancourt,121894713,1,1006667015862431744,14,14.0,Nelson Cruz is having his worst season as a Mariner and still sports a wRC+ of 143. he also has the highest career wRC+ in team history. yes better than Griffey ARod Edgar etc.however much you think you appreciate him I assure you it is not enough
KellyLevenda,2646238117,1,1006658157433802752,14,14.0,The idea that killing an #animal benefits her #species is absurd. Comment on permits submitted by canned #hunting ranches that import or breed #endangered & other #animals for the purpose of killing them for sport: https://buff.ly/2FsGoOq  #wildlifepic.twitter.com/h87oEZcofd
NorthTexan,28860427,1,1011738398233649152,14,14.0,#UNTalum Joe Greene will continue his support of #UNT this Friday with the Nibble & Mingle Fundraiser benefiting the Agnes Lucille Craft Greene Memorial Scholarship. Get tickets for the event that boasts sports icons and amazing culinary creations. https://bit.ly/2tdAVXH pic.twitter.com/jSle3F293C
JohnMcCarthyMMA,788197512,2,1011013354746331136,28,14.0,There are differences between the two. Both are MMA promotions. The UFC has the largest roster of fighters in MMA. Bellator allows fighters to compete in other combative sports like Boxing & Kickboxing . Bellator allows sponsors while the UFC regulates Reebok pay #AskBJMhttps://twitter.com/chandlerhilton/status/1011001559474491392 …
garylfrancione,43660789,1,1012831016988303360,14,14.0,Is it morally reprehensible that #TessThompsonTalley killed this giraffe? Sure. But there is no difference between killing for sport and killing for palate pleasure--no difference between the giraffe and a chicken. If youre upset but youre not #vegan change that.pic.twitter.com/tI7dDFIuL7
FanSince09,231504942,1,1012803588907675648,14,14.0,It’s not even a stretch to believe that that this could be the landscape of Philadelphia sports in 2019:Lebron JamesCarson WentzManny MachadoBryce HarperBen Simmons Joel EmbiidKawhi LeonardWhoever is good at hockey I don’t know.
CoachFerrell1,337812163,1,1012117410906853376,14,14.0,Brazosport HS (Texas - 4A) has a varsity Asst football defensive position available: DB or OLB (3-4) plus2nd Sport.Tx Teacher Cert required: Teen Leadership or Math are available. We have excellent facilities and excellent pay. Send resume to Michael.ferrell@brazosportisd.net
JT_Evans97,775465804708081664,1,1012110239712325632,14,14.0,Miami Dolphins 2 super bowlsMiami Heat3 NBA Titles Miami hurricanes 21 champions (9 in baseball and football)Miami Marlins 2 world series title Miami is a bad sports town
da13thsun,49503851,1,1007768358182408192,14,14.0,I know dudes scared of prison & will do county time.Th County is like a concentration camp & prison is like real life to stimulate your minds with law library Religious library music sports exercises everything to make you better if you utilize whats there.
DennisGucci,306123365,1,1007727404754833408,14,14.0,@OtiAdjei  is correct @Cristiano  isnt the first to score in 8 major championship Ghanas @ASAMOAH_GYAN3  has scored in 9 2006 World Cup2008 Afcon2010 Afcon2010 World Cup2012 Afcon2013 Afcon2014 World Cup2015 Afcon 2017 Afcon@MailSport @ESPNFC @BBCSport @FIFAWorldCup
numbrrzz,551385464,1,1003409579143770113,14,14.0,Just shook hands with Doug Ford in Oshawa and the Golden Arches-I asked him if he got his sport jacket at Holt Renfrew- “I’m a Walmart guy”- he answered union members question bluntly- he is more impressive in person- no handlers “protecting” him either- Doug is what Ont needs
CoinWithHeart,960612705936793600,1,1007049477017014272,13,13.0,#Chrysalis Coin is a new breed of token using blockchain technology and leading the way to a new kind of #fundraising.Chrysalis goal is to Empower #youth sports so that no-one sits on the sidelines because of a disability.#cryptocurrency #ERC20 #fundraising #bitcoin #charitypic.twitter.com/cHBuoXSeLg
zoecoronaa,979443055,1,1005961562547474432,13,13.0,the first day of band camp people throw up on the side of the practice field we practice a whole month in the summer we work 8 and 12 hour says. We work almost everyday during comp szn we leave @ 3am for comps preform in hot Uni’s then come back at 12am. I think its a sport https://twitter.com/maxpreps/status/1002618864520196096 …
imaplayerus,817497326906441728,1,1005905873779154944,13,13.0,Retweeted Jaeger Sports (@jaegersports):If I can throw it 200 ft I try to throw it 300 ft.  I dont stop at 120 feet -- I throw it as far as I can.Greg MadduxLong Toss Also = #FEEL
the_hindu,20751449,1,1004505758568939520,13,13.0,Virat Kohli joined the likes of Sachin Tendulkar Cristiano Ronaldo Lionel Messi and Usain Bolt in the sports zone of the Madame Tussauds Wax Museum. #ViratKohlihttps://trib.al/WY6zfcI
ProctorRails,2420737915,1,1006636154345721858,13,13.0,Proctor Public Schools is teaming up with @StLukesDuluth to name the school’s new sports and event center in a 10-year $300000 agreement. In addition St. Lukes will be providing Proctor Public Schools with athletic training and overseeing the Fitness Center. #RailStrongpic.twitter.com/utELPBOXkf
ukshaolintemple,135435627,1,1008824162717224961,13,13.0,Check out this kick great height. Can you kick this high? .#highkick #highkicks #kicks #taekwondo #karate #taekwondokick #karatekick #martialarts #sports #wushu #koreamartialartspic.twitter.com/Sci53tt7yZ
RetroNewsNow,2377703834,1,1010624571039473664,13,13.0,On June 23 1972 President Richard Nixon signed into law the Higher Education Act which included the groundbreaking Title IX legislation barring discrimination based on sex in higher education programs including funding for sports & other extracurricular activities pic.twitter.com/pRgdhGd59c
ShaneNPhillips,446732725,1,1010982440234516481,13,13.0,Things you love the most make you hurt the most. Our sport can be glorious in one breath and utterly heartbreaking in the next. So chase those glorious moments like the Ragin Cajun did with a dogged determination an open heart and a big smile. Godspeed Jason. pic.twitter.com/pEzndEAhhf
greennomad61,2651368746,3,1007747727202115584,38,12.666666666666666,I just supported #TheInglorious12th  on .@ThunderclapIt // .@WildeAboutBirds Please join me http://thndr.me/NRexZW   12th August will echo with the sound of gunshots as the #grouse shooting starts. Thousands of Red Grouse will be shot for sport#BanHunting #UK
Cyclo_2k,3394663480,2,1003762931681693699,25,12.5,Sports got his mom involved and they sent this whole email lying and accusing me to my mom when all I did was expose the scamming. Someone had to take a stand. This is sad and it got escalated.....might have to end it all tonight. Someone has to stand up. Say goodbye
fcsavibes,125260779,1,1002679462499151872,12,12.0,June is National Caribbean American Heritage Month People of the Caribbean have contributed and continue to influence the heritage of the U.S. through culture education sports leadership & business. We will celebrate this month to recognize the important contributions. pic.twitter.com/E2WKxopKZE
bufnewspreptalk,69709297,1,1007044597288194049,12,12.0,With the high school sports season done for the 2017-18 here is a roll call of state champions from WNY in the New York State Public High School Athletic Association the Catholic High School Association and New York State Federation. #preptalklive http://bit.ly/2t7Qhfy pic.twitter.com/iPggxEA0Qy
LFCknowledge,92574521,1,1005592450965147648,12,12.0,It is my understanding the deal has not fallen down because Liverpool tried to renegotiate the terms of the deal. Liverpool did not attempt suggest or offer to renegotiate any terms for Fekir. (Phil McNulty BBC Sports chief football writer)
EnjoyInterNews,931940660,1,1005577968226308097,12,12.0,RMC Sport: #Juventus #Napoli #Roma and #Inter could well show interest in #Fekir after #Lyon released a statement terminating negotiations with #Liverpool. The player had a medical with Liverpool but the talks had been “definitively terminated at 20.00.”pic.twitter.com/jIm0RpiKMD
AlexKennedyNBA,23065057,1,1005559098929278983,12,12.0,Instead of going from site to site looking for 2018 NBA mock drafts just read this one article! @HoopsHypes aggregate mock draft averages out where each prospect is projected to go based on mocks from ESPN NBADraftnet The Ringer SI and CBS Sports: https://hoopshype.com/2018/06/06/nba-mock-draft-consensu-big-board-luka-doncic/ …
airmax_power,808528151458566145,2,1012834731916963840,24,12.0,20 days on Twitter 1K followers now is time for 2 weeks off  #vacation #socks #gay #fetish #kink #dirtysocks #Nike #NikeTuned #TN #sweatysocks #sport #fitness #muscles #Adidas #shorts #feet #fitness #bottomboy #gym #workout #soccerpic.twitter.com/b4J2hRauuB
Rama4des,917046796387528704,1,1009563954803191809,12,12.0,#Portugal 1:0 #Morocco | World Cup | Group B | Day 2 | Goal #Ronaldo 4 .. Follow @RAMA4DES for more •No copyright intended #rama4des #rama4goal #Sport #football #soccer #goals #goal #futbal #worldcup #cristianoronaldo #cristianopic.twitter.com/C6ynV6In8n
vlazlo2020,814510248316833792,1,1003778689153359872,12,12.0,Keywords: They disagree with their President because he insists ...Notice this is a Statement from the President. Not the usual Statement from the White House.The issue here is much bigger than who has greater claim on sports fans sympathies. Its about dictatorial power
yuzuspiration,969029913016655873,1,1012841998317912064,12,12.0,#LRTTracy had asked Yuzuru why he wanted 4Lo and all possible quads in H&Ls layout and Yuzu replied he wanted to push himself & the sport. At the press conference immediately after he broke his own record (again) Yuzu was talking about 4A and Quints.http://www.insideskating.net/2017/08/21/features/dearly-beloved-we-are-gathered-here-to-experience-yuzuru-hanyus-greatness …pic.twitter.com/loEOMxRCeh
Lowskii13,781866681547235328,1,1012108797907697666,12,12.0,#WhosWhoatVStateWhat up doe!It’s ya boy Lowski I’m a Junior at VSU majoring in Business Marketing with a minor in Mass Media. I play and ref almost all the sports for intramural. If you need something I’m your guy I got access to almost anything you may need so get at me! pic.twitter.com/icOFD2hweG
TheNightGallery,190403384,1,1003380805832454152,12,12.0,Sports item circa 1974: Battling Maxo accompanied by his manager and handler arrives in Maynard Kansas for a scheduled 6-round bout. #ZoneIntros #S5E2 Steel -- starring Lee Marvin and written by Richard Mathesonpic.twitter.com/78INDhDe2z
StevenKelsey13,954369255633539072,4,1003387815957336064,47,11.75,Lol MJ played college ball that doesnt count as wear and tear? and i wont debate with you about offense LBJ is playing unbelievable on the offensive side of the ball but the dude is playing little to no defense basketball is a 2-way sport LBJ plays 1-way MJ 2-way
ACMilanSydney,349395807,3,1003390804730114048,35,11.666666666666666,Manuele Baiocchini on Sky Sport 24: The market goes on Rodriguez could leave 15m his value. He’s liked in Germany Milan could replace him with Strinic but even with Biraghi who is really liked by Gattuso. Fiorentina paid 2m € now worth a lot more because of a good season.
TokenStars,887238931863003137,14,1013551138006798336,157,11.214285714285714,Two 1/8 games two penalty shootouts on #WorldCup today! Did you guess #SPARUS and #CRODEN results right on TokenStars?   Try our Sports Predictions Bot predict the results and win huge prizes: 3 iPhoneX and 40000+ TEAM tokens. https://goo.gl/F2y6GF pic.twitter.com/9X9I8MFqQ8
AlanZionist,858686316,1,1005561375194800128,11,11.0,As far as the intolerance of the #BDS can go and foul the fair play of the sportStop trash #BDS #FIFA #AFA #Sport #Argentina #LionelMessi #Soccer #Football #Terrorism #Hamaspic.twitter.com/CuztW9KUc9
TRXtraining,24395545,1,1004468155706757120,11,11.0,“TRX & Halo Sport are made for each other.” - Olympian @itskimglassCheck out the blog to learn how combining @HaloNeuro + TRX can lead to incredible results + find out how you can SAVE $315  http://bit.ly/TRX-hs #TRX #SuspensionTrainer #Made2Movepic.twitter.com/54Zh3iXMK9
CivvyKarla,785171743031848960,1,1009909785041481733,11,11.0,Right troops off to bed. Dates for the #veteran sea camp are set at 8/9 Sept it’s a weekend. It’s free to Veterans. Anyone who needs a break from the norm. It’s in West Kirby. No kit needed no cost. Just banter sport and the sea.  Night All pic.twitter.com/ko5GfTksru
leegartner,494448069,1,1003778759420334081,11,11.0,After decades of feeling shame anger humiliation isolation fear...These four incredible woman now feel BRAVE STRONG PROUD COURAGEOUS & UNITED!  Their message & mission:“Sport must be free of abuse...physical abuse and psychological abuse...”#AbuseFreeSporthttps://twitter.com/cbcolympics/status/1003703487069376513 …
spectatemadrid,954204422300667904,2,1007738062493900801,22,11.0,OFFICIAL: The technical staff team for next season:- Julen Lopetegui (Head)- Luis Lloris (Goalkeeping)- Antonio Pintus (Fitness)- Javier Mallo (Fitness)- José Carlos García Parales (Sports Therapist) pic.twitter.com/mqr1TRZUyH
