user@mention,user_id,No of tweets,tweet_id,retweet_count,local influence score,Tweet
mlshkr,2162376077,1,1004489797648375808,5391,5391.0,i miss high school events la like teachers day sports day the merdeka celebrations and the jamuan all. it’s all the tiny things that suddenly brings back all these memories man :(
seothot,852945732059398148,1,1007044328756334592,2665,2665.0,johnny has the perfect body and could literally pull off any fit yet he chooses to dress like a white dad named david that thinks golf is an extreme sport and y’all wonder why i hate men
CalvinKlein,18647765,1,1011000184896217095,1331,1331.0,.@Harry_Styles sports a matching #CALVINKLEIN #205W39NYC jacket and uniform pant with red and white stripe on stage in Atlanta.pic.twitter.com/my2V47nnTH
AsteadWesley,362111287,1,1003782769544179712,1136,1136.0,Important to note that in other sports like baseball or NASCAR or the Olympics Trump has welcomed champions without incident. Its basketball and football Americas sports with most prominent black athletes and fanbases which have been target of this administrations ire https://twitter.com/kylegriffin1/status/1003781073292185600 …
OU_Athletics,26304266,1,1004500226416218113,554,554.0,#Sooners selected in the top  of their sports’ respective pro drafts.And we’re not done yet!#OneOklahoma #BoomerSoonerpic.twitter.com/U7gzmNnfr2
billwurtz,289853473,1,1007749577968152576,513,513.0,in sports there is a 2 point penalty for impersonating the refereeso if youre gonna do it make sure you give yourself 3 points or more. maybe even give the ref a penalty too
ejarquiza,885389110583721984,1,1003745224328470531,464,464.0,“You play any sports?”I’m in varsity jumping to conclusions overthinking and hiding my emotions. County champ for all three :)
SarahSpain,18494981,3,1003780711785160706,1166,388.6666666666667,If you often find yourself saying stick to sports or complaining that you dont want politics in your sports be assured that the White House removing all of the sports from a sports celebration and turning it into a show of patriotism is as political as it gets. https://twitter.com/RapSheet/status/1003775663558422529 …
MessiWorId,3073024118,1,1008482963695308801,386,386.0,Nobody blaming Neymar for Brazils 1-1 draw because its a team sport. But yesterday it was all Messis fault even though he was miles better than any other player on the pitch.
NateSilver538,16017475,1,1003783667074756608,383,383.0,Hard to think of anyone who would formulate a better contrast with Trump than an old white business dude who once ran a professional sports team into the ground. https://twitter.com/andrewrsorkin/status/1003731882196983809 …
NBATV,25319414,1,1012831246756524034,340,340.0,Reports: Los Angeles Lakers guard Lonzo Ball has torn meniscus in left knee. (via Yahoo Sports) https://on.nba.com/2KlOpeM pic.twitter.com/OQ5NXkNobb
HeymanHustle,23089228,1,1012806459053215744,331,331.0,I am very happy for the @nyknicks @TheGarden and the City of #NewYork! The CENTER OF ATTENTION The TURKISH DELIGHT @Enes_Kanter is sticking around for a while and #NYC is a better sports town because of this development! Hey its a good day to be a #PaulHeymanGuy!https://twitter.com/Enes_Kanter/status/1012745048503541760 …
brfootball,1561123663,1,1009561297057386498,323,323.0,Manchester City have agreed an initial £43m fee to sign Napoli midfielder Jorginho according to @guardian_sport pic.twitter.com/jEvRW972Nw
JuddApatow,88749392,1,1009562384258617344,301,301.0,Now would be the time to cut the montage of how @FoxNews said he couldn’t fix it and then said he could when he made an adjustment.  They are not journalists they are propaganda.    They lie for and with him as a BUSINESS CHOICE.  And they own Fox TV and movies and sports. https://twitter.com/thenation/status/1009559757236133889 …
STATSports1,1002006327273672705,1,1007028856614801408,298,298.0,XBOX ONE GIVEAWAY SUMMER 2018!! It’s as easy as it gets to ENTER!!Follow me (@STATSports1) Like and RT- that’s it!!@Sports22384807 @Sports_Maniac7 @TheSportsTrain#Giveaway #Giveaways #GiveawayAlertpic.twitter.com/oGR5bi90Ae
sarcasticmommy4,2349042853,1,1013564225006911488,276,276.0,If you withstand 100+ degree heat to watch your child play a sport you’re automatically going to heaven. It’s in the Bible.
XplodingUnicorn,780104972,1,1009556610413449223,244,244.0,8-year-old: *gets back from watching a baseball game*Me: How was it?8: There were bases. And a ball.Im raising a sports reporter.
JeanieBuss,34862549,1,1012113810226741248,244,244.0,Best Commissioner in sports. Great leader with vision and integrity and an even greater human being. #AdamSilver #NBA #Commissionerhttps://twitter.com/sportscenter/status/1012075427333050368 … – at Los Angeles Lakers Training Facility
kathy0brien,2838441566,1,1007019321514700800,243,243.0,Many students are working part-time are committed to sports and are staying up extra hours to maintain academic excellence. As teachers we need to be mindful of just how much they are taxed (especially at this time of the year). Be flexible be compassionate and be kind.
MechelleV,25593665,2,1007044385941401600,483,241.5,A truly tragic day in womens basketball: legendary player and coach Anne Donovan has passed away at age 56 from heart failure. Devastating news. A wonderful person and so important in womens sports.
MeghanEMurphy,285916664,1,1007033081222463488,240,240.0,Male are taking over girls sports. This is so unfair. Women had to fight to ensure girls had their own athletic programs in school and that right is disappearing very quickly thanks to gender identity. Can we see why feminists are concerned? http://www.wtnh.com/news/connecticut/transgender-track-stars-win-state-championship-ignite-debate-over-rules/1235044455 …
DeadlineDayLive,1030711922,2,1006645063265312769,472,236.0,Roma midfielder Radja Nainggolan is an Inter Milan transfer target for £30m. (Source: Gazzetta Dello Sport) pic.twitter.com/zIeDMw8EmA
PhilBowermaster,17422708,1,1005585595584806913,234,234.0,Heres our chat with Dr. Dave Schrader from Teradata University Network about how the world of sports like the real world is increasingly made out of data. #worldtransformedhttps://youtu.be/-sgdrBvH6zI
MarkBermanFox26,78515008,1,1003741064824590349,198,198.0,Earl Campbell honored with his spot on the Houston Sports Hall of Fames Walk of Fame: Now I really have a place to bring my grandkids to and show them I really was a football player in Houston. pic.twitter.com/BUaVKGVtRX
USL,38580532,1,1004486339109310470,161,161.0,We are thrilled to welcome New Mexico to the USL family and strengthen the sport of soccer in the Southwest.@USLNewMexico joins #USL for the 2019 season.https://uslsc.cr/2HqeoLE
FawazAlshreef,412165629,1,1008489517546983424,148,148.0,Sports and politics have different platforms which should not be collaborating when it comes to stadium and when we discuss fairplay#FIFa seems like neglecting it!Money against values again !#SportWithoutPolitics#عريضة_رياضة_بلا_سياسة
_marriiaaa_,1301811049,1,1005564193481764864,139,139.0,And that’s a wrap -Graduated valedictorian-4.7+ gpa-Headed to UCLA w/ no loans-Proud immigrant -Member of NHSAnti-Bullying Club Link CrewInteractHospiceChristian Club CSF-300+ volunteer hours-Have a job-Played sports-Won a carAnd it’s all for my mom & dad pic.twitter.com/5cUH7D5TjL
amahnke,14519030,1,1005923291037564928,135,135.0,Every day I’m less and less hopeful that Marty McFly is going to be able to steal back the Grays Sports Almanac from young Trump before it’s too late.
SpiderlingTom,603194204,1,1007042863614447616,133,133.0,this bitch really made golf look like the hottest sport out there whom the fuck ??? also that ass? baby gettin thicc! pic.twitter.com/rHUbj6PMnT
Terroriser,296124687,1,1008845113605251072,128,128.0,One thing about this World Cup that really frustrates me is noticing how easily players will go down for ANY contact. The sport is being ruined. The referees even make it worse by allowing it happen.
MESSI0o,813687730286788608,1,1003399426734481410,123,123.0,Thierry Henry: “Every football player is in Messi’s shadow. To escape it choose another sport. pic.twitter.com/QKbn2FI2l2
JamieLittleTV,103053196,1,1013535388600815616,122,122.0,Kyle does the cry baby motion to the camera acknowledging all of the boos. Got to love someone who is true to himself win or lose. He’s good for this sport.
liam_twomey,74756626,1,1009914152025034753,121,121.0,The worst thing about the Messi vs Ronaldo debate is it places no value on the wider context. Football is a team sport. When one has more *team* success than the other it’s generally because they’ve had better conditions to succeed
Rahulrautwrites,2347122337,1,1006684761132228608,116,116.0,The Dream That United Our Nation... Presenting the official poster of @akshaykumars this Independence day release #Gold. Directed by @kagtireema and produced by @ritesh_sid & @FarOutAkhtar the sports drama also stars @Roymouni Vineet Kumar Singh @kapoorkkunal & @TheAmitSadh.pic.twitter.com/XNYoDXuWSv
Kurt_Voigt_AP,66727310,1,1008491697578397703,111,111.0,The rest of the country just can’t possibly understand how badly Arkansas’ collective sports psyche needs something good like this. It’s been a rough few years in Fayetteville.
Kasparov63,449588356,1,1003787638883708928,111,111.0,Also very good. As I wrote about Putin’s exploitation of Sochi and this World Cup leaders say “it’s just sports” when using them as publicity platforms for their politics. https://twitter.com/SarahSpain/status/1003780711785160706 …
DiIlatronic,933557720552296448,1,1002676363541786624,106,106.0,Gabriel Jesus is ridiculously underrated and if all you think he does is stand in the box and wait for tap ins the sport isn’t for you https://twitter.com/sidelinescouted/status/1002593953970040832 …
timelesssports_,784419106242125825,1,1003777759796133889,101,101.0,(1982) Rest In Peace to Dwight Clark who passed away after a battle with ALS. The Catch is truly a timeless moment in sports history that will never be forgotten.  pic.twitter.com/GlSx5yXPNb
cunlade,889136322572636160,1,1007738113299550208,101,101.0,Lmao imagine wanting the sport you love that is under appreciated to not get exposure especially during its biggest stage. Stop playing gatekeeper you fucking bozos. https://twitter.com/dedicatedto_mj/status/1007710897022885889 …
AnythingLFC_,881821981397704704,1,1012821474644766721,96,96.0,| Sky Sports journalist and French football expert Jonathan Johnson on Fekir: “I think Fekir will sign for Liverpool.” pic.twitter.com/UrjEebogbx
tancredipalmeri,167704836,1,1012825251598819328,94,94.0,BOOM! Chelsea saw rejected an offer for Alisson for 60m€ according to Corriere dello Sport
AllistairMcCaw,112225755,1,1003401320424931329,94,94.0,Athletes; having the game skills might get you far in a sport but If you want to go far in life then learn to be respectful mannered humble and appreciative.
Lexus,48497136,1,1011720604326793216,91,91.0,Roses are red violets are blue fall in love with the new #LexusES and #LexusES F SPORT. @TerraneaResort https://lexus.us/2KkGVEJ pic.twitter.com/8C23z9XXej
hibikekazenouta,2670615512,2,1010619281153851394,179,89.5,Tamen de Gushi-Webtoon-Sports girl meets a cute girl in the bus stop and tries her best to try to get closer to her.-Slow build lovely supporting cast funny and beautiful art. pic.twitter.com/SMNFc3mNB4
FIFAWorldCup,138372303,1,1009564048784936962,88,88.0,STAY TUNED: #FRA vs #PER with @piresrobert7!Join the Hisense Sports Live Stream Thursday 21 June 16:30 CET. Incredible prizes Incredible show! Watch here: http://bit.ly/Hisensesports #seetheincrediblepic.twitter.com/X2vSzu7v8K
MalcolmJarod,462090844,1,1002696703697408000,87,87.0,.@kobebryant I appreciate you. Such a huge inspiration to me. Dream come true meeting/talking sports and storytelling with you this is icing on the cake. Thank you #MambaMentality #keepreadinghttps://twitter.com/kobebryant/status/1002692872309637120 …
Ricardo__713,2529226836,1,1007731151065059328,86,86.0,If you don’t like soccer don’t say anything bad just shut the fuck up. We get the World Cup for 1 month only every 4 years. We gonna be tweeting until July 15th. Deal with it or mute tweets. Don’t talk down on the sport.
MLW,21019252,1,1011720414488420353,85,85.0,BREAKING NEWS: JULY 19TH BATTLE RIOT EVENT IN NYC TO AIR AS MLWS FIRST PRIME TIME SPECIAL ON Bein Sports. https://www.si.com/wrestling/2018/06/26/major-league-wrestling-bein-sports-network-special-july …
OdemwingieP,240869466,1,1007743507052879873,84,84.0,Great to be a guest on Russian Match tv with an Olympic champion A Borodyuk and a top top sports commentator D Guberniev.  Thanks Mr Ronaldo for giving us Something to talk about! pic.twitter.com/iRFRVHhWgK
ThoroInsider,4068690076,2,1005585482464595974,166,83.0,Justify has immortalized his name in the history books forever as America’s 13th Triple Crown winner & one of the great athletes in sports history. ...He is so worthy. pic.twitter.com/8aBfkqYEAW
DMReporter,194732581,1,1005913247726350336,83,83.0,SPORT: My god there are some fragile and damaged people haunting the comments section at Mail Online. Take for example these reactions to the news that women will be commentating on some World Cup matches. pic.twitter.com/rHTvQs3w4o
NewYorker,14677919,1,1011027105927360514,80,80.0,“The job” Stephen A. Smith says of being a sports commentator “is to be enough of a personality that they want to know what you think”: http://nyer.cm/sGlybj1 pic.twitter.com/fnsrKvoQba
athletesparent,4889569340,1,1011708349891653645,79,79.0,Every program that wants to great should support every other sport and group on their campus. It breeds EXCELLENCE! Celebrate every success in the school! Selfish programs don’t set foot into other events. pic.twitter.com/YmpfuAWizk
BBCSport,265902729,364,1004830360901861376,28571,78.49175824175825,The latest Fifa world rankings do not make pleasant viewing for Russia.The host nation of this years #WorldCup will be the lowest ranked side at the tournament. https://bbc.in/2JAgVYF pic.twitter.com/tnrIevjRO3
CheGiaevara,133639740,2,1013539672553918464,154,77.0,Hernán Castillo for TNT Sports in Argentina claiming that Jorge Sampaoli is no longer the manager of Argentina. A matter of when not if the official announcement will come https://twitter.com/TNTSportsLA/status/1013528466325671941 …
PapazLagos,322894494,2,1009927184121810944,147,73.5,What about that fake sports  journalist Biola Kazeem who believed Pep is fraud because in opinion his two year old son can win trophies with Messi ?
BrittMcHenry,165586474,1,1005949283022106624,73,73.0,Imagine writing something that demeans one of the toughest accomplishments in sports. Ten bucks this writer probably couldn’t skate one lap around the rink. https://twitter.com/nypost/status/1005585605869428736 …
selenamortiz,1497475884,1,1009582332708179968,72,72.0,hunting animals is so fucking weird like you gotta be a really unhinged individual to think gunning down a helpless animal is a sport
gdunbarap,104886819,1,1009915069227044864,71,71.0,While football fans were enjoying Croatia the Saudi sports minister was tweet-trolling UEFAs president. After the game UEFA fired back. It’s a proxy Saudi-Qatar dispute https://apnews.com/7b7c413863ca4afa818a265337dfb8bc/Saudi-minister-tweets-barb-at-UEFA-chief-in-TV-rights-row …
abbyaguirre_,4063893312,1,1003399287261351936,71,71.0,Drill team is a sport idc what anyone else says. It involves physical exertion and skill. We go through training just like any other sport does. It’s more than just dancing across a stage field or court. https://twitter.com/maxpreps/status/1002618864520196096 …
RyanAustinFC,804348087523217408,2,1010633286312480774,141,70.5,Imagine if the other Fox Sports Commentators were on Toni Kroos Strike....READY SET FIRE!!! #GER #Kroos #GERSWEpic.twitter.com/81TJI6EsZA
firefox,2142731,1,1008814713717841920,69,69.0,Side View just might be the best way to stay productive while not missing a match.(This also applies to basically any stream if sports arent your thing.) https://mzl.la/2kVYC2l
NASCARonNBC,1615420753,1,1008823811939106817,68,68.0,.@NASCAR is a family affair with many drivers sons going on to race in the sport themselves. @DaleJarretts son @jarrett_zach chose baseball instead and is starting to make a name for himself. pic.twitter.com/xesmSuftY8
darachos,925483707032571904,1,1009538558489759745,67,67.0,Heres a wacky idea. Maybe we can have discussions about Irish on English-language media that arent debates on whether it deserves to exist or not? I mean people who hate sport dont get invited to do match commentary.
Venuseswilliams,50725573,1,1008845346359906304,67,67.0,I’m excited to be in Des Moines this Saturday for the Des Moines Register Sports Awards. Let’s celebrate high school athletics together. Get your tix at http://sportsawards.desmoinesregister.com  #ALLIOWApic.twitter.com/WxfQQRQnbQ
GaryBedore,32992038,1,1010666381593989122,67,67.0,Billy Preston to the Cavaliers Yahoo Sports just tweeted. A source close to Preston tells me hell play for the summer league team.
OtterbeinSports,24731248,1,1003741088866357254,66,66.0,Rivalry Update: Otterbein went 14-5 in head-to-head contests against Capital this past year and finished ahead of the Crusaders in 16 of 20 OAC sports.
AllResistNews,802184729235554304,1,1005952557020135425,65,65.0,Get & sport the image that everyone is talking about as Angela Merkel looks down on Trump. Offering many unique styles! #TheResistance #FBRParty #FBR #BlueWave2018https://teespring.com/shop/merkel-looking-down-on-the-don …
AthleteNation,610568604,1,1006657536412520452,63,63.0,Its bigger then sports.After striking out his friend to advance to the State Championship this HS pitcher decides to console him instead of celebrating with his team.  pic.twitter.com/T3AGcaUPhP
agustd_tw,804398676810600448,1,1009943206606376960,61,61.0,Wow @bts_twt selected as #1 male idol and #1 overall power people in the music industry with Bang PD as the #1 producer via Sports Seoul yearly poll  http://entertain.naver.com/read?oid=468&aid=0000396973 …
MadsMikkelsenFR,865656147440672768,2,1005561311403618306,118,59.0,NEW PIC  : Mads with Jens Christiansen today June 9 2018 at the Danpo Charity Tournament in Indoor Club Sport Center. #MadsMikkelsen https://instagram.com/p/Bj0Yq5vA_-o/ pic.twitter.com/S4IE6Bf40i
whatSFSaid,2189057396,1,1004487051226558464,59,59.0,Why read books? Neuroscientists tell us reading develops the mind as sport develops the body. So the more you read the more your imagination will soar! #literacyhttp://www.literacyworks.org/news/2015/5/20/why-read-reason-6-knowledge-is-power-but-imagination-is-more-valuable …pic.twitter.com/27popSGjjS
JT_Rose_Win,872885268,1,1010988101206986752,59,59.0,My 7th grade year when everyones turns 13 more than half the Westlane basketball team could dunk and you didnt hear shit on Sports Center https://twitter.com/sportscenter/status/1010971779244969984 …
ABC,28785486,1,1013565423533613056,59,59.0,A sports radio broadcaster died when he stepped out of a stalled van and was swept away by a raging flashflood in Iowa officials said. https://abcn.ws/2tKw0Oc pic.twitter.com/aNloOqlXkW
cthagod,17878322,1,1011721126668570624,58,58.0,Ok Fox Sports One I know this is supposed to offend me but I really think this graphic is  and the fact they added my folks @jemelehill and troubleman31 to it just makes me want to… https://www.instagram.com/p/BkgLW9Ila43/?utm_source=ig_twitter_share&igshid=482lml3a2sh6 …
GoogleForEdu,254218142,1,1003781453774311426,55,55.0,On and off the court #GSuiteEdu tools help enhance sports education lessons. Learn how to incorporate #edtech in your #physed class from @MrAdamPE https://goo.gl/G7pZxX pic.twitter.com/CMqE4UokSr
LockheedMartin,42871498,1,1003765848828334080,55,55.0,VR goggles aren’t just for watching sports we pair them with #Prepar3D to demonstrate advanced training capabilities to the @usairforce!pic.twitter.com/r1RoxaqkIT
HonestToddler,568247551,1,1003750851201159168,55,55.0,The way her body has been scrutinized her achievements diminished and dealing with all of this in a space and sport so historically exclusive and then to face serious medical issues and still thrive...she is an incredible human being.
Whippenz,361902109,1,1008819408985153536,55,55.0,❥❥❥❥❝#Hunting Is Not A Sport It’s Murder❢❞Ask Your MP To Sign #EDM313 To Ban#TrailHunting On #NationalTrustLand❢PLSRT  ♚↣❥ http://thndr.me/RKwkVl MT @ThunderclapIt @AgainstHunting @greennomad61pic.twitter.com/2xTOC8KDY2
darcangel21,4258126415,1,1004476944006766594,54,54.0,Are mainstream sports pubs/sites covering this? Or how about the mainstream media in general? Haven’t seen anything and my God this needs to be shared wide and far. https://twitter.com/bytimreynolds/status/1004414140142759944 …
domiacovino,2604909719,1,1002695409205051392,53,53.0,rugby is the most physically demanding sport. 80 minutes of non stop running gotta be able to play BOTH offense and defense no pads just cleats and a mouth piece. https://twitter.com/shaynatamanaha/status/1002652166958403584 …
mikerelentless,766242122878087168,1,1008462541335523329,53,53.0,Bitcoin Cash is now accepted at Bodog!!!- Poker & Sports Bonus of 100% up to $500- Casino Bonus of 150% up to $1500#Bitcoin (BCH)  https://www.bodog.eu/promotions/bitcoin-cash-bonus-help …pic.twitter.com/4hm5vCzEGa
iMiaSanMia,618387275,1,1004506635593711616,52,52.0,Catalan newspaper SPORT claims that Bayern would accept a €50m + Lucas Digne offer from Barcelona to sign Thiago. pic.twitter.com/oI6G0nEN3R
DannyPhantom89,39642480,1,1003750378884739073,52,52.0,That’s not how rap beef works. $$ and charts don’t mean a thing to fans of the sport. It’s all good til you get hit with a haymaker pic.twitter.com/auRcGvN6FS
FightDisciples,4815704601,1,1005570471285415943,51,51.0,If you’ve never seen a pantomime before Jack and the Beanstalk is currently on BT Sport#FurySeferi
marc_raimondi,69351991,1,1011723014184947712,51,51.0,It’s official. FOX Sports is in the pro-wrestling business. The deal with WWE for Smackdown Live is done per a release. Two hours every Friday night on big FOX beginning in October 2019. pic.twitter.com/zO7xGoP0Vl
BSO,18823758,4,1012116372724170752,201,50.25,There is difference between sports journalism and sports entertainment. Some can blend the two but if you want to get PAID like big time paid you going to have to be an entertainer talking about sports. Colin wrong all the time but that doesnt matter anymore. https://twitter.com/awfulannouncing/status/1012114604238008320 …
ziyatong,948104532,1,1005575530903756800,50,50.0,Every time you hear men say that women are “too emotional” think of sports the stock market & politics...to name a few. pic.twitter.com/NWU9cC9qqw
MilanEye,372616740,1,1004467040021811206,50,50.0,Zapata could renew his contract in the coming weeks. His current contract ends in June 2019. [Premium Sport] pic.twitter.com/eFX6T2abmv
PL1918ENG,1010135411216265219,1,1012827293234974721,50,50.0,Mrs. Irena Szewińska has passed away. She was an Olympic champion and an outstanding sportswoman. A great lady of world sport! Rest in peace! pic.twitter.com/4SkRJi54AP
tommys54321,2345850344,1,1006672430742605824,49,49.0,Alright u guys decided and the giveaway is going to be a random sports card lot with a few hits in there! All u have to do is RT THIS tweet & Follow for your chance to win! Will pick a winner on June 22 Good Luck everybody
CjAscoli,2374630437,1,1012836334262681600,49,49.0,Well shit add it to the list:   Sports plus Blockbuster KB toys Toys R Us https://twitter.com/jesssromano/status/1012165420227448833 …
SoccerInsider,16313045,5,1012104441561010177,242,48.4,Through Tuesdays #WorldCup matches the top 5 U.S. markets for Fox Sports are:1. Washington DC2. Miami3. Austin4. San Francisco5. Providence
JMessam,472498832,1,1005560365235646464,48,48.0,Cut day is the worst day in pro sports. On one hand feeling happy if you’ve been blessed to make it and the other hand sadness for your brothers that didn’t. Good luck to all those going through a transitions I hope you land where your meant to be!
ScottDAmore,2431435344,1,1003396961192595456,47,47.0,Toronto peeps come on out tomorrow for our Press Conference at Real Sports in Maple Leaf Square.Doors open at 9am and Press Conference starts at 10am. https://twitter.com/impactwrestling/status/1003365708590243840 …
CanadaSoccerEN,103948050,2,1003369710405201920,93,46.5,Hosting the #FIFAWorldCup in Canada will grow the worlds game.  Our sport has long been our number one team participation sport.  Hosting major competitions has only grown the interest in the sport across the country. #United2026 #Opportunity2026pic.twitter.com/ds2ZvTs5Nb
FortniteJuly,713531307104550913,1,1005592936090763264,46,46.0,RANDOM FORTNITE ACCOUNT GIVEAWAY1 WINNER Enter:RT Comment your favorite sport! Follow:@MiningGivez@PlugsDotNet@FortniteMay@FortniteWar@FortniteFund ENDS IN 30 MINUTES!GOOD LUCK! pic.twitter.com/arDZouPPgz
areyonnnn_,825157715051892736,1,1003766260537135105,46,46.0,lemme go ahead and... Areyon LaBome18Houston TXFuture Sports Agent#WhosWhoOfTXST22 pic.twitter.com/kdAFJ45RpM
OsmanZtheGooner,81646575,3,1006660674334937088,137,45.666666666666664,Sport BILD are hit & miss so we will need to wait for further confirmation from better sources in Germany RE Leno but if true then Ivan has done Napoli here twice in a day
