user@mention,user_id,No of tweets,tweet_id,retweet_count,local influence score,Tweet
DrDiscHamilton,314057284,1,1011030280008855553,11,11.0,#ArkellsRally Night #2 at the soft open to Odds (@oddsthebar) 164 James St S the new sports bar joint venture between Max & Nick of @arkellsmusic and The Other Bird group! Digging into the Dennis Rodman nachos (with pork belly!) and enjoying the warm friendly vibe! Mark at DDpic.twitter.com/44KBy6E2Ru
JrMoe_,545022186,1,1007772354230005760,11,11.0,I don’t hate Cristiano Ronaldo. I think anybody who hates CR7 Messi Ronaldinho Maradona Pelé and all the phenomenal legends ain’t a real football fan. But if you say Ronaldo is better than Messi you have to be talking about another sport. Period. #PORESP #POR #ESP #WorldCup
Namouniho,1495775742,1,1007755976185958401,11,11.0,Being in a car with my mum and dad is a nightmare. Today I found out my dad doesnt know how to use a sat nav or drive in the city my heart was in my mouth and then theres my mum fam doing being sport commentary in the backseat. BALAK ZEBRACROSSING BLA3KAL FERROJ
AhmedMarsha,627487761,1,1002696028758401024,10,10.0,#TheFUFADrum 88 goals scored so far after Match Day 4.The player who scores the 100th landmark goal of the competition will be given 100000/= by 102.1 FUFA fm.Who will net the landmark goal?@IsmaelKiyonga @MosesMagogo @Monitor_Sport @rogersbyamukama @nbstv @NTV_Omumulipic.twitter.com/3wSygYLxws
domoxtiger,301764377,1,1002687302567686146,10,10.0,Battle rap requires you to be up on so many topics: current battlers rap battle history pop culture politics news sports lingo street shit industry shit etc. And the creativity it requires is crazy. https://twitter.com/foolishnard/status/1002683766345818118 …
sportsdrzaf,3243299153,1,1008472827408855040,10,10.0,Superb this. Thankfully there was an AED in the gym and that his father able to perform CPR which combined most likely saved the young mans life. Another reminder that all gyms / sports clubs should have AEDs and BLS and CPR great skill to learn https://twitter.com/gma/status/1008323942535258112 …
DumoEgo,730433330433372160,1,1005584143156174849,10,10.0,2018 has been the greatest sports year everTriple Crown wonCapitals and Ovechkin won the Cup16 seed upsetted 1 seed in march madnessUS Womens Hockey won gold in OlympicsVegas Golden Knights
BearArchery,69807727,1,1005577813804675072,10,10.0,Archery is more than a sport or hobby. Its a lifestyle and passion that teaches us lessons in ethics responsibility respect and an overall involvement with nature and the environment #BearArchery #PassItOn #Archery #FredBear #ArcheryTraditions #Bowhunting #YouthArcherypic.twitter.com/Q08XXy0SdW
CCUIMSports,510749599,1,1005572038470328321,10,10.0,Our First Team of the Week are the Gentleman of Kappa Sigma. @CCUKappaSigma won the fraternity division of our three largest sports Flag Football Basketball and Softball. Theyve also produced two of our awesome supervisors Alex Gorr and Colin Pollick. Good luck next year boys! pic.twitter.com/TsX3YnLV3v
sergbarrientos,131393031,1,1005565360731373568,10,10.0,Why would EA sports put this matchup in the trailer? TO vs Jalen? Out of all matchups Cowboys vs Jaguars? Really? Not a coincidence I think Jalens gonna be on the cover pic.twitter.com/2Ym0e8fbdz
kodes03,261656348,1,1005952516498980865,10,10.0,#qldmaroons v #nswblues  JUNE 22nd  North Sydney Oval  LIVE Channel 9  7.30pm #rugbyleague #nrl #rugbylove #sport #motivation #fitness #football #queensland #qld #brisbane #footy #ourway #samegameourwaypic.twitter.com/aRz8Gs92LQ
kashthefuturist,925112851894865920,1,1005909358104993795,10,10.0,Robot-sumo is an actual sport#AI #IoT #digital #Robotics #Robot #future #technology #TechTrends #data #automation #BigData #automate #sensorspic.twitter.com/O8x9elbi3U
holzer_tanya,3166149121,1,1006673290176417792,10,10.0,Scipio Jeme was awarded the 2018 Brittany Holzer Angel on Earth scholarship.  We couldn’t have chosen a more deserving recipient. The qualities that won you this award are the qualities you displayed in sports but more importantly are the qualities that will carry you thru life! pic.twitter.com/WJsRH64DK5
BloodHorse,14433996,1,1006662204001865731,10,10.0,In Wednesdays BloodHorse Daily:@OBSSales June Concludes 2-Year-Old Sales SeasonStudy Narrows Focus on How Furosemide WorksJustify to Parade @ChurchillDowns@MonmouthPark Set for Sports WageringQuality Road Progeny Make Major Sweep& #SoMuchMore! https://bit.ly/2HIiQWn pic.twitter.com/94IoUGkSLM
JenLouiseWilson,3180799929,1,1006642292545945601,10,10.0,Glad to see the #WorldCup stirring discussion about history of race & sports in Russia. For a literary compliment I highly recommend Ismailovs novel The Underground; set on the Moscow metro its about the child of an African athlete & a Russian woman who met at 1980 Olympics. pic.twitter.com/MoofNnehZi
IntFSPT,2370481098,1,1011718208989093888,10,10.0,IFSPT Symposium on Sports Injuries in collaboration with the Panhellenic Physiotherapists Association Sat June 30 8 am to 6 pm at the Olympic Committee Amphitheatre in Athens Greece. The symposium is being offered free to all IFSPT members. http://Isosi.psf.org.gr .
WSCV2017,869676773348319232,1,1009546748447154184,10,10.0,Its time for our Big Announcement. The 2018 Sports Celebrity Dinner and Auction presented by KH Developments is pleased to welcome Sport Celebrity Guests: Jaden Schwartz Brayden Schenn Brian Trottier Dennis Hull and Kelly Chase! Tickets ($175 each) Tables of 8 ($1400) pic.twitter.com/Mw5zs5hGel
EGAAUS,759647090876174336,1,1009924766659108865,10,10.0,Announcing the launch of our Esports Gambling & Integrity Panel led by Sports Integrity expert @Royter100 & Gambling Law specialist Julian Hoskins facilitated by @daveharrisAUS Thank you for your leadership and direction Julian & Iain!More here:https://www.egaa.com.au/egaa-launches-gambling-and-integrity-panel …
QuintusCurtius,1634208277,1,1008814242831699969,10,10.0,How kids in 1982 spent summer:  playing sports working part time job working on their cars.How kids in 2018 spend summer:  taking computer courses music lessons for instrument they hate cram courses soy courses Chinese classes.  Glad Im not a kid today.
BardishKW,2696723713,1,1010633423726219264,10,10.0,The CCBC’s Annual #CanadaDayFair is a piece of home away from home & Canada’s favourite winter sport is on full display Happy to join Canadian biz from coast to coast to coast in #Beijing to promote the best our country has to offer! #PuckDroppic.twitter.com/62wgrtfCIX
CarvalhoJTElite,311974888,1,1012827634810617857,10,10.0,According to Gazzetta & Corriell delle sport Roma rejected chelsea €60m offer for Alisson & Chelsea could now go for Donnarumma. NO to Donnarumma hes rubbish on the ball & is not that good just tall would be replacing Thibo with a worse version of him.
FreemanrugbyJPN,2153067128,1,1010998757779894273,10,10.0,Not a bad weekend to be a British sports lover in Japan.#BraveBlossoms beat Georgia #SamuraiBlue draw with #Sen#ENG beat #Pan at #FifaWorldCup2018 top Springboks in #rugby and #Australia in #cricket.Scotland down #ARG in rugby.pic.twitter.com/M8uzWtOy40
VisitCZ,31201351,1,1012085716623519744,10,10.0,Summer Experiences in Prague - Water sports walks romantic boat rides festivals and more! Theres plenty to do in Prague this summer!http://bit.ly/2ltwUdu #visitczechrepublic #visitcz #praguepic.twitter.com/RRM7r6YWqc
Thegroz,26784377,1,1012083937470902273,10,10.0,Good luck to my friend @thefishonradio as he does his final broadcast on KRKO today. A key player on the Seattle sports radio scene for 3 decades. His humor and candor will be missed. Truly enjoyed working with the man I call The Big Dipper especially on W.S.U. games Good Luck!
SunlakeSoftball,2950096981,1,1007734006757122050,10,10.0,CONGRATULATIONS to Kendra Falby (2nd Team OF) Paige Maseda (2nd Team OF) and Emma Sica (Honorable Mention C) Class 7A Miracle Sports All-State Teams!!!! GREAT JOB!!! pic.twitter.com/rF3OEDuRPD
WMUR9,14662569,1,1004866673277628416,10,10.0,This weeks #HometownHero is Pelhams Mia Herrling who will be continuing her high-jumping career at @umasslowell: http://goo.gl/RtCsjU #sports #highschoolsports #athletes #nhathletes #highschoolathletes #athletics #track #highjump #trackandfield #highjumperpic.twitter.com/QUjhAT8mzt
JillBMyers,372914933,1,1004831751045308417,10,10.0,Look at what happened on January 21 2017.  Perhaps it’s more about no longer being apathetic aloof & taking democracy seriously.  It’s NOT inevitable or a spectator sport.  We’re activated educated & have seen results from @IndivisibleTeam. #152Days #SacredVote #2018Midterms
WestmorelandSN,300730006,2,1008821831636156416,19,9.5,Hempfield wins its third straight PIAA softball championship; Robert Kennedy puts on a show in the Foothills Classic; Cali Konek has transferred again; Norwin selected to host football championship and MORE in todays Westmoreland Sports Notebook: http://www.westmorelandsports.com/news/2068 pic.twitter.com/3nWIf31iqw
warner_jene3,956620507784204288,1,1008498994295726080,9,9.0,This “stick to sports” response is getting tiresome and worn out!..ok so lets say @ShannonSharpe stuck to sports..being i can tell u arent athletic whats the answer to the issue at hand regarding the decline in farm workers? I’ll wait.
ClassicCars_com,23973261,1,1008469597606039553,9,9.0,The 1969 models featured Chryslers new round-sided Fuselage Look styling - 1969 Plymouth Sport Fury: https://classiccars.com/listings/view/1045136/1969-plymouth-sport-fury-for-sale-in-midvale-utah-84070 …#classiccarsdotcom #driveyourdream #forsale #plymouthsportfury #plymouthfury #plymouth #1960spic.twitter.com/IybAMHZMl7
PvBoiZeroni,996073291377881088,1,1008467180986351616,9,9.0,Bro I was recycling all the empty beer bottles in my Mexico jersey & my neighbor I’ve never met screams out “MEXICO MEXICO!” He had his Serbian flag wrapped around him and says “congrats on defeating Germany that’s huge!” World Cup brings everyone together man love this sport!
MMindrumMD,957767862101438465,2,1007036515434881029,18,9.0,Major flaws (some question fraud) in journals (i.e. NEJM ) & landmark PREDIMED study. This issue in science w/ pressure to publish industry bias and conflicts of interest among authors of guidelines are equivalent to doping in sports. Medicine has a looming credibility crisis. https://twitter.com/skathire/status/1007013711444185088 …
nomifooty,1670231442,1,1007040111849148416,9,9.0,According to Corriere dello Sport and also Alfredo Pedulla Sarris representatives Fali Ramadani and Alessandro Pellegrini are currently in London and they had a meeting with Chelsea board yesterday. Nothing is clear yet but both clubs are trying to figure out the best solution pic.twitter.com/7biNvFmNfj
just_Jimz,392580098,1,1005598386920312832,9,9.0,It’s crazy how many insults and disses and all that shit I hear in battles don’t bother me one bit .. it’s apart of the sport .. but the only thing that gets me mad is the false statements of me not having my own crib lol it’s ok if you live at home b .. BUTTT I DONT ! Foh lol
TheRealC_Los,39650715,2,1003759999401779207,18,9.0,A un-named @NBA GM said today that Priority Sports the agency of Micheal Porter Jr has informed some teams that MPJ will undergo a physical exam in the coming days & will workout at his Pro Day live in front of execs & scouts this Friday in Chicago. #Bulls Reps will be there
BarstoolSam,2518195471,1,1005584184402939905,9,9.0,Congrats @lmechegaray ur everything wrong with soccer fans. U want sport to grow yet cry if someone covers it for casual fans in a way that impinges ur snowflake sensibilitiesps: u work for a company that uses naked ladies to sells magazines so save the sanctimonious bullshit https://twitter.com/lmechegaray/status/1005412361816236032 …
ApexOnRacing,2288142614,1,1005579020296220672,9,9.0,TIME REMAINING: 15hrs 48mins1/3 through the race as we approach sunset!Follow the #AOR24H LIVE: https://AOR.social/rF2-24h-Pt2 Current Leaders:LMP2:1. @vd_sport (Baxter)2. @Team_ACR (Blanton)GTE:1. Reborn Racers (Pizzo)2. RacingClub Endurance Team Jr (Oliveira)pic.twitter.com/AzbbrRI6Ul
rachbarnhart,16275936,1,1005570126450712581,9,9.0,I’ve been saying I’ve knocked on 2000 doors. Counted today. Definitely 3000 at this point. I got 374 signatures & I’ve talked to more than 900 voters since then. About 40% of people home. I wear Anne Klein Sport brand shoes in case you’re wondering! #ROC #NY25
jacklstickney,29312785,1,1005949466786951174,9,9.0,Isnt this just the point of drug testing in womens sports (and the Olympics): to stop male hormone enhanced women.  Now you want to allow ACTUAL males to compete with women!  In the immortal words of the melting Wicked Witch of the West: Ohhhhh... What a world what a world!
darthplaygues,700744999,1,1005922330449674242,9,9.0,You pick sport to report on instead of the NHS pay announcement extra low cost housing increase in carer’s allowance or extra/refurbished nurseries? Fair play but it’s that kind of gutter reporting that pushes #Indyref2 all the closer!
DaAnsahonSports,95001048,2,1013563184014397442,18,9.0,Possibly the greatest pure passer ever Dan Fouts wins another afc west title (1980) vs the Steele curtain. #nfl #chargers #danfouts #lachargers #losangeles #la #california #sports #nfl… https://www.instagram.com/p/BktQtO4nSt4/?utm_source=ig_twitter_share&igshid=1ink84u7tx1fa …
LydiaFaithfull,4592117599,1,1006664236276371456,9,9.0,48 years ago today Dock Ellis threw a no hitter on acid in the goddamn rain. I don’t care about animation sports and never recommend shit but this 4:32 video is truly fucking delightful. RIP Dock. You had style.https://youtu.be/_vUhSYLRw14 pic.twitter.com/4dxJWFAYFU
GB_Dolphins,751167782373380096,1,1006641521662324737,9,9.0,2018 Ridge Sports Team Shop Now Available! Don’tmiss your ONLY chance to get GB football gear in time for the season https://www.ridge-football.com/  find GB Team Shop page Use password Dolphins1 to see all items. Credit card payments available. DM for detailspic.twitter.com/ewfY7Qu8Op
DodgersFdn,4917775837,1,1009919257075838977,9,9.0,We believe the power of baseball can change lives. - Nichol Whiteman on Sport For Good: The Role of Team Sport Philanthropy at the @LA84Foundation Sport At The Service of Humanity Second Regional Conference. #ThePowerOfBaseball #BiggerThanBaseball #PlayForAllpic.twitter.com/S1a9lJ3dzN – at Loyola Marymount University (LMU)
SleetmoorUtd,968959180257349633,1,1009902120190009345,9,9.0,Massive congratulations and a well deserved win tonight in the Derby Telegraph Heroes of Derbyshire Awards for Sport Hero for our very own Barry Newton with over 35 years service to ADASC and now Sleetmoor United - all round top bloke  well done Barry. pic.twitter.com/piIIMZeVd7
AlthausEJC,1071669066,1,1008844239768207360,9,9.0,Former Grain Valley 4-sport star Zack @zackkary_2 Ehlen who enjoyed great success at State Fair CC is going to be featured in Tuesday Examiner! He will continue his baseball career at MIAA power UCM. Best all-around athlete in Grain Valley HS history - earned 13 letters. WoW!
baDnewSanalysT,887655945551179776,1,1012794167951491072,9,9.0,Just in two people including the PA to Sports Minister Rashid Achesa have been confirmed dead.This followed after a serious fire exchange when Rashid Achesa was trying to block Senator Malalas motorcade. pic.twitter.com/5fg4mATl8P
AmerHotRodFdn,809357707,1,1007743305856245760,9,9.0,A real head-turner at the 2018 @RaceofGentlemen was Stacey Heminover’s ’28 Model A Modified. It sports a flattie with iron heads and looks fast just standing still. It looked and sounded even better at full tilt on the beach.©AHRF/Jim Miller Collection (JMC_8071)#TROGpic.twitter.com/g54Ira1Hkd
jasonmohammad,106767705,1,1007732256981516294,9,9.0,Just interviewed David De Gea. Obviously hugely disappointed to draw the match. Says they created more chances than Portugal. On “the goal” - “these things happen in football.” Available on radio and @BBCSport soon #PORESP #BBCWorldCup #worldcup
cubsportstan,956352980424515584,2,1012091279482728449,17,8.5,best cub sport songs ranked:15. you14. can’t13. rank12. them11. because10. their9. songs8. are7. diverse6. and 5. all4. are3. absolute 2. masterpieces1. come on mess me up
ClubMasodi,711171466465660930,2,1009571203160334336,17,8.5,Baibalaa Tournament 2018.Day 3 MasOdi Sports Club -VS- Punk’s Next Level.It Was An Easy Win Against Punk’s Next Level.Fly like a birD  Die like a herO Zippo | Photographer pic.twitter.com/eBFtcV7I7z
AFP_Sport,2381967920,2,1003753820323827713,17,8.5,Liverpool goalkeeper Loris Karius suffered concussion before his two costly blunders in the Champions League final against Real Madrid doctors sayhttp://u.afp.com/oMYG  #Karius #LFC #UCLFinal2018 @AFP @AFP_Sport pic.twitter.com/tA1KrOuBEw
LCSBond2018,1007333241295122437,2,1012083316072308736,17,8.5,A Yes vote will change the game!  Check out the ideas for a new indoor practice facility for the Splitter Nation!  This facility will house a 300 meter track indoor turf batting cages a workout facility...& enough multi-use space for every sport to find a way to get better! pic.twitter.com/kLTNkQNNoV
CelticNation67,828745006047514625,1,1002694185810526208,8,8.0,Not that I needed it but got a stark reminder the past 24 hours that the Celtic family is the best group of people in sport.In an era when the sense of community erodes year on year it is refreshing to see that the Tic family is as strong as its ever been.Proud to be a Tim
JimWatsonOttawa,60597469,1,1002693913545773057,8,8.0,Inducting hockey star @jimkyte  former mayor Jim Durrell football legend @JeffAvery16  ringette trailblazer Betty Shields  and rugby powerhouse Steve Gray into @OttawaSportsHoF- A big thank you to @AlgonquinColleg Sport Business students for making tonight a great success. pic.twitter.com/GWbjEd0vf6 – at Horticulture Building
WVHSathletics,389215232,1,1002686739977326592,8,8.0,Saturday Sports Viking baseball plays in IHSAA Regionals @ Crawfordsville vs North Montgomery at 11am.Ethan Roach competes in IHSAA State Finals in track @ Indiana University 5pm (100M & 200M)
SLSAustralia,178963355,1,1002671322860806145,8,8.0,Rock fishing is deemed Australias most dangerous sport.158 rock fishers have died since 2004 and 99% were not wearing a lifejacket. Always wear a lifejacket fish with a friend and check the conditions before leaving.Visit http://www.safefishing.com.au  to find out more.pic.twitter.com/FsBdBXJya3
giannadegeorge,441418284,1,1007041842511269889,8,8.0,Sorry but I dont get why guys can walk around shirtless and thats socially acceptable but if a girl is seen in a crop top sports bra or bandeau they instantly get nasty looks. Like why??? Were at least wearing something like theyre wearing NOTHING
putrawayan179,745650920084496384,1,1007029663820967937,8,8.0,1. More funding towards sports in uni.2. We need good lecturers not just someone with a PhD. Heck adik aku pun boleh duduk sambil baca slide.3. Main goal is to learn not grades. https://twitter.com/syedsaddiq/status/1006872344617349120 …
NWSTucson,594723485,1,1007019788122644481,8,8.0,If youre outdoors playing sports & hear thunder take shelter immediately--you are close enough to be struck! Lightning injuries/fatalities are unfortunately common around sports fields. When thunder roars go indoors! #azwx #Monsoon2018 #MonsoonAwarenessWeekpic.twitter.com/ssiWNHMHBc
theseoldcars,84637834,1,1005568331942912001,8,8.0,What about a Suzuki Swift Sport or a Fiat Panda 100HP as a more frugal daily?*fifteen minutes later*Right so it looks like an E90 M3 will do a tolerable 23mpg.
_Busdevpeep,815204079358054400,1,1005923553156444160,8,8.0,This weekend in sport:Tyson Fury chases a midget round a boxing ring Cantona’s back on the pitch at OT and Neil from the Inbetweeners scores the winning penalty as England win a shoot out.Nurse fetch my meds. #SoccerAid2018
mucoachdoug,836972755371372544,1,1005918382934220800,8,8.0,Im a sports guy so heres a sports analogy.  So Im the starting pitcher (Dems) but I am pitching horribly & get yanked (2016 election).  So reliever (Trump) comes in & does amazingly well & it looks like well win the game we were about to lose.  So starter hopes we lose?!
dreamaskew,725426518747287552,1,1004474618512457728,8,8.0,okay I know I abandoned my Monsterhearts sports supplement months ago but Clear Eyes - A Monsterhearts supplement that cant lose is such a good title that Im compelled to pick it back up again.
drdavebrooks,1471161307,1,1006673709828980736,8,8.0,And how many physician hours are lost trying to convince the ND patients that they don’t need testing for adrenal fatigue sub clinical hypothyroidism Chronic Lyme disease and the like?Luckily for me less of this in sports med
SportsingJim,47601946,1,1006661706385444864,8,8.0,What’s wrong with sports culture?Colin Kaepernick protests the treatment of minorities in America  blacklisted by the NFLSlava Voynov is convicted of spousal abuse  has “quite a bit of interest” from NHL teams on a potential return pic.twitter.com/hdD26RlH42
MissLaliberte1,743558251321630720,1,1006636022808104960,8,8.0,I love my civil cook job ; working in a restaurant is my favorite sport (except sex ). But  I will be in vacation next week and I would love a date with sexy sportI look forward to kiss you and more...#indycompanion #curvesaresexy #montrealescort #gfe #montrealcourtesanpic.twitter.com/rUA3rt9sbx
whynotcourt,2588384671,1,1009547021240406018,8,8.0,Look who’s in H-town!! @icecube and #ClydeDrexler met with Houston Mayor @SylvesterTurner on Wednesday to talk about @thebig3 in Houston this week. Thank you @icecube & #ClydeDrexler for talking with me about #TheBig3Season2 with leading sports media @vypehouston #HoUStonpic.twitter.com/M2oOLaQZpK – at Houston City Hall
gusmears1905,615099280,1,1009546804415942656,8,8.0,Italy is a country I love. It gave the world many great things. It gave Chelsea many great people.But it can take all these fucking twitter sports journalists who pop up every summer with vague attention seeking nonsense like Buble at Christmas and shove them up its arse.
AtlantaFalcons,16347506,1,1009936380934459392,8,8.0,Love this! Work hard Gibran and always believe in yourself for starters. Work on your writing and communication skills. Read get involved with the sports information dept. network apply for internships and work hard – always with a smile on your face. Youll get it! – MT https://twitter.com/LilGmoneyP/status/1009790949503979521 …
wpsds,1964202325,1,1009934020950548480,8,8.0,Breaking:Paducah police decide to exclusively use Electric Morning Show as torture to interrogate suspects. Police chief Keef said so far we have people confessing to crimes that didnt even happenSports is next
young_gotti2,983422115251712002,1,1008861322761703424,8,8.0,Kira Lewis (@Mr_Lewis3) highlight mixtape Averaged 27.9 ppg 6.6 rpg 6.1 apg5 star recruit for 2019 (247 Sports)#17 overall prospect for 2019Holds offers from Alabama Indiana + moreClick link for full video : https://youtu.be/sE4L_eRiDBo pic.twitter.com/HOFaPdpJWs
Empress_Poison_,860504332457955328,1,1010670708920406021,8,8.0,A Wishlist purchase is a great way to break the ice and show me respect whether you buy for my work my sport or just for me and I may actually reply to your message  #medicalmistress #glovefetish #latexfetish #sissyslut #abdl #abdlmommy #sissymaid #femdompic.twitter.com/74VaUArxxP
mercedro,16954018,1,1010636663398289409,8,8.0,“Univision is 3rd most-watched network on DISH in any language UDN is DISH’s 2nd most-watched sports channel in any language UniMás is a top-15 net regardless of language on DISH” https://deadline.com/2018/06/univision-warns-dish-subscribers-on-potential-access-cut-off-in-carriage-dispute-1202416310/ …
ckamka,113781050,1,1012812507831037952,8,8.0,David Ortiz made his MLB Debut for the Twins at Wrigley Field 9/2/1997.#Cubs radio broadcaster Ron Coomer hit 3rd for the Twins that day.NBC Sports Chicagos Doug Glanville hit 2nd for the Cubs.
SCarolinaJoe,1048764631,1,1012119951380008960,8,8.0,This & his hit on Andre Ellington are 2 big reasons why @JungleBoi_Swagg is a Gamecock Legend & my favorite Gamecock of all time.....out of all the sports  #Gamecockspic.twitter.com/BjuxzELqBe
Fake_Buck,286220561,1,1003401518861701120,8,8.0,The Orioles Facebook group is like Baltimore sports fan Infowars. There is a thread in there about if Cal used roids because now that hes 60 his face is round like Barry Bonds.THE MAN DOESNT PLAY SPORTS JUST GOT DIVORCED AND IS ENJOYING SOME ICE CREAM DAMMIT
LEW18U_Oley,978439469119492096,1,1004843369456111616,8,8.0,LEW walk off by @jpaulick2 defeats Steve’s Sports in their 1st pool play game 9-8 @MCTournaments. @jpaulick2 had 3 RBI. @ParkerRich16 got no decision but kept LEW in the game going 5 with 3K. @case_jakob lead the way with 3 hits. @rcrooks427 and @Alex_brill5 also had mult hits.
AllPassingThing,2579515332,2,1011711179574607877,15,7.5,The Catholic ChurchIrish speakers and others involved in the preservation of our culture (which is the worlds greatest) should use the #newbridgeornowhere scandal to forge a new GAA which returns to its roots to protect and promote Gaelic cultureNot Sky Sports & British money
FLOWJamaica,194109234,2,1004849815556116486,15,7.5,Big win for Daniele Williams at the Diamond League! Watch as the 2015 World Champ wins the 100mH in a Seasons Best time of 12.60s in Oslo Norway!Enjoy #IAAFDiamondLeague coverage free on the Flow Sports App using your Flow ID. Download now: http://hyperurl.co/FlowSportsApp pic.twitter.com/qEkt6FmgHo
