user@mention,user_id,No of tweets,tweet_id,retweet_count,local influence score,Tweet
SquirrelJock,3528418636,1,1006650263418101762,5,5.0,Two professors of Public Law disagree on the law. The only charlatan is the third rate sports commentator thinking he can offer any meaningful insight. https://twitter.com/mstewart_23/status/1006636643984519168 …
GeauxDU,82144037,1,1006650035902304256,5,5.0,2019 Dillard University Sports Hall of Fame Nominations Open Until August 15! #MyDU alumni! #GeauxBleu #BleuWorldOrder@du1869 @BleuPrideRising @DUAlumnihttp://www.dillardbleudevils.com/SIDHelp.php?action=form&parameters=41 …pic.twitter.com/EvS2eURxBi
Tataegguk,222412652,1,1006643436965978112,5,5.0,how their tour was going so farand what realizations they made as they traveled the world and interacted with their intl fans?From : Jungkook- Sports Kyunghyang Interview - #우린여기있었고_5주년이다가와준거야#우리의방탄_5주년축하해_아랍아미#5thFlowerPathWithBTS @BTS_twtpic.twitter.com/CnqM1Qcd5t
IMS,18156714,1,1006642410766700545,5,5.0,Some of the coolest vintage sports cars will race this weekend at IMS during the #BrickyardVintage including this 1969 Lola T70 MKIII.  >> http://IMS.com/Vintage pic.twitter.com/CGaKi8cb7f
KWCHArielle,24760842,2,1013564531187093504,10,5.0,Happy @American_Conf anniversary @GoShockers!Were featuring each of the teams tonight on Sports Sunday but heres a preview of the @GoShockersVB year in review:#watchus #AAC #anniversarypic.twitter.com/WHw1dp6DVR
KidSportBC,38509718,1,1006639904288321539,5,5.0,Thanks @SNCaroline for the birthday wish! Become a monthly donor and sponsor a child. Donate $25/month and give a kid the experience of organized sport. #KidSport25 #SoALLKidsCanPlay http://ow.ly/fmIv30kt7uY pic.twitter.com/uJjuJTI5YN
NH_Coaching_,2350976198,2,1003373054767042560,10,5.0,“The theme that less can be more followed Ryan throughout his journey with Fiji & he believes it is one that professional sport should be focusing on in an age of endless data & analysis.” http://www.dailymail.co.uk/sport/rugbyunion/article-5800385/Ben-Ryan-coaching-Fiji-three-years-following-miserable-existence-England-Rugby.html …
HarvestMedicine,817059265084932096,1,1006636574467997696,5,5.0,CBD for Athletes via @roottie420 https://bit.ly/2LJsTN3 Visit http://hmed.ca  for more cannabis resources news and reviews.#athlete #inflammation #pain #training #sports pic.twitter.com/arYnZ5o2CV
CoachNickEstey,1006159119861075968,1,1011756433786929152,5,5.0,I view every player who comes through my program either HS or Club as my responsibility to safeguard and instill an excitement passion and love for this game. As any coach in any sport it should be your #1 priority.
KEYTNC3,582280139,1,1011740210718281728,5,5.0,The California Department of Health has lifted all health advisories related to sport-harvested bivalve shellfish in Santa Barbara County.  http://bit.ly/2IvbvtL
SpLeisH,1712141707,1,1011739156777721856,5,5.0,Excellent new paper on the limitations and possibilities of prosopography as well as new research into Womens Rowing in the 20th Century by @ManMetUni PhD candidate @LisaTaylor1985 available now from Sport in History https://bit.ly/2lD6fLy
abbykras,633405303,1,1011736181133004801,5,5.0,“Hunting is a sport” bitch this fat shit probably can’t even walk 10 feet without having to sit down “sport” my ass end trophy hunting https://twitter.com/jamesmelville/status/1010458829224587266 …
BRathletics13,1649086026,1,1011733600755245057,5,5.0,Fall sports meeting at the BREC. July 11 2018. 6:00 PM. Please plan on attending to meet your coaches & get information concerning the upcoming season.
TravisSheridan,14883212,1,1011727074824990721,5,5.0,Its cool to be in a video with a famous news anchor one of those retired sport ball fellas a donut dude and a guy responsible for yummy goodness. We all seem to love #Archie! @GatewayArchSTL @explorestlouishttps://twitter.com/alexiszotos/status/1011715638438526976 …
KillaAllo,2518231002,1,1011726947125284865,5,5.0,21 years old....with the brain of a 60 year old man they said.....idk how y’all could choose a sport over your life that’s crazy. https://twitter.com/ap_top25/status/1011631695974592514 …
stannesfulshaw,373008546,2,1011724989693755392,10,5.0,Thank you to everyone who attended the #Wilmslow School Sports Awards this evening. Our guest speaker @Scottie2507 was awesome - we LOVED all the medals and great advice about never giving up and embracing all opportunities. Well done to Callum from our very own school who
MenInBlazers,365603329,2,1012800020360384512,10,5.0,MiB Presents: Laylas Occasionally Unbiased Football Show with @Laylaloves. Watch all episodes of #LaylaFS via NBC Sports digital.https://youtu.be/m7WZk8mrzHc
cmoney404,136710734,1,1011707637845708803,5,5.0,As someone who has made the drive every year for the last 15 years to be #LiveAtKyDowns lemme tell all of you - Its a special place that keeps getting better.  Do yourself a favor.  Go enjoy Franklin Ky and the Sport of Kings this fall.
we_are_MI,1008952382963658752,1,1009577520092475392,5,5.0,MI Sports can confirm that Steven Kwan will be available off the bench tonight for @BeaverBaseball #CollegeWorldSeries #Omaha2018
SpectrumHockey,969107566037950464,1,1009573608178380800,5,5.0,Spectrum Hockey isnt just about becoming a better hockey player but also about becoming a better person. Senior cohort giving back to the sport today! pic.twitter.com/7KrIJ1NR5J
AmyCallender,388641309,1,1009563840776933377,5,5.0,Hats off to this school for making athlete safety a priority.  Congratulations! Switzerland Co. High School Receives National Athletic Trainers’ Association Safe Sports School Award https://www.eaglecountryonline.com/news/local-news/switzerland-co-high-school-receives-national-athletic-trainers-association-safe-sports-school-award/ …
InfernoOmni,2185713181,1,1009559967903469570,5,5.0,I feel if Nintendo was more involved there would be more organizations and sponsors outside of Smash willing to invest more into the scene. Higher salaries from sports teams and more opportunities that surpass just 5 players out thousands.
iShabi7a,2265602857,1,1009558541135499269,5,5.0,For a country like Saudi Arabia who has all the money in the world you’d think they’d be a powerhouse...but they fuckin suck at everything there is...sports  military  politics  etc
syria_true,126974076,1,1009553487515004930,5,5.0,This #Iranian beauty got ready to go to Russia to #WorldCup and support Iranian football teamto b equal wth men and attend sport eventshttps://youtu.be/2xfNqXFdABg pic.twitter.com/VeLIfwhnjP
tonyleen,30227507,1,1009550517998116864,5,5.0,The cover of Thursdays @ExaminerSport leads on Brian Lenihans battle with mental illness. And @TommyMartinTV3 on female sports punditry and the reaction to same. pic.twitter.com/5u77472c2o
1pitchwarrior,564284299,2,1009538222324633600,10,5.0,iPlay Pledge - https://mailchi.mp/1pitchwarrior/iplay-pledge … An article and idea for parents who have had enough of aweful sportsmanship at youth sports and a way to empower their kids to take a stand.
Arivnna,195930299,1,1009540953936416769,5,5.0,The act of hunting for sport is very sick and disturbing. What would really provoke you to be okay with killing innocent life for... fun??? It’s literally for no good reason. https://twitter.com/t0nit0ne/status/1009346222530973696 …
sportrecdance,798921652608397312,1,1009539676355612680,5,5.0,How to look after your mental health using exercise being active doesn’t have to mean doing sport or going to the gym. There are lots of ways to be active; find the one that works for you and let’s all get physical! https://shar.es/anisCg  via @mentalhealth
TripleDeadHeat,18348727,1,1009949055479246848,5,5.0,Woodbine Oaks winner Dixie Moon aiming to run in $1M Queens Plate for @cdayphillips1 #QP18 (By @danralphcp / @CdnPress_Sports) https://www.tsn.ca/woodbine-oaks-winner-dixie-moon-aiming-to-run-in-1m-queen-s-plate-1.1119547 …
SnapperTams,78853278,1,1009946911871299584,5,5.0,Congratulations to @MB3FIVE who was just drafted second overall in the #2018NBADraft by the @SacramentoKings. First ever @sierracanyon alum to be drafted by a major league professional sports team.#MakeHistory @SCanyonSports #SierraCanyon @SierraCan_Alum
JoshHenschke,197176538,1,1009943007167213568,5,5.0,Adam Silver is the first commish in the history of my time watching sports to be cheered instead of booed. The man absolutely deserves the praise.
MMAonSiriusXM,27688118,1,1009942269858807813,5,5.0,Marc Raimondi: Kayla Harrisons not in MMA for the cheap attention: Shes all about the sport of MMA @lthomasnews #TLTSpic.twitter.com/X3OZCD26Rw
mattpenglish,57063810,1,1009929346046406657,5,5.0,Three legends at the Opening Ceremony. Well done ⁦@Sports Des⁩ ⁦@IanDempsey⁩ and what a passionate speech by President Micael D. Higgins. All ⁦@SOIreland⁩ so proud. Hard to believe it was over a week ago!pic.twitter.com/IodsAX3KDU
MichaelGLFlood,570561735,1,1009929290606002176,5,5.0,Sport and violence against women: Report finds spike in family violence rate in NSW during State of Origin https://www.smh.com.au/national/nsw/report-finds-spike-in-family-violence-rate-in-nsw-during-state-of-origin-20180621-h11o2k.html … via @smh
JadePaveley,117153436,1,1009926099894194181,5,5.0,Thank you again @networkshe for asking me to talk at your conference! It was so interesting to hear from other women in diffferent sports from Surfing Rugby triathlons to Moms getting together to play football!  #GetInvolved photo pinched from @OurSquadCymru pic.twitter.com/f71Y9S5tsY
NAUTrackFieldXC,1852547804,1,1009921718465380352,5,5.0,Nicole Fotinos concludes her time at the @usatf Championships as one of the best sprinters in the nation.She finished 19th overall in the 400m against some of the best runners the sport has to offer. #NAUStrongpic.twitter.com/oQWlg00bgg
Texas6ASports,2490692354,1,1009919642738069509,5,5.0,We are finally in a position to cover all of the sports we do to the fullest-degree.That means non-district games and tournaments for basketball and baseball.If there’s enough interest in the sport we may even cover Soccer next year.
Burli_ChiChiLiu,2535658944,1,1009914728041230336,5,5.0,Sportsnet 590 The FAN @FAN590 has an opening for a new Part-Time Sports Editor.  If you Live Eat and Breath everything sports they want to meet you! Working knowledge of Burli Newsroom System is an asset https://www.chichiliuburli.com/hiring pic.twitter.com/taLDbuX7dm
AK_MediaMan,219380508,1,1009914248766672896,5,5.0,Awesome to see that two of my favourite peeps in sport nominated for the women in sport PR category in @gsport4girls #gsport13 awards. Congrats @Leila_Steyn @Syfokazi good luck ladies and a shout out to  @KassNaidoo for continuing to raise the bar with these awards...
Cherbear2421,447539496,1,1009912947660001286,5,5.0,Twitter the best out. Get your news on here direct tweets from the leader of the free world sports sprinkle in some memes and see what nonesense your friends are spewing
anfield_sports,1076779202,1,1009911779370131457,5,5.0,Fantastic night of grass roots football @anfield_sports Summer league under 8’s. Great teams players and managers. Overall fantastic night. Great feeling to our summer league pic.twitter.com/gLt6P9nuye
ScotPollard31,3193610906,1,1009907962721325058,5,5.0,#TBT to the day I got drafted. Oh wait there isn’t a picture. I was watching from a sports book in Vegas because that was the only place that had it on. And also cameras didn’t have phones attached to them back then. #19 @DetroitPistons @NBA
Antoinette_McK,766644535288066048,1,1009906966062338048,5,5.0,Rugby legend and @SportNINet sporting ambassador and gentleman @StephenFerris6 talking frankly about sport and mental health at the #TeamInspire awards evening. A real inspiration to all of us.pic.twitter.com/tTvRa1cBS7
umisr,217437553,1,1009903788256161792,5,5.0,Using data on 12th graders from the annual Monitoring the Future nationwide survey conducted by @UM_SRC researchers show that participating in multiple sports helps kids both on and off the field. http://bit.ly/2tr8zc0  @ysinews @NIHpic.twitter.com/rzx1d7pKiF
AshhPashh7,308253640,1,1003777407969648646,5,5.0,S/O to the NCAA Leadership Development staff for allowing me the opportunity to volunteer and be a part of the project team at the Career in Sports Forum! An absolutely incredible experience with even greater people! #LearnLeadpic.twitter.com/q1k85ejTJI
MrsDKaszuba,765196393959002112,1,1003777094986489856,5,5.0,Celebrating our student athletes at Senior Sports Awards Night—Thank you @OTBoosterClub parents athletes @OT_SpartanATC @Oceanathletics fans and all involved in this great year of Spartan athletics! #spartanlegacypic.twitter.com/zkRJTPfXej
TheM_L_G,147205029,1,1003763259072237569,5,5.0,Nothing like scrolling through twitter and seeing the head of a major English sports section laughing about how Karius and Liverpool are faking the concussion.
soxmachine_josh,21213366,1,1003759350358388736,5,5.0,We start the @SoxMachine MLB Draft Show starts in one hour. Join me @FutureSox @BrianBilek_  and @TheLoop_Sports @JamesFox917 The Mixlr Show room is open. Leave us questions and comments in the chat window.http://mixlr.com/soxmachine
TerryNelson23,232945564,1,1003757368340107264,5,5.0,If someone would have told me 10 yrs ago @espn would have dropped from my 1st source to my 6th source for sports news...I would have laughed so hard...but here we are. https://twitter.com/680thefan/status/1003716286927507458 …
RollinsonKm,2244598815,1,1003750270696910849,5,5.0,Great advertisement for #pride inclusion and equality in sport is ever growing and its awesome to see @yckladies @YorkKnightsRLFC supporting the LGBT community of York for pride this weekend. Just need the world to follow suit sometime soon. #proud https://twitter.com/jackienickson1/status/1003730912314642438 …
tharacing,264379612,1,1003742816902746112,5,5.0,NJ Assembly and Senate committees both passed sports betting regulatory bill today June 4. No fee for leagues. Vote later this week in both houses. @MonmouthPark @njbreds
BowlsScotland,602094901,1,1003741333041840128,5,5.0,A6. Bowls is one of the most accessible sports. We work with @SDS_sport to give everyone the opportunity to be part of the bowls community bringing people together adding to their confidence and skills and boosting their physical and mental health. #SportHourpic.twitter.com/x8O2nVVoAl
JasonSnavely,248935169,1,1008854599753580544,5,5.0,Just a couple AZ sports guys talking about their upcoming nuptials... And as it turns out D.J. Foster is getting married on the SAME DAY as one of his #AZCardinals teammates! @ASTATE_8 @BIGboehmTHEORYpic.twitter.com/frHm1kp1jt
TheBronxZooNYY,780845424345088000,1,1008844016400470017,5,5.0,ESPN has forgotten what it stood for.ENTERTAINMENT & SPORTS PROGRAMMING NETWORKNot politics or social justice etc.Had to unfollow @MichelleDBeadle because of this garbage.@espnhttp://bxzoo.com
karenjcoventry,1090479078,1,1008840109704253446,5,5.0,What a weekend of Sport and the emotion and magic that goes with @SOIreland Games. Thank you to @joannecnkelly @GerMcTavish @LaurLaur___ for sending me photographs that sum up the weekend - smiles inspiration volunteers dreams and a drive for excellence!pic.twitter.com/szBFTIF2Nk
Dapcoach,153357904,1,1008821225722966017,5,5.0,@EssexBladesSU basketball set off in style from @Uni_of_Essex @Essex_Sport Arena today for the Uni of Macau aboard the new @EssexRebels team coach courtesy of sponsors @RomanCoaches.  @WBBLofficial @bballengland @SportsafeUK @EssexAbroad @Forster_Anthony @SRES_UoE @DSalmonCarspic.twitter.com/wJ8floFS4N
RobertBlakeSC,900014959,1,1008819637008715779,5,5.0,Today we received the Gold Standard Award for our work with School Games. ⁦@schoolgamesGB⁩ Congratulations to all of our Sports Leaders who helped us to win this award with their determination and commitment to their role as Leaders. #AspireAchieveCelebratepic.twitter.com/hWpSSyyVgm
Ankenysoccer,952916384186621952,1,1010670427574808577,5,5.0,Our very own Jack Nurre representing AHS Boys Soccer at the Des Moines Register All-Iowa Sports award! Congrats Jack! #lad! @Ankeny_Hawkspic.twitter.com/3Yoo6zO2Gb
heatherboggs1,527879431,1,1010667557567725568,5,5.0,This is disgusting. I dont think I can handle seeing this crap everywhere. Its in Hollywood in sports in church in politics in about every single area you can think of. It is an epidemic.
Msaeid8,3020510145,1,1010645309301710850,5,5.0,2018 and you still See racist and ignorant people. It’s bigger than just sport like how do you think being racist and ignorant  is ok like how ?? #JimmyDurmaz
TheBearPitTV,184163530,2,1013549336989437952,10,5.0,Berahino says hes determined to get his career back on track and help Stoke get back to the Premier League. #SCFC #TBPTV (Sky Sports) pic.twitter.com/qr5XiHVdYM
markocooper,336463041,1,1010632779158171648,5,5.0,TyC Sports in Argentina is saying that Sampaoli wont be involved in the line-up formation or substitutions. Hell accompany the team but have no input. http://youtube.com/watch?v=GZhbF9WQN8Y …
DeidraDukesFOX5,33099097,1,1010626376389615616,5,5.0,Hope your weekend is off to a great start! Join @FOX5Atlanta tonight at 6 @KERRYFOX5ATL @jeffhillfox5 @Cody_Fox5 @jaclynFOX5ATL @AlexaLiackoFOX5 for your latest news weathersports! #fox5atl #news #newsers #foxnews
BeanymanSports,295380693,1,1010623287381065730,5,5.0,Patrice Evra let’s out a huge “I LOVE THIS GAME!” as he says goodbye to the ITV Sport World Cup team  https://www.instagram.com/p/BkYXtmMjYmJ pic.twitter.com/DnZRWvSpKz
ShaunDPickering,2333960788,1,1012846216416243723,5,5.0,One of the all-time greats of our sport has sadly passed away. Great Long Jumper and Sprinter over a long and successful career. RIP Irena. https://twitter.com/PL1918ENG/status/1012827293234974721 …
2hot2coldsports,969684983597207552,1,1012830144891891719,5,5.0,Listen to Episode 23: The Bodies Issue Hour 2 by Too Hot to Handle Too Cold to Hold Sports Takes #np on #SoundCloud #podcast #PodernFamilyhttps://soundcloud.com/2hot2cold/23hr2
mlax_cghsnc,507552801,1,1012824869308895232,5,5.0,To those athletes playing a fall sport who are interested in the 2019 Lacrosse season FOCUS ON YOUR FALL SPORT. You owe it to your team your coaching staff and yourself. We’ll be ready for you when you get here. Everyone else it’s time to go.
iainmartin1,110437588,1,1012817704292626434,5,5.0,Is Roger Federer the greatest tennis player of all time? (Allan Massie weekly sport column for Reaction subscribers) https://reaction.life/roger-federer-greatest-tennis-player-time/ …
andpscott,146709191,1,1012814788395757569,5,5.0,#URU v #POR- possibly a battle of attrition or possibly a World Cup classic involving three of the best forwards in the game. @AFP_Sport preview:https://sg.news.yahoo.com/ronaldo-suarez-put-world-cup-dreams-line-portugal-190231072--spt.html …
TampaTarpons,22219559,1,1012810438629658624,5,5.0,The Tarpons are in Port Charlotte taking on the @StoneCrabs. Heres what you need to know about tonights series-opener  6:35 p.m. Charlotte Sports Park http://www.milb.com/documents/3/1/8/283491318/6.29.18_Tarpons_Game_Notes.pdf … https://tunein.com/radio/Charlotte-Stone-Crabs-Baseball-Network-s168099/ … @MiLB First Pitchpic.twitter.com/08DgkDxp6b
MariaTaylor7,37041552,1,1012803093237559296,5,5.0,Such a blessing to honor one of my role models. The @Vol_Sports legend and pioneer Joan Cronan #EnjoyTheJourney @joancronan @NACDApic.twitter.com/n38cdIxGL8
campbell__med,1446441258,1,1012799366518771713,5,5.0,Kudos to Drs. Mohammed Qureshi and Shaun Knox for completing the Campbell University Sports Medicine fellowship! pic.twitter.com/0KfFTbDL6y
HR_10H,1494190741,1,1011026575503122432,5,5.0,It is so hard to find words today!  It’s so hard to like our sport in these times. Our team sends our prayers to @JasonJohnsonRac family and team.  We love Jason’s smile racing and passion for his family. His @KnoxvilleNats win is historic. Simply the best.
PaperChampsNews,802603294287859716,1,1011016152003248129,5,5.0,Anyone who hasnt listened to the @davemeltzerWON episode of @TalkIsJericho really should check it out. Some really entertaining stories and a good insight into who Dave is and his chosen career as a wrestling (sports) journalist.
fornabaioctp,66816592,1,1011008826907287552,5,5.0,Sport Express is reporting that former Sound Tiger Sergei Ogorodnikov has died in an accident: https://translate.google.com/translate?hl=en&sl=ru&tl=en&u=https%3A%2F%2Fwww.sport-express.ru%2Fhockey%2Fnews%2Fpobeditel-yuniorskogo-chempionata-mira-pogib-razbivshis-v-avarii-na-vodnom-motocikle-1426147%2F … (h/t @enteryarik)
Karembeu,706797723715047425,1,1010999303656046596,5,5.0,Live from the Red Square for Optus Sport tonight after an eventful FIFA World Cup matchday! #WorldCup2018 #Moscow #RedSquare #rusia2018pic.twitter.com/WcoJFP2aD7
steveptid,1010628478969044995,1,1010991349682884608,5,5.0,What a day for England and our sport... England World Cup   Hamilton French Grand Prix  England with a 5-0 whitewashMakes you proud of our country  pic.twitter.com/dIvqf19I6e
Chantaljs13,796179387473391616,1,1010989582559608837,5,5.0,Nice to see all these normally anti-black Latinx celebrating Colombia’s football win! Hooray for humanizing the black people of your culture who contribute more than you all of the time but you only recognize it during sports!
holland_tom,239885144,1,1010986562090389506,5,5.0,I am aware the some men can feel intimidated by displays of #EliteMasculinity but wish to reassure my male followers that I’m not all #sport & #beer & do have a secret #metrosexual side as well...https://twitter.com/theoldbatsman/status/1010985239018131459?s=21 …
StVincentRHS,2799575007,1,1010981578388967425,5,5.0,16 years in the waiting. One very happy Housemaster. Very Proud of the SV boys today as they held their nerve to win a fabulous sports day. Well done to all who competed to make this the fantastic day it always is. #stvincentpridepic.twitter.com/d6Hqe11VXc
laura_hiye,796060876344279040,1,1010978029722570753,5,5.0,Its #calciostorico day here in #Florence the brutal and beautiful sport from the 1500s still played today every year on the day of the Patron Saint of Florence#artistsontwitter #sport #traditionalartpic.twitter.com/OKJHMSgGp4
AutomaticAndy14,2285694830,1,1010977626213646336,5,5.0,Do you love sports?Are you kinda funny?Do you love Lane Kiffin?Apply for this if you answered yes to 2/3 of these. https://twitter.com/studentusports/status/1009823636818202625 …
Detroit_Pride37,974614600539934720,1,1012118592966492160,5,5.0,Here’s an outlook of Detroit’s major sports teams:#Lions-Franchise QB offering hope for 1st Super Bowl.#RedWings-Rebuilding and caught in unfamiliarity.#Tigers-Rebuilding with focus placed on young pitching.#Pistons-Locked into mediocrity  for the next half decade.
lcardismo,990694974193881089,1,1012113311792615430,5,5.0,President of Portugal Marcelo visited Trump in the White House and the man literally trolled him in Sports talk and Politics talk I’m crying lmao.
JasmineADemers,426991587,1,1012095260476862464,5,5.0,Newest @dailywildcat edition featuring former Wildcat @DeandreAyton.#arizonadailywildcat #volume111 #issue39 #journalism #sports #news #arts #studentmediapic.twitter.com/XiJTqu1u9E
SlmSolo,327529234,1,1012092730082840576,5,5.0,I get that this is a team sport but I am beyond infuriated how the Braves have handled several 1st MLB callups this year. To put the player and their family through that after waiting a lifetime for the moment is a slap in the face. Horrible.
NeisdPE_Health,973365094687084549,1,1012090412352368642,5,5.0,CPR certification on this beautiful day at the NEISD Sports Park!  Being prepared for every emergency is #theNEISDway!!   @NEISD @NeisdAthletics @American_Heart #savealife #heartsmatterpic.twitter.com/8xwEwXfjcu
JFD1960,556229125,1,1007765887649280001,5,5.0,Sports news: Outbreak of norovirus in Aregentinas World Cup training camp.Doctors worried it may get Messi
dmcmodesto,201812880,1,1007765527304040449,5,5.0,Doctors Medical Center hosted its 4th annual Sports Screenings this week at Enochs HS for local student-athletes. We screened more than 1750 students and raised approximately $43750 - all of which will go back to @MCS4Kids and their athletic programs!pic.twitter.com/dpbrmTVu8R
RDJ2_5199,1297649058,1,1007765172956655616,5,5.0,If Tyus leave the Timberwolves I’m a be super fed up with MN sports and there is no way Jeff Teague should still be starting over him next year https://twitter.com/showtime_will1/status/1007763423118155776 …
YeeHawBrewing,2675074632,1,1007756889650851840,5,5.0,Some people call it soccer.Some people call it football.I call it a damn good reason to drink some beer and watch some sports.
jcgladiators,3418284424,1,1007750025814962176,5,5.0,Congrats to JCHS rising two sport athlete Maddie Horne on winning the New Balance HS Outdoor Nationals in Girls Discuss Emerging Elite.  Softball and track standout athlete @JC_fastpitch @JCHS_Track @LeadGladiator @FultonAD_craftspic.twitter.com/tZqWHJM8Ci
Lightskin_Jah,828457982467911681,1,1007745310926557187,5,5.0,I do what I do everyday in not only sports but also academics so I can one day repay my parents for everything they have done and to set my future children up for greatnessthank you  @nshss for selecting me@wpialsportsnews @NikkiP_3 @pellegrininat @210thspic.twitter.com/dzxQIOpZMF
cyclingweekly,20485710,1,1007744606270828544,5,5.0,This lab rat thing is costing results: Aqua Blue Sport boss decries 3T Strada mechanical problem | http://fal.cn/yJnf pic.twitter.com/3S2kXlUDoD
