user@mention,user_id,No of tweets,tweet_id,retweet_count,local influence score,Tweet
eliteexposure_,4870637535,1,1013541890359267329,6,6.0,If you don’t know this guy get to know him D1 Dynasty Dover High School Dover DE c/o 2020 6’ Elijah Allen I call him Jesus Shuttlesworth Cuz He Got Game! Coming to CP3 Live @lionsofbball @Coach_Rick57 @JamieShaw5 @AllStarPreps @Bblakney_Sports @D1Dynastyhttps://m.youtube.com/watch?feature=youtu.be&v=wk1fVU3fVNI …
USArmyBaylorDPT,820115025868324864,1,1004855290104295425,6,6.0,#TBT CPT Dan Norvell—1998–The first @USArmy Physical Therapist assigned to  2nd BN/ 75th Ranger Regiment examines a Ranger’s knee. COL @StanMcChrystal introduced sports medicine to the Ranger Medical Team leading to improved readiness. #leadership  @USASOCNewspic.twitter.com/IbDOzSTw6I
UKinTunisia,114751899,1,1004847936415719424,6,6.0,During a reception to celebrate the growing participation of women in sport Dr Saida Ayachi and Dr Sghaier Zouita spoke about the importance that gender equality in sport has on society while setting out their ambition to grow female participation in football across #Tunisiapic.twitter.com/l2FuO1SX8d
MouseRat_Fan,96632354,1,1004846316424519680,6,6.0,tennis is the crazies sport because theyll hit the ball back and forth for an hour and its finally over youre like nice! a point but then tennis is like actually thats only like like 1/4 of a point. then you need 6 points. and then thats just one set. and theres 5 of those
CoachUdofia,726068856,2,1004842040893591554,11,5.5,Assistant Football Coach at Flying Sports Academy U23 . Head Coach at Dynamo Fc U23 and Head Coach at Kash Football Academy U15 #Football #Passion #LightUpMyDreampic.twitter.com/NzFC3yGOw2
SmartState1,247358046,2,1008840025302167552,11,5.5,Pacific powerhouses Tonga Samoa Fiji and Papua New Guinea come back to Campbelltown Sports Stadium for the 2018 Ox & Palm Pacific Test on Saturday. #nrl
theballera,952693324875431936,3,1010671260869816320,16,5.333333333333333,A+ to Big Baller Brand clothing bureau for providing better business and gaining another satisfied customer. BBB satisfies thousands of customers from around the world and is proud to be America’s fastest growing sports brand. Welcome to the family @curly_jay_24(IG) pic.twitter.com/rVN0AGa6uU
WalkertownHigh,3524021735,1,1002692461830033412,5,5.0,Thx 2 our awesome Spring Sports coaches @WalkertownHigh ! Coach Smith @WHSFAChief Coach Bottoms  @LadyPack_Soccer Coach Drone  Coach Ward  @mcrews08 Coach Crews @PackTennis  & @WalkertownFB Coach Pardue  Coach Hall @MsHall_WHS  pic.twitter.com/CwKJcMYUHi
Aya__Marie,135588260,1,1008488793593208833,5,5.0,Between legacy (lineage) admissions + the athletic admissions for sports like crew lacrosse and equestrian where low-income and students of color are underrepresented its clear that the attacks on affirmative action are rooted in racism and not equality. Check out this thread https://twitter.com/James_S_Murphy/status/1007814404556165122 …
mazdzer,886896218,1,1008485362052816902,5,5.0,Dakujem (Thank You) Bratislava for being such good hosts for this years Luge Congress. One of the things I am most proud of is being able to represent my fellow Luge athletes from around the world at the highest level in our sport. This year’s congress w… https://ift.tt/2tdCFzz pic.twitter.com/CRUHRiWHRk
ringsau,300276390,1,1007049100779446272,5,5.0,Asbel Kiprop: Former Olympic champion gives up fight to prove innocence - BBC SportFar too many athletes give up challenging these allegations and cop the default max ban as a result. Guilty or not all athletes deserve access to their day in court https://www.bbc.com/sport/athletics/44477106 …
greasy_jr,992601918986899456,1,1007040445942136837,5,5.0,$fdm will surprise people nice little bit of news today. More promo Henri said “this will be a global brand” hard to ignore considering his past. Even if crypto / fan coins tank with BTC (this year) they have sports betting  @HenriHolm
PatMcManamon,27708542,1,1007018191028011008,5,5.0,The Browns said that JW Johnson the son-in-law of Jimmy and Dee Haslam will become an executive vice president with the Browns. Johnson’s background is in TV and marketing; he has worked at Pilot Flying J CBS Sports and RIVR Media and founded 3 Sons... http://www.espn.com/espn/now?nowId=21-40021999-4 …
NC_DECA,276735880,1,1007017242796740608,5,5.0,@NC_DECA would like to recognize Diana & Daija from @MaverickDECA. Daija and Diana joined together during their second year of DECA to participate in the Sports & Entertainment Team Decision Making role play. In their first year working together. . .
Equarius_Bldstk,181894192,1,1005587018766864385,5,5.0,The first Triple Crown winner not to have raced at 2yo - and so good to see 2 lines of multiple  Champion &  Champion HAWAII (SAf) in his pedigree!  JUSTIFY with a truly global pedigree and large international spread of owners is just what the sport needs!!    https://twitter.com/attheraces/status/1005583854491480064 …
POETICDRINK2U,19171455,1,1005960818918293505,5,5.0,A Boxing Videogame should have Tendencies Capabilities and Traits #WheresOurBoxingVideogame #Boxing #VIDEOGAME #FIGHTNIGHTCHAMPION #indiegamedev #indiegame #gamedev #sports #EA #EASPORTS #2KSPORTS #games #gaming #2K https://boxingvideogamesite.wordpress.com/2018/06/10/a-boxing-videogame-should-have-tendencies-capabilities-and-traits/ … via @wordpressdotcom
YahooForde,33395719,1,1005950522208202757,5,5.0,Belmont column: Bob Baffert lost his first Triple Crown race by a nose and worried hed never get another chance. Now hes the king of the sport and hanging with The King. Taking Justify from unraced in February to the Triple Crown is his best work yet https://yhoo.it/2sJ9oxe
KoachElder,153220953,1,1005930603357884416,5,5.0,Warriors Elite Sports TourneyChampionship Game@selectonebball-70YIIS II Success-56Carnal August 27pt 6asstWilliam Young 17pt 12asstGerard Stewart 10Caleb Hill 10LaTrell Moore 6pt 13rb@djones8301 @TXboysbasketbal @RcsSports @Top100Talent#AnotherOne #InMyKhaledVoicepic.twitter.com/2Zzopq3DOl
arupofficial14,869141869636198400,1,1005915512855859200,5,5.0,Congratulations To @IndianFootball For Clinching The Hero InterContinental CupGreat Enjoy With The @BluePilgrims at Offside Sports Cafe Bhawanipur. #Jay_Hind #Vande_Mataram #IntercontinentalCup2018 #InqilabEIndianFootball #BlueTigers #BackTheBlue #AsianDream #Championspic.twitter.com/THoPqxFanL
HburgClinic,494451604,1,1004494408073601024,5,5.0,Hattiesburg Clinic Orthopaedics & Sports Medicine Physical Therapy Connections and Psychology & Counseling are relocating to Hattiesburg Clinic - Tatum! This morning we celebrated the groundbreaking for the new facility with the community. http://bit.ly/2JmUSlb pic.twitter.com/1YVzxOi03K
Clement_Madrid_,449465077,1,1004479514741825537,5,5.0,This Was The Front page of @AsanteKotoko_SC Official Mouthpiece Kotoko Express after Referee Samuel Sukah ROBBED them last season when they Played  @AccraHeartsOak at the Accra Sports Stadium .#Number12 #Anas #IamAnas #SayNoToCorruption #Nyantakyi #Kwasiopolipic.twitter.com/8bFOtgOCJL
SodSolutions,33523675,1,1004479093931413504,5,5.0,Beautiful #Latitude36bermuda harvested @FireFlyEquip in PaigeTX at Thomas Turf. No waste with Latitude36. Cold&heat tolerant wear tolerant toughfor golf sports homes and commercial uses @USGA @TPITurfTalk @ShowcaseHome @gardenandgun @FieldExperts @LandscapeTexas enjoypic.twitter.com/KIP3w1tNXU
JayPaterno,24627889,2,1008820668459356162,10,5.0,Walt Bahr: Certainly a giant in Penn State sports history...but on a personal note he had tremendous integrity had a welcoming way about him & had a great family. People whove been around State College & PSU for awhile feel this loss of a big big man. https://twitter.com/PhillyDailyNews/status/1008786397770207232 …
TheLesterLee,355697532,1,1004475850891431936,5,5.0,A chick at a baseball game?? I didnt even realize that girls could understand sports...wait...AND shes drinking a beer?!?! Girls dont drink beer. This is nuts. Talk about wife material amirite? https://twitter.com/athlete_vidz/status/1004352771942965249 …
CropOverHUB,1665495474,1,1004473805333581824,5,5.0,UPDATE: Following an extensive briefing session with newly appointed Minister of Creative Economy Culture & Sports the Honourable John King & the new Permanent Secretary it was confirmed that the #CropOver season will commence with the scheduled events on the calendar.
Elijvhsoliz,184319103,1,1006669209751998464,5,5.0,It’s been forever.. but hey New Entity apparel I’m working up. Lmk if you’d sport these ideas. If I get enough likes and feed back I’ll go through with them. So lmk guys! #elijvhvrt #entityapparelpic.twitter.com/yJv9BIlkSj
RESERvedlizGiz,845621076977729536,1,1006665272185499653,5,5.0,Great  occasion take the chance face many immense  #challenges requires #Unity and #Enviroment #Climatechange United we collective corrective tackle we all have part2play Pres #Putin requires #Passion What it lacks is #Leadeship Sports #Fifa #Russia2018 is blessing in disguise
ItalyUN_NY,253137919,1,1006660646132486144,5,5.0,#Italian Association Progetto #Filippide participated #today in XI #CRPD#inclusion through #sport is at the core of its commitment and experience in dealing w/ #autism w/ a special focus on #minors #youth #women#2030Agenda #HumanRights #disabilities #COSP11pic.twitter.com/YgiMpZ8Q56
cfaAthletics,886629192175104002,1,1006655218321362944,5,5.0,What a fantastic year for our cfa Athletes! We have 5 guys and 5 girls going all over the East Coast next year to play sports in college! 5 different states! Check out their colleges and go support them next year!! #CollegeBound #NCAAD3 #ncaaD1 #naia #nccaa #cfaalumnipic.twitter.com/xacXHAU5C0
reaganroy,26751981,1,1006652778175979520,5,5.0,Per @uiltexas regarding player ejections: 1) Football - remainder of game + 1st half of next game. 2) Other sports (soccer exception) - remainder of game + all of next game. Effective August 1 2018 if approved by Commission of Education. #TXHSFB #bEASTTexaspic.twitter.com/1CeE4IgDdp
SamanthaSinger_,429579803,1,1006649111867686913,5,5.0,ICYMI: Fair board votes 5-0 to build @MLS stadium at #Nashville fairgrounds. Cost is $250 million creates 3500 construction jobs & would open by 2020. Plan still needs votes from Metro Zoning Board Metro Council & Sports Authority. @FOXNashvillehttp://fox17.com/news/local/board-votes-to-have-mls-stadium-built-in-nashville-farigrounds …
Nikki528,36880922,1,1011760751068016641,5,5.0,Never had any feelings for/against Domi but I hope Serena drags her by the root the next time they play. Bye girl bye! | Wimbledon: Not fair to seed Serena Williams says Dominika Cibulkova. - BBC Sport https://www.bbc.co.uk/sport/tennis/44619412 …
MalteseAnna,1418394145,1,1011758076888674307,5,5.0,PMFS = Professional Male FreestylePFFS = Professional Female FreestyleWhy is there a 40% payout discrepancy between the genders @NFAAUSA?  Its disappointing. This sport is supposed to be egalitarian.  We shoot from the same distances as the men; why are we not paid as much? pic.twitter.com/SfwB9I8P3L
ETNreisenweber,201136410,2,1012843448582524928,10,5.0,Spoke with @erie_seawolves Alex Faedo and Daz Cameron about their times going through the sports science testing with the University of Michigan. Faedo said he had a normal bullpen with a bunch of cameras watching everything while they had Cameron just run with sensors on him.
ayenoah__,895413950648426496,1,1011743460196405248,5,5.0,my barber: so do you do any sports?me: yeah I’m a cheerleader barber: ohhh you do it for the girls huh?!?me: hahaha no*me in my head*: sweetie no I swing the other way
MadeForPhilly,3219147574,1,1011719909427089409,5,5.0,One of the bigger Philly Sports Mysteries of 2018 is the hate that the Phillies and Gabe Kapler generate.- Rookie manager- Young nucleus of position players- 3 games out of first approaching the All Star BreakHow could one hate on this team that has exceeded expectations? pic.twitter.com/AjPhrg8LLY
NewmarketLib,739397324955373568,1,1011708248263675904,5,5.0,Do you like to move it move it? We like to move it move it. Why dont you move it move it down to your nearest library and borrow some sports equipment? pic.twitter.com/orPzx5FcOA
USAStadium,961164668,1,1009577266504925184,5,5.0,The 5th Annual USA Summer Showdown is July 12-15. We currently have 80 teams signed up in 14U-16U & 18U bracket. Wednesday July 11 we will have the USA Showdown Showcase for 2018-19-20-21-22 grads as well as unsigned JUCO players   See flyer for more info @2d_sports @slbaker12pic.twitter.com/dL4Yf1LfMb
4Jschools,380692063,1,1009542155956772864,5,5.0,School-based health centers are open this summer! Sports physicals vaccinations sick visits and more. Call for appt. Churchill clinic: M–Th 8:00–4:30 541-790-5227 North Eugene clinic: Fri 8:00–3:30 541-790-4445  Open: June 18–29 & July 30–Aug. 31 @PeaceHealth_Orepic.twitter.com/EtuLS4mvJa
shiyanming,929293681,1,1009922531078410243,5,5.0,Kung Fu stick basic practice today at @ukshaolintemple clearly Im out of practice but never give up keep going. #kungfu #shaolin #martialarts #ukshaolintemple #gongfu #gunshu #qigong #sports #wushu #chinesemartialartspic.twitter.com/PCyFuqPnps
ziu_hkrsrtm,544811247,1,1009907589881253888,5,5.0,https://www.amazon.com/dp/B0069FCW9C?_encoding=UTF8&linkCode=ur2&tag=amausrecman-20 …#KevinCronin #NealDoughty #BruceHallIve seen REO #twice at the #Sports #complex in #Kansas City #Missouri. I was #blown away #especially when they #played #Golden #Country. When they #played #Golden #Country I was #walking up from the #first #lev…
RedRaiderAD,3396697618,1,1003777838376456192,5,5.0,Lowell Pierrette gets better every time he steps on a track! His 21’-4” PR Jump at today’s “Last Chance” Meet at Lakeland HS @lakeland_sports was all he needed to give himself a chance for a NYS Long Jump Champion! #StateQualifiedx2 #IonaBound #RedRaiderNation #PlayInTheSandpic.twitter.com/95Sr7Kne3v
TeamILR,486706755,1,1003774521738956800,5,5.0,The impressive new TT Supporter t-shirt from Suter Racing. This quality item from Swiss Fashion Brand @Mithos_Fashion / @Mithos_Sport is available at the Suter awning (Penz13) in the @iom_tt paddock orhttp://www.suterproducts.com/bekleidung/tt-supporter-t-shirt-2018.html …Thank-you for your support.  #2strokeattacksTTpic.twitter.com/ZtSXQgjBI1
TheFliteCast,4330268063,1,1003771347649073152,5,5.0,Film box office is not a sports scoreboard. Nothing defeated Solo it simply isnt selling nearly as well as projected or hoped for a variety of reasons. But now you have some thinking they won against evil Disney and others thinking they lost to angry fanboys. False. pic.twitter.com/PizDH145LU
ConnerPrairie,7936772,1,1003751578640224259,5,5.0,Dont miss Curiosity Fair at Conner Prairie this weekend! Whether youre interested in sports chemistry technology science or something else entirely -- theres something for everyone on June 9th and 10th! View full event details here: https://buff.ly/2shrXbs  #ConnerPrairiepic.twitter.com/Ksm5OYp7tj
UWI_StAugustine,79095569,2,1003395908657188870,10,5.0,This July the Sport and Physical Education Centre (SPEC) hosts a Football Camp for boys and girls ages 7 to 17. The camp features qualified coaches from the Football IQ Academy. Dates: July 9 to 13 | Location: The UWI SPEC | Cost: $650. Learn more: https://buff.ly/2LaXqDp  #Camppic.twitter.com/Br80S4XFGa
TheRealMrACL,1265754078,1,1008848041468747779,5,5.0,Next State: KentuckyToday 9 members of the legislature announced theyre teaming up to explore the topic of sports betting w the goal to draft & file legislation to implement legal sports betting. Existing bills on file in both chambers have laid dormant for several months now.
savejmpsoftball,857458546035773440,1,1008831885697585160,5,5.0,Ne mentez pas a une communauté de sports recréationelle.... nous sommes fort! Dont mess with a group of pick up softball players... we are strong. #polmtl #SaveTheNorthField #softballpic.twitter.com/uVMyxgTbTP
CatholicRevivl,2597212364,1,1008817393022447616,5,5.0,*classmates talking about the soccer tournament*Me: Soccer is a terrible sport.Priest teaching us: Soccer really isnt even a sport. Its just an activity.Me: *looks at the camera like Jim from The Office realizing Ive met my unpopular opinion match.*
Sandy_D_Rooney,944275725875429376,1,1010673088785084416,5,5.0,Mississippi State vs. #3 Oregon State (Game 11)Live:> http://espn3itv.com/ncaa-baseball Stream live sports watch game replays get video highlights and access featured ESPN programming on your computer mobile device and TV with WatchESPN. Oregon State vs. Mississippi State Live pic.twitter.com/hT6Cufnz4t
aedison,1471021,1,1010671784922763264,5,5.0,it’s like the sports stuff. I recently got tons of tweets sent to me which included a photo or link to a story about a trans woman in a college basketball team. she’s older taller and broader than her teammates. okay. some would a cis woman of the same age and build be okay?
sadgaytrash,2320947182,1,1010671559869194241,5,5.0,like imagine being my flatmates and seeing me walk in dressed in pink short shorts a pink sports bra and a pink hat that says princess on it. the image of me stood there opposite the gay flag in our goodvibes living room is just the best fucking shit
MRobertsQLD,762470063261704192,1,1010662876992831488,5,5.0,In the words of Paul Keating no doubt Albo will tell Shifty I want to do you slowly. There has to be a little bit of sport in this for all of us. Take this to the bank. It will be slow. Painful. Bloody. But oh so predictable. And bereft of any ideas other than ego and bravado
per_jacob_solli,966052271061520384,1,1010642159144525824,5,5.0,Patrick is training his grandmother  #entertainment #la #beverlyhills #london #morning #football #cars #world #life #happy #positive #money #casual #usa #training #present #sport #nature #rolsroyce #hospital #friends #bestoftheday #billionaire #luxury #music #naturephotographypic.twitter.com/1CM6vrBbcr
damndestinee_,2858852915,1,1010620543425490949,5,5.0,#whoswhoatvcu Hey my name is Destinee- HPEX major w/ a pre-med tract - rising sophomore #vcu21- im from culpeper virginia- i’m super chill and friendly so i’m always down for anything. i also love nature music food and sports. feel free to hmu :) pic.twitter.com/rn0u8fEA8u
ppapoker,16896067,1,1012836359541698560,5,5.0,From @PokerNews: 37 states are considering how to properly regulate sports gaming online poker and iGaming. The Poker Alliance aims to make sure the voices of poker players are heard throughout the United States.https://www.pokernews.com/news/2018/06/poker-alliance-president-discusses-organization-revival-31299.htm?itm_content=pn-hp-hero-2 …
PetersenWill,88986363,1,1012831738223972354,5,5.0,Several execs in Denver sports have privately expressed in the previous month LBJ to Denver had potential legs that no one on a national scale would ever see coming. It’s always been about LA and still is but the Nuggets nearly had LBJ in 2003. 15 years later they’re back.
MaestroCares,466703239,1,1012811448609800193,5,5.0,Come out tomorrow rain or shine for the MCF 5th annual Yard Sale. All proceeds benefit orphaned children in Latin America and U.S. We will be having a variety of items on sale including home goods furniture sport clothing shoes etc.....#chicago #yardsale #maestrocarespic.twitter.com/zNxk045IBa
CSShowcase_LV,1011664582564241408,1,1012810697640538112,5,5.0,Connected Sports Showcase is very proud to feature - Coach Jhared Simpson of the Fort Wayne Mad Ants (NBA G-League) to our Las Vegas event -  Coach finished his 2nd year as an Assistant Coach for the Mad Ants in 2017-18!  @Jsimpson131
ajsconnect,986901835746283520,1,1012796306060963840,5,5.0,ALL NEW AJS SPORTS COLLECTIONTHE HOTTEST CLOTHING IN THE GAME!!!https://ajsconnectstore.co.uk/collections/ajs-sports …LIKE SHARE & GET YOURS!! JUST FOLLOW THE LINK#UKSmallBiz #SPORTS #gym #boxing #MMA #Fighting #Champion #thebest #fight #Hardwork #gymlife #gymmotivation #awesome #bestofalltim #AJSSPORTSpic.twitter.com/AHt8Swem6g
JacindaBunch,30754878,1,1012121332069347329,5,5.0,Iowa Rockets 16-1 Final Day 3 UpdateDay 3 Crossover Game vs AVA 16N Schumacher 25-17 W25-7 WI6-1 moves on to Gold Bracket tomorrow at 10 am Eastern!!!!!!!! They will be playing again at ESPN Wide World of Sports  pic.twitter.com/QSIc7y2vR6 – at Orange County Convention Center South Concourse
WINYRadio,135251333,1,1012107067056902144,5,5.0,FROM THE SPORTS DEPARTMENT: PSA ATHLETIC HALL OF FAME CLASS ANNOUNCED!In the spring of 2018 the Putnam Science Academy administration team formed the PSA Athletic Hall of Fame. The purpose of the Hall of Fame is to... https://www.facebook.com/winyradio/posts/2040129699332589 …
trigonis30,235272592,1,1012106736805613572,5,5.0,Grassroots Hoops at Crossroads: @usabasketball was designed to organize our natl teams for intl competition & promote grow & elevate the sport of basketball through service & leadership. Not be Americas Big Brother (George Orwells 1984). Should lead NOT dominate US hoops
DEpressON2,808309544652771328,1,1012081761554190336,5,5.0,So proudJack won 5 out of 5 races at his sports day and proved that none of us have to jump through hoops on others instructions let’s just enjoy the journey and bring joy and laughter to everyone. #mHealth #togetherweinspire #letsdothis #Depression #anxiety #together #hopepic.twitter.com/zXz22NZAX3
bcringette,92389329,1,1012080031508467712,5,5.0,Looking for something to do on Canada Day? Come to Sport BC Summer Warm-Up to try out Ringette and many other sports!Join us for a free diverse day of activity celebrating sport community & Canada in the heart of Vancouver! #CanadaDay #SportBC #Ringette #RingetteBCpic.twitter.com/ixdW7yHAPh
announcerphil,185695742,1,1012075447356739586,5,5.0,Some #boxing fans need to realise that it’s a business first and a sport second. As long as AJ beats Povetkin him vs Wilder is a bigger fight next year than it is this year. It will sell more PPV and gross more money. It’s frustrating but it’s also a fact.
NoonInKorea,809470408009207808,1,1007765873665499136,5,5.0,Rodman spent more time with KJU than prolly any other Westerner so his views are sought after. What was the turning point in NK-US relations? PyeongChang. Sports & music venues are great occasions for starting dialogue. Pres Moon had a very good idea and made his overture there
SteveCaritas,154910558,1,1007751472451383297,5,5.0,Kids in sports can be very tough to deal with. Parents are worse. Advice to save your dignity:1. Cheer for your child.2. Let the coach coach.3. Appreciate that coaches have given their time.4. If you feel the urge to snark don’t.5. Don’t live through your children.
Oatesspecialty,97364676,1,1007747257775656961,5,5.0,Baseball is a game of explosive movements but is often trained like an endurance sport. Too often baseball players are running poles or some other type of long distance running. They need to train explosively to match the demands of their sport.http://ow.ly/ERvm30kwvkt pic.twitter.com/cOcK4UJG4R
CoachL1,347646860,1,1007728795703562240,5,5.0,In sports skills and fundamentals are learned but class & sportmanship are taught. Just like in the real word hard work & survival are learned but love & hate are  taught.  Learned =picked upTaught= focused onWe must TEACH our youth!
FrappMocha,138906028,1,1003418036752142336,5,5.0,A late entry 4 #CIBsunday I have #nba Street Vol. 2 for d #Nintendo #GamecubeStreet was originally from d EA Sports BIG series. There were 5 physical games released & a couple of online games in .Anybody here pumped up for Game 2 between #Cavs vs #Warriors ?#GamersUnitepic.twitter.com/ihUR2JGI0M
ShockZ314,557230438,1,1003414417583812611,5,5.0,Hello! African American bisexual (questioning) ace. I (currently) write m/m romance. In His Corner is a sports romance featuring two African American professional wrestling heroes. Thank you! https://read.amazon.com/kp/embed?asin=B07CBY2JQB&preview=newtab&linkCode=kpe&ref_=cm_sw_r_kb_dp_rvhfBbYM6JM1A …
polevaultpower,18649326,1,1003413149591134208,5,5.0,I lobbied our Board of Directors to make our banned/suspended list public at the March 2017 Board Meeting. It was finally made public October 2017.  ALL NGBs should have a public list. Its ridiculous that this is still a conversation that needs to be had in any sport  https://twitter.com/hogshead3au/status/1003286460353609728 …
LOLKNBR,552404975,1,1013550700066770944,5,5.0,BREAKING: Kuip says Flem yelled at Hank this morning for trying to cut the line at breakfast. Kruk reports Hank also tried to pick the peppers out of his salsa. Disgusting unforgivable behavior from a veteran beat writer. What in the wide world of sports is going on?
KarismaLucatero,2689550328,1,1013541647735373825,5,5.0,Hardest working athletes ranked by sports:13. you12. can’t11. rank10. them9. because8. each7. sport6. pushes5. athletes4. to3. work2. harder1. Wrestling
0utfitRepeater,863152470385508352,1,1013527963059408896,5,5.0,Why dont Indian mothers raise their daughters to be confident the way they raise and hype their sons? I have seen the prettiest of women feel like theyre ugly while men who wear sports shoes with formals think theyre some hot stuff who every woman would die to sleep with.
jaxdotcom,15572679,1,1004861813786333184,5,5.0,Jamie Shelton the president of bestbet will be the 2018 Gator Bowl Sports chairman overseeing the TaxSlayer Gator Bowl the JaxSports Council and JaxSports Charities. http://www.jacksonville.com/sports/20180607/bestbet-president-jamie-shelton-named-gator-bowl-sports-chairman?utm_source=Twitter&utm_medium=social&utm_campaign=jaxdotcom-SND …
