user@mention,user_id,No of tweets,tweet_id,retweet_count,local influence score,Tweet
Sports_Night,224736303,14,1004839068377677824,103,7.357142857142857,What do you think is the real reason Terrell Owens declined his invite to the Hall of Fame?Best tweets make @Sports_Night!#NFL
JSnodsEnq,4113068915,3,1010660932001857536,22,7.333333333333333,‘20 @LovTigers_AD F receives an offer from @XavierWBB #cincyrecruiting @mlaughman @sspringersports @EnquirerShelby @JRichardsonENQ @AdamJBaum @ECC_Sports @CoachDParkerhttps://twitter.com/jillianhayess/status/1010651609171361799 …
2018USAGames,266115874,3,1013570537874833408,22,7.333333333333333,Team @espn w/@ApoloOhno @marshmellomusic support #inclusion today at the Unified Sports Challenge #2018USAGames! #ChooseToIncludepic.twitter.com/mfQ5Lk47PY
Illibuck1,572373039,1,1002686685002522625,7,7.0,Mad props to the @whitesox sports med team here. Herm BBall and @MOR_Docs @JeremyAllandMD #Teamworkhttps://twitter.com/gma/status/1002517677171081216 …
FryTheSportsGuy,823971906353102848,2,1004491655750279168,14,7.0,Tonight on KTVF Sports! The Top Five plays for our High School teams from this Spring Sports season! pic.twitter.com/KHRimYCJ5B
officialRTE2,988488515922092032,1,1002679218113859586,7,7.0,scr doesnt give a fuck about any extra curricular that isnt a sport https://twitter.com/ellendelaneycti/status/1002674703482449920 …
ESPNWWOS,29492701,1,1008491986251370496,7,7.0,Happy Father’s Day to all the sports Dads and Coaches from #ESPNatDisney!pic.twitter.com/OqFz9khamR
kierstennaveryy,2963172341,1,1008488854070931458,7,7.0,Taking a Benadryl in the middle of the day should be an extreme sport. Where will I fall asleep next? Will I wake up in an hour? A day?
kolo94303,55417551,2,1010982383745581057,14,7.0,2018 @All_Poly_Sports camp done. Thank you to everyone who had a part in putting this camp together! See you all next year! pic.twitter.com/E6sDQ9BOxv
kentcricket,24687268,1,1008463309866192897,7,7.0,Video highlights: Kuhns 127 steers Kent to @OneDayCup final https://www.bbc.co.uk/sport/cricket/44514707 … via @bbcsport
LAmaroongold,745755397756166145,1,1007044032164515840,7,7.0,Here are Loyolas spring varsity sports teams award-winners (to be clear these are given by the coaches). http://www.maroonandgoldsports.com/2018/spring-varsity-sports-teams-awards/ …
CKAwrestling,73120275,1,1007037578258862080,7,7.0,Coach Keen’s tremendous contribution to the sport of wrestling still impacts us all today! pic.twitter.com/EnGmQPD7Pj
Integrity_BBall,2434699403,1,1007031922944610304,7,7.0,Congratulations Fellas!!! Thanks for representing Integrity Sports in the 2018 West Reading Junior League All-Star Game pic.twitter.com/mvdtN8VPVb
dgworek,315185972,1,1007030111877595136,7,7.0,@11DayPowerPlay  Leukemia Warriors training at Impact Sports tonight. #kidsmakinadifferencepic.twitter.com/6rfW2t5X1j
LowriCerysEd,100371682,1,1007020133154508802,7,7.0,Bendigedig! So proud of the @AHK_Wales team @activity4kidz @emily_marchant @anna_sian @_KellyMorgan_ @DrAnwenJones @DylanBlain @naldaw @DrCainCTClark @DrSRPWilliams @PublicHealthW @PlayWales @sustrans @sport_wales @juliehobdaycydc et al. Looking forward to the next steps for AHK!
shsathleaders,916267066948313093,1,1005599876867067904,7,7.0,Way to go @SpeedwaySftball ! You represent the school and the town so well.  Love that fact that most of the girls are involved in multi sports and activities. Everyone is so proud of all of you!!
ChapD_,251359372,1,1005598156757667840,7,7.0,Extreme sport: Makin white people feel uncomfortable...
Ubercapper,360999058,1,1005590595543412736,7,7.0,Mike Smith is one genuinely humble man. We are blessed he is associated with our sport.
JHunter023,403696758,1,1005584338472374272,7,7.0,Watching Ovi celebrate after winning the cup has got to be one of the coolest things that has happened in sports.
ConcordBBB,993933894465589249,1,1005579857932226564,7,7.0,Doesn’t get any better than this. John Beilein of Michigan. Speaking the truth for all to hear in all sports. Terrific stuff! pic.twitter.com/stwaGZi5mJ
BIUK,294176860,1,1005570232948350976,7,7.0,This table tennis bar has interactive tables that turn the sport into a video game pic.twitter.com/PwZPy1stSs
_YoungWave,285327954,1,1005567802223284225,7,7.0,Ok after talking to my sports writing potna and seeing this phot I believe him pic.twitter.com/JFeiMn2V65
TheVoiceNews,47591958,1,1005566205288222721,7,7.0,A host of black professionals across the health sector sport business and more are recognised in the Queen’s Birthday Honours list http://bit.ly/2JCCIzd pic.twitter.com/kogRZJu3P4
JAAVRGSJ,2290364641,1,1005958398633021440,7,7.0,stripping should be considered a sport I tried balancing myself on a pole and I damn near got put in a  coma
alyhess_3,2392986144,1,1005939640619159553,7,7.0,I never realized how much time I dedicated to sports until I started laying around the house wondering what the hell I was suppose to do with my day.
malcolmcannon62,126056159,1,1005928005997297667,7,7.0,So incredibly proud of and pleased for @Beagleboy172 @MeerGoose11 and the entire squad support team and office at @CricketScotland on their victory over @ECB_cricket great result for Scottish sport @ClydesdAileen @ScotGovFM
drkellierose,2642032185,1,1004494199243169792,7,7.0,This is is a great opportunity for aspiring sports practitioners to get some experience. We’re doing some great stuff this year - come and get involved! https://twitter.com/harperperform/status/1004322687127379968 …
ABQBizFirst,26061792,1,1004485711263944704,7,7.0,BREAKING: New Mexicos kickin it with addition of a new sports team http://bizj.us/1pmf2k
mclaff_cfr,3859251880,1,1004477132674879488,7,7.0,#ThisIsGreatIfeWhere sport complex has finally become Shiloh annex ooo
Nenagh9,20446102,1,1004475691180679171,7,7.0,Thank you @FrancoFrattini  this means so much Sport must never have animal cruelty attached to it ....We thank you for all that you do #WorldForeverInYourDebt
LoganJohnson04,2851226093,1,1004473033124384769,7,7.0,Some of today’s @hebronathletics 7v7 V @CHHS_Sports @BerkmarFootball Hats off to our Seniors & @ColtenGauthier for putting the ball on the ALL DAY!  @HustleInc7v7 @therealkwat @ErikRichardsUSA @PlayBookAthlete @RecruitGeorgia @tballardqbcoach @Tjedwards82 @OreyFerrell247pic.twitter.com/vugPqtSTCt
strong_science,816305914282029056,2,1009566517359345664,14,7.0,Muscle Slack and High Velocity Training #sports #sportssciencehttp://strongbyscience.net/2017/05/23/muscle-slack-high-velocity-training-integrative-approach/ …
kustoo,7098702,1,1006680178414714881,7,7.0,NEW VIDEO ALERT:UNBOXING: Air JORDANS and a $250000 Sports CarVIDEO: https://youtu.be/0t86eFQ_Szg pic.twitter.com/tY4QCHp81E
ItsTheBoss_Tho,1898314088,1,1006666775092776962,7,7.0,#WhoswhoNCCU -Kadajiah-Junior (Sports Medicine)-252 - I seem mean but I’m really lit.  pic.twitter.com/SGt5tVBoRC
YeagerSpartanFB,3052344344,1,1006662545128742912,7,7.0,This is one of the best sports stories and videos Ive ever seen. Testimony to the power of sports to develop relationships that will last a lifetime.http://www.sportingnews.com/mlb/news/ty-koehn-jack-kocon-minnesota-high-school-baseball-video/hkpbioyitqif1gkaggnqwy38a …
Adweek,30205586,1,1006646098629414912,7,7.0,Ad of the Day: Hidden somewhere on Earth this card will give the finder free sports gear for life: https://adweek.it/2sX5OQn pic.twitter.com/C4zQhymhSh
MattThompson91,323474014,1,1006640203036086272,7,7.0,Sport teaches so many positive life skills - up their at the top is humility and respect. https://twitter.com/espn/status/1006264953345576960 …
JasonAllanUK,3050249413,1,1006638519387869184,7,7.0,Damn if boredom eating was a sport watch out Mo Farah
craig_jipson,3367489407,1,1011760540845264896,7,7.0,Edward Little Men’s Basketball wins team of the Year Winter Sports at Varsity Maine Awards pic.twitter.com/4skY1ujAKf
POSTwrestling,928918156537503744,1,1011731598302011392,7,7.0,The WWE confirms domestic rights deals with USA & Fox Sports SmackDown moving to Fridays in 2019https://www.postwrestling.com/2018/06/26/the-wwe-confirms-domestic-rights-deals-with-usa-fox-sports-smackdown-moving-to-fridays-in-2019/ …pic.twitter.com/mtjxG3o24i
ShutdownLine,333092717,1,1011730815531864065,7,7.0,Amateur sports psychology is one of the things I hate the most about sportswriting. https://twitter.com/dellowhockey/status/1011725219529150470 …
ABC7Robert,124953237,1,1011720378530574337,7,7.0,Tonight at 6:20 this former Georgetown football player takes the biggest walk of his life. @ABC7Erin has this amazing story in sports on @abc7news.pic.twitter.com/zZMwjXsdbH
JoQuinn22,917584154,1,1011712312389066758,7,7.0,watching the reactions of a team and it’s fans during the World Cup gives me goosebumps. people from all walks of life brought together by a sport try and tell me that’s not beautiful.
vintagexpast,904742495703183360,1,1011707956226863106,7,7.0,Twitter keeps showing me sports news because I’m constantly looking at sexy athletes I don’t even watch sports pic.twitter.com/8kKqOMBAQY
islandproball,357125656,1,1009586253954764800,7,7.0,Basketball is a global sport that has no borders. On this #WorldRefugeeDay we stand with millions across the world pursuing their safety and freedom.
langwhitaker,19826588,1,1009572621875335169,7,7.0,Gonna ask to borrow the sports almanac to see who the @memgrizz are drafting tomorrow nightpic.twitter.com/U1vHPOmhY1
UWEMScSportEx,285068897,1,1009567770386759682,7,7.0,Fantastic opportunities like this become a possibility when you have an MSc in Sport & Exercise Psychology. Check out our course here: https://courses.uwe.ac.uk/C8901/sport-and-exercise-psychology …https://twitter.com/jobsinpsychol/status/1009442919080742914 …
Joshbrown66,237451119,1,1009555417129553920,7,7.0,Big time dual sport athlete just left campus after his unofficial visit. ⁦@calpolystangs⁩ ⁦@calpolyfootball⁩ #comedobothpic.twitter.com/7UZsTy3O8B
AppObResCen,992079934280683520,1,1009549276941348864,7,7.0,@itvcalendar covering the launch of the LBU Applied Obesity Research Centre today @PinkiSahota @profpaulgately @BeckettResearch @Carnegie_Sport @DrStuartFlintpic.twitter.com/NEmeJrSHzE
PatMcLoone,1093053926,1,1009540263319130117,7,7.0,Our @lenfestinst fellow in Sports @why_drb makes her debut with a fine piece on tennis star Sloane Stephens coming to town July 19 to play for the Freedoms.http://www.philly.com/philly/sports/sloane-stephens-us-open-title-french-final-cheesesteak-philadelphia-freedoms-20180620.html …
kerritroyer,1429146600,1,1009945521308520448,7,7.0,Sports Careers in KC panel at @Populous with @kualumni. Great to see @JordanRBass on the mic moderating this rockstar group!pic.twitter.com/qDRIz1wBzZ – at Populous
Independent,16973333,1,1009908640684429314,7,7.0,A £1m military drone flew over a packed primary school sports day - then there was a crash https://www.independent.co.uk/news/uk/home-news/drone-watchkeeper-crash-school-sports-day-failed-mod-military-spending-projects-defence-equipment-a8409206.html?utm_term=Autofeed&utm_campaign=Echobox&utm_medium=Social&utm_source=Twitter#Echobox=1529611776 …pic.twitter.com/ei4f4zkDBd
RV_SportsMed,800703623411810305,1,1009902004318154753,7,7.0,Are you registered through Genesis for sports at RV? If your answer is no click the link below and completed this mandatory process. https://sites.google.com/rvrhs.com/rv-sportsmed/athletic-registration?authuser=0 …
BobGreenburg,483881032,1,1003786062257369088,7,7.0,So the Hickory Softball team is the last team standing out of Mercer County for the 2017-18 High School Sports season.
axios,800707492346925056,1,1003783206296961024,7,7.0,Delaware beat New Jersey to the punch as the first state after Nevada to legalize sports gambling. https://www.axios.com/delaware-sports-betting-1528120616-86b0a6eb-b6b2-4a22-82b6-b283375d02d5.html?utm_source=twitter&utm_medium=social&utm_campaign=organic&utm_content=1100 …
PaulZeise,312198098,1,1003780902806310912,7,7.0,Good this is a nice start now lets cancel all White House trips for sports teams for the rest of creation. https://twitter.com/AdamSchefter/status/1003780553085243393 …
iowastatedaily,15832179,1,1003780073164541952,7,7.0,Are you ready for the Iowa State Daily sports podcast lineup kicking off with Podcasual Friday? Its only a few days away and features @noahrohlfing @LesMwirichia @TrevorHolbrook  @KobeRianGaines and @k_rambo_.pic.twitter.com/ZjGSk3PeM6
BNBlitzNow,893185762908405761,1,1003771453781762048,7,7.0,See the whos who of the sports world at the 32nd annual Jim Kelly Celebrity Golf Classic. Gallery by @hsjrphoto: http://bit.ly/2xJY8Wc pic.twitter.com/WJWydhwfu6
UFCPI,710209718753431552,1,1003769679616196609,7,7.0,Ensuring that local pro sports teams are prepared to defend themselves should competition require it is our gift to the Las Vegas community. https://twitter.com/lvlightsfc/status/1003755897036800000?s=21 …
KvilleFootball,3213555420,1,1003752879734353921,7,7.0,KHS Sports Physicals this Saturday 6/9/2018 at High School 8am-11am. Please RT.
NBCSNationals,2319354187,1,1003747947559968774,7,7.0,it sure is a shame that there is no nats game tonight good luck finding some sports to watch tonight DC
BucksPR,431082451,1,1008852881636843520,7,7.0,“We’re thrilled to have one of the toughest and most action-packed sports in the world come to Milwaukee in October. https://on.nba.com/2JYEiZ5
DanielHemric,218331649,1,1008831072719855616,7,7.0,Awesome time with these guys right here from @alscoinc today! Your partnership with us @RCRracing is what our sport is all about & it all starts with surrounding yourself with good people. It’s a pleasure being associated with you all thanks for having me today @NCRLA Classic!pic.twitter.com/5AFVfmN1OL
kevintresolini,61100634,2,1010642716781367296,14,7.0,Always one of best scenes in #netde sports as buddies and players for @DFRCBlueGold have pregame meeting. #delhspic.twitter.com/Z3dKRchX8J
ahmadf_o,2938827314,1,1010646269340061698,7,7.0,Im glad Thiago finally decided to switch sports but this sport has more injuries are you sure about this man pic.twitter.com/OkhU4nlHJN
CalQuinn_,213929081,1,1010630716907048960,7,7.0,When non-sports girls tweet about sports... “defense of line”... It’s *defensive line pic.twitter.com/ReYJvxjBXl
PBS,12133382,1,1010628523646685190,7,7.0,As traditional sports like baseball and football struggle with stalling viewership a new kind of sport has emerged with huge appeal: eSports. (From @NewsHour)https://to.pbs.org/2tueTPQ
Alaaego,276329275,1,1010620176323227649,7,7.0,BBC Sport - World Cup 2018: Salah used for political capital as Chechnya host Egypt training http://www.bbc.com/sport/football/44451415 …
KNSports,309401267,1,1012846939505942528,7,7.0,Be sure to pick up tomorrows News for the unveiling of this years All-County softball teams as voted on by county coaches and KN sports staff! @SjcaSports @TrempAthletics @WestoshaCHS @WilmotSports @RedDevil_AD @ITHS_Athletics @SLPacers
heraldscotland,157997359,1,1012834355700477952,7,7.0,Plans for new £47m Meadowbank sports centre given the go-ahead http://www.heraldscotland.com/news/16324632.plans-for-new-47m-meadowbank-sports-centre-given-the-go-ahead/ …
raincityseries,458063246,1,1012817868348579840,7,7.0,Be grateful for every day that Dan Gilbert doesnt *co-own* your favorite sports team pic.twitter.com/D3srNFmkon
FatouSadio,32666997,1,1012816391177691136,7,7.0,For those who asked why I was almost in tears when @smithpelly23 resigned this is it. He is so important to the sport & I’m so glad he’s ours. Thank you @kendra__andrews for this wonderful piece. Cc @Capitals @PostSports #ALLCAPSpic.twitter.com/Ef0fqPhM7T
D0UGFRESH,108771395,1,1012811896343482368,7,7.0,Someone tel lithe US authorities they have the wrong man - he couldn’t hit a thing this season
woodsamantha,22867917,2,1012095660261142528,14,7.0,Good opportunities here for my sports folks.  Added bonus: Become my frenemy. https://twitter.com/CecilyFaenza/status/1012094719629750272 …
SmarterGood,37595560,1,1011005695389417472,7,7.0,.@jeffskoll has always said that social change is a team sport. If we don’t work in this team-based way we’re holding back the change we’re trying to affect—@laspindle @SkollFoundation #AspenIdeashttps://twitter.com/smartergood/status/1011004754783170560 …
WeGotDopeKicks,3298496779,1,1010996758237863942,7,7.0,Stussy Sport Nylon Short in Orange is available w/ FREE SHIPPING! SHOP HERE  https://bit.ly/2t22m6R
DonnieB86,946629498476298240,1,1010981705618948097,7,7.0,2018 High School Sports Report “Co Miss Softball Player of the Year” #teamjackets #2019senioryearpic.twitter.com/P4a8IsHxxj
shannon_fiona,627336357,1,1010978722961416194,7,7.0,Delighted to be part of the National Coaching Tutor Team. It’s great to be able to give back to the game and assist with the growth and development of such a great sport. https://twitter.com/gaa_handball/status/1010973556614844416 …
coachforce,47669105,1,1012117722887524352,7,7.0,Thanks to Lost Nations Sports Park for hosting the North Shore Summer League. Positive experience for all teams... Done. Next. #TLSTE  #familypic.twitter.com/Atxssslz0d
tjoe54,435275773,1,1012108860319059968,7,7.0,@ArFCAArkansas Camden-Fairview has a Jr. High Football job open. Spring sport will be track. Teaching position is open. Please send info to Coach Monden at jmonden@cfsd.k12.ar.us
sarahmh0218,740319722642628608,1,1012108675153121280,7,7.0,LOUIS LIKES SPORTS SO SHKSUNDHDND #TeenChoice #ChoiceFandom #Directioners @onedirection
stuartpstevens,1543986138,1,1012101318331248640,7,7.0,Sweden winning Mexico advancing Germany losing. Mostly sport  reminds us we have a heart by breaking it. But sometimes there is bliss...#WorldCup2018https://twitter.com/siavoushf/status/1012011145660715008 …
scuddacam021,971048996092264448,1,1012092807882866688,7,7.0,Great camp today @UrbanaU_Sports thank you to @tyhaines16 and the whole Urbana coaching staff for making this such a great experience.pic.twitter.com/iuTwJvucbj
HiImKeith_,297066949,1,1007764026326208512,7,7.0,The sad Brazilian that became famous last World Cup past away in 2015 of cancer. His sons are keeping his love of the sport alive this year. pic.twitter.com/dyDFCHnZHk
JackieeeFlo,3232886269,1,1007745294883311622,7,7.0,When the World Cup is on the world watches. No other sport can top it idc idc.
Fox9Sports,24027780,1,1003418840976355328,7,7.0,TONIGHT on FOX 9 Sports NOW 10:35pm - Get ready for some fun as @toriihunter48 joins us to talk about his role in Mondays #MLBDraft this years #MNTwins team and much more!pic.twitter.com/49D85yBXxL
j_spencer10,853012597683220480,1,1003407948977262592,7,7.0,Field hockey players are honestly the biggest supporters when it comes to sports and that’s stamped  https://twitter.com/___madisonrenee/status/1003354177899237378 …
ScottABC7,22805792,1,1003403133182205953,7,7.0,The proof is in the pudding. D.C. LOVES their sports. Look at this rating from last nights Game 3.Way to go Caps fans. Keep it up. This is a SPORTS TOWN! https://twitter.com/NBCSportsPR/status/1003283212913860609 …
shawnjustice,18709160,1,1003398433888141312,7,7.0,Floss off!  Thanks for being an awesome sport Niko! #CrewSCpic.twitter.com/nKk0FxB9zo
theywantboog,717398346676219904,1,1003383399220998144,7,7.0,pickerington central is states champions in 3 different sports this year! and a final four appearance .. #2018
joneil97,1226415756,1,1003374995219902465,7,7.0,The WCWS is breaking my heart..I am not ready to be a senior and leave this sport behind
iSprint___,2320984967,1,1003374991830847493,7,7.0,If there’s any sport I see a real athlete getting slept on in it’s basketball... so many real hoopers never get a chance
Wojispn,1009639332834086912,1,1013547349518397441,7,7.0,Paul George and Westbrook have scheduled their wedding on August 15th reported by multiple sources at Yahoo Sports
MickFoley76,741188809,1,1013542232794763266,7,7.0,Why in the wide world of sports could the Round 4 football qualifier draw not have been made last night or even at some point during the live TV games today? We knew all the teams before 9pm.
HoodedMan,20001303,1,1013534767973916673,7,7.0,All sports are a horrible activity a show of gladiators distracting people with bread and circuses. #WorldCup
hannahjoseph199,1954677344,1,1013530833330819079,7,7.0,Thanks for supporting me and women’s sport! Need more people like this on the hype #showup BRING ON THE FINAL https://twitter.com/jonathanjoseph0/status/1013525813239705601 …
RachelDePompa,35292538,1,1004864977457549314,7,7.0,Literally have a scrapbook filled with all the games I went to as a kid with my dad. #ALLCAPS I’ve been waiting for this sports moment my whole life. @Capitalspic.twitter.com/gKwvlHfQaw
LillyAnnOHora,291159077,1,1004847321786576896,7,7.0,Please please please complete this survey and support women in sport ! https://twitter.com/sportireland/status/1004714548077780992 …
CoachKAdkins,533207657,1,1004841209418825728,7,7.0,@SpartanRecruits @sparta_sports @Coach_Bland Great work today at the KSU Passing Camp! Super organized as always - first class all the way! #Spartanspic.twitter.com/0q4P2QoZAS
_jallen13_,307413664,1,1004835496399441920,7,7.0,Cy Springs WR @darius_D1 in the lab @ALL_EN_SPORTS you’re up now Lil bro #WeALLEN https://twitter.com/darius_d1/status/1004828252568018949 …
NEABanditElite,712823837792931842,3,1010666628114153479,20,6.666666666666667,College coaches in a few years your going to have to fill that freshmen spot 2022 Devares Whitaker one of the top PG in the state @CoachJordanUALR @CoachBalado @RustonRifle @ARBballRankings @UCAMBB @ARHoopScoop @NEABanditElite @OleMissMBB @42_sports https://twitter.com/lilvares1/status/1010528765720526848 …
okprepsextra,2755646617,17,1010999618774159360,112,6.588235294117647,Photo gallery: Highlights from Saturday nights 2018 All-World Awards celebrating the best in high school sports http://ow.ly/72rP30kDO0o pic.twitter.com/gkvzeIeXBG
BarcaLisa10,3067839730,2,1012834816524472321,13,6.5,Argentina. Many people might think that’s incredible stupid but Messi is the best thing in football and what I like most about the sport
DamonSalvadore1,998637114,2,1003370071258009606,13,6.5,Im starting to think the LeBron/JR Smith photo may take over crying Jordan as the No. 1 meme in sports. pic.twitter.com/rz0nO2xkGx
_JakeRussell,222226370,2,1004486453311746049,13,6.5,Let this sink in folks. D.C. officials... planning a parade route... for a D.C. sports team... winning a championship. https://twitter.com/mattacklandfox5/status/1004479766802718720 …
WhatToWearHQ,879571075864158208,2,1008825439719182336,13,6.5,Stussy Sport Nylon Short in Orange is now available to purchase with Free Shipping! BUY HERE: http://bit.ly/2MvQrqb
arrogantera,617639511,2,1013561640485376001,13,6.5,Stussy Sport Nylon Short in Orange is now available to purchase with Free Shipping! BUY HERE: http://bit.ly/2MvQrqb
USABChamps_West,561799041,2,1012793952217456640,13,6.5,Our  winners Sports Academy Dukes ended their week in Arizona with a win as well.Congratulations guys! #Champs18pic.twitter.com/HS5eJr4y0E
sbrown2pt0,2934046378,2,1010651010782650370,13,6.5,Those scorecards are an absolute embarrassment to the sport. Basically Postol did nothing. That is a joke.
illinoispolicy,21323251,2,1011014394774458368,13,6.5,nothing like celebrating taxpayers being forced to pay for sports stadiums. good politics ≠ good policy https://twitter.com/charlesmcbarron/status/1010583125435604992 …
big73miller,929942021921497088,4,1013541936706224129,25,6.25,Congrats to Next Page Force for winning the Hoops Play USA Tournament in Conway Arkansas!!!! @Next_PageForce @ARBballRankings @Coast2CoastPrep @ARHoopScoop @geeksNathletes @Derial13 @the_camp_one @KeithTruth @TAKEOVERSports @IndiHoops @42_sports @BPortistime @ArRecruitingGuypic.twitter.com/5I2OrhtGbG
FOXSPORTSAZ,18055751,5,1013526739681570816,31,6.2,Deandre Ayton calls Arizona fans -- regardless of sport -- the best in the world. #AllAZpic.twitter.com/JGjXFe1DzO
VToolSoutheast,940609731269484544,6,1007746944113020930,37,6.166666666666667,.@Triton_Rays_706 17Us Tyler Faught starts the innings off with a laser to center field.@2d_sports pic.twitter.com/gXWm2lnZG7
nottheanne,1591658383,1,1002690242313367554,6,6.0,Sports illustrated face ass... but nah fr I wanna be in sports illustrated  pic.twitter.com/O5lfXv1sWD
EMittendorfMD,852162560484937729,1,1002685714985881601,6,6.0,So true - curing cancer is a team sport; collaboration is key to making progress. @JenWargoMD is a great teammate!https://twitter.com/parkerici/status/1002633729012043777 …
SportsPac12,948655410818424833,2,1012093549548990464,12,6.0,In which major sport is the Pac-12 most likely to win its next national title?Bonus: Predict the year and team in the comments.
PatentPurple,601941030,1,1002678768639586305,6,6.0,Get a whiff of this - @LALIQUE Encre Noir Sport http://ow.ly/r3LO30dVNVS  #scent #fragrance @wetweetblogs
Gq14Greg,3169290475,1,1002678235837161474,6,6.0,Last high school baseball game tomorrow 6pm tejeda sports complex come out to see a good game. pic.twitter.com/ibl2OLq8SM
tunein,54688421,1,1002672638206959616,6,6.0,The Bay Areas sports talk leader is back where it belongs. Hear @KNBR and your favorite personalities (@adamcopes @knbrmurph @KRON4GRadnich @sportslarryknbr @byronjr23 @JohnLundRadio @DrewHoffar @KevinFrandsen @RyanCovay) anytime anywhere on @TuneIn. https://listen.tunein.com/DTgve5v4oN pic.twitter.com/J7PGBbVUzk
