user@mention,user_id,No of tweets,tweet_id,retweet_count,local influence score,Tweet
HelloMoore,603790183,1,1006639028509212678,8,8.0,Enjoyed hosting @Plexalcity event & chairing insightful panel on how sports tech can be an enabler to tackle physical inactivity @DisRightsUK @baby2body @jalexzurita @OrsolaDeMarco @LondonSport @_ukactive @ODIHQ @rydermc @Geremy_Sagoe @scottcainuk @ToveOkunniwa #LondonTechWeekpic.twitter.com/fL9knPdAM6
TOCAshton247,944023174961942528,3,1004846192696745990,24,8.0,“Coach pass me a hard hat!” Taking the time out today to hang out with #Head Coach Coach Lewis (@soneworleansbra) from Legacy the School of Sport Sciences #takethisL from these #Titanspic.twitter.com/TtuMB9snjD
arsalanhshah,53783099,1,1009577427398483973,8,8.0,- Open invite for #Sports #Bloggers in #KarachiCall on given numbers to confirm your seat on first come basis...#SuperBoxingLeague #HitHarder#Pakistanpic.twitter.com/OFlzhBLD1t
21Bet,358416155,1,1009551718961606657,8,8.0,Away from all sport and gambling talk We’ve seen this tweeted on our timeline in the past hour. We have quite a large audience reach so If anybody can help this gentleman please do so. https://twitter.com/mrtomblewitt/status/1009539994388754433 …
backdoorcover,771461448945938433,1,1009543374280552455,8,8.0,Soccer guy @WilldeFries joins us again to talk World Cup progress then we kick his beta ass out and talk real sports like the NBA PGA College World Series and professional wrestling.Subscribe: https://itunes.apple.com/us/podcast/back-door-cover/id1150173141?mt=2 …pic.twitter.com/CmstabEY2M
RRSportsCenter,1931084899,1,1009542675710857216,8,8.0,Get ready for this years Great American Shootout starting Saturday and running through Sunday at the Sports Center! Details: http://ow.ly/WPWA30kAzYV  @TexasHoopsGASO #GASO #TexasHoops #SportsCapitalofTexaspic.twitter.com/0EabRnBpKv
chc_m2,1734502632,1,1009539224805265408,8,8.0,Our former @chc_m1 skipper & former @CanterburyJnrHC player Tom Richford is taking on 24 Sports in 24 hours to raise money for @Blisscharity.  We’re supporting him. and think you should! See the link to read his story and donate:https://www.justgiving.com/fundraising/24sportsin24hours?utm_campaign=lc_frp_share_transaction_default---fundraiser-page-donation-received---nth-donation&utm_content=6baa3009-c10c-44db-a631-fde716c1ce69&utm_medium=email&utm_source=postoffice&utm_term=1528446140547 …
ankur2912179,3310522616,1,1009947916209754115,8,8.0,Passion & willingness always precede over skill in any sport!!Croatia wanted it more badly #ARGCROpic.twitter.com/JvrLiy8AdV
KyleAndrews1994,3513422613,1,1009946867474550785,8,8.0,I have some good news everyone. I’m beginning a new journey with @1057TheFan tomorrow. I wanted to thank everyone with @1340AMFOXSports for giving me an amazing opportunity to be a sports reporter covering the Orioles Terps and FC Baltimore.
LyndaVoltzMP,373792867,2,1010635147140427776,16,8.0,I hear the viewing numbers were through the roof which belies the argument some make about womens sport. Hopefully TV stations are taking note!
_Drew_McCoy_,29090846,1,1003782239228841984,8,8.0,That said if Trumps personal unpopularity leads to the demise of stupid presidential events like sports teams and the WHCA dinner put him on Mount Rushmore!
Meridian_FC,866702660350726145,1,1003754437150638080,8,8.0,Meridian Sports u14 2018/19 for players to add to a already strong team. Playing Selkent A with links to playing Kent youth league as well. Please DM us for more details @KentYouthLeague @SelkentYFL @Meridian_SSC @fcbusiness @tonyssoccer @TonyIncenzo @BASLFL @KentFA @LondonFA
CdnPressVideo,857667673601302528,1,1003751072878551040,8,8.0,Four women sexually assaulted by ex-national ski coach Bertrand Charest say a system is urgently needed to protect children in provincial and national levels in sports. https://bit.ly/2JdK4tH  @sidhartha_bpic.twitter.com/bK5uczI5Pw
RespectGroup,2667421969,1,1003750805953024002,8,8.0,Will your organization take action? Lets be proactive and end abuse in sport -together. Learn about what other sport organizations have done to combat abuse and what we are doing to change the narrative at: http://www.respectinsport.com  #abusefreesportpic.twitter.com/TeV3J4Mghd
omglaiba,1083297385,1,1008851321141825536,8,8.0,People on twitter will really degrade you because of your opinion regarding a sport. I’m so done with people not minding their business and targeting an individual just because of their views. Smh.
Studio10au,1612349160,1,1008845120223862784,8,8.0,The people who own these sports just want the biggest amount of money possible so its ending up more & more away from free-to-air TV & on streaming services that cant... deliver. - @AngelaBishop #Studio10 The panel weighs in on #OptusFail. #WorldCuppic.twitter.com/YQ59ZVEZ9X
DanSpehler,34907868,1,1010669183393304577,8,8.0,Congrats to @DaveG_Sports @ChrisHaganIndy @TriciaWhitaker @LarraOverton @brettbensley Wes Woodward Phil N & the entire Indy Sports Central team for their Emmy on their Peyton Manning special- well deserved! #2018IndyEmmys @FOX59pic.twitter.com/GraDo9iQbg
evgrieve,17598047,1,1010661607481978883,8,8.0,From the Lower East Side sports desk: Little League playoff game delayed 45 minutes while a red-tailed hawk eats a pigeon http://evgrieve.com/2018/06/little-league-playoff-game-delayed-45.html …
KHolloway_WREG3,365154778,1,1010650594028277761,8,8.0,Hey guys! Help me welcome @MRice_Sports ! She’s our new weekend sports anchor. We’re thrilled to have her. #GirlPower  Also help me congratulate @MCeide_WREG3 on his promotion to sports director! You can catch him now Mon-Fri. @3onyoursidepic.twitter.com/l1fP4Kijfc
MWCoyote,108222255,1,1012832120170008578,8,8.0,Want to be the next quality Sports designer @CSGazetteSports? Look at who has worked here: @theford at @freep @jaystpierre at @StribSports Tom Fox @HoustonChron  Sean Kristoff at @TB_Times. Spread the word + join us in Colorado Springs. @APSE_sportmedia https://www.journalismjobs.com/1646072-pagination-desk-designersports-colorado-springs-gazette …pic.twitter.com/73o1sx6AWI
RiggosRag,16897434,1,1012799385447608321,8,8.0,Here’s a little follow me Friday for the writers on the Riggo’s Rag staff! Check out these accounts for more #Redskins news and other Washington sports takes.@JacobCamenker @ian_cummings_9 @TheRealityIs__ @MVScouting @NathanBritton_ @BurgundyBurner @HinesmanTrophy @bvasco45
ciacsports,22775634,1,1012798683199475713,8,8.0,Marissa Walker and her family honored on stage with a standing ovation as Marissa is awarded the 2018 NFHS Spirit of Sport Award. pic.twitter.com/wsFRXopWKd
GatorsVB,40300883,1,1011025388640690176,8,8.0,Dont miss Mondays Honda Sports Award ceremony as @ra_montie vies for the Honda Cup! All the info you need https://bit.ly/2Mm7euW #GoGators
ABC7Erin,21369113,1,1011003691242049537,8,8.0,So excited for tonights guest on @ABC7News Sports Sunday at 11:35pm. The Team 980s @JacksonSports joins me. When the season ended John Wall made it clear he wanted an athletic big man but the #Wizards selected Troy Brown Jr. we will get Scotts take tonight.pic.twitter.com/3UIaAtyn9F
NPNowZenner,390552109,1,1011000894241075201,8,8.0,Thank you to everyone who came out to the News-Press Now Prep Sports Honors tomorrow. It was awesome to have a packed house in the Fulkerson Center! Congrats to all of our winners and thanks to coach Bill Snyder for joining us for this special day! pic.twitter.com/W5hFsTJ6T2
KofieYeboah,169968593,1,1010990570783854594,8,8.0,There are 3 things I look for in sports video game story modes. I take a look at some recent efforts in NBA 2K Madden FIFA and MLB Show to see which ones do well and which ones execute poorly.(FULL )https://www.youtube.com/watch?v=Te_pWL5a6b0 …pic.twitter.com/F2z0it9Hwi
BostonSportsTap,736286329,1,1012123108973694976,8,8.0,Thank you all for the continued support of the #podcast and website. We have just launched a #Patreon subscription program with some exclusive content each month as well as opportunities for you to become part of the show. Check it out: https://www.patreon.com/bostonsportstap  #boston #sports
hpusports,50760400,1,1012110311342604288,8,8.0,HPU’s Yancy Flores representing @hpusports HPUsports  and the @ASC_sports in the 2018 NCAA Division III CoSIDA student program https://twitter.com/ncaadiii/status/1012108058732920832 …
LouTommoBTY,3880337052,1,1012108277390249984,8,8.0,IDEK HOW! SHE LIKES SPORTS THO AND THAT’S IT SKSKSHAHAKA #TeenChioce #Directioners #ChoiceFandom #BestFandom @onedirection
UDJCubs,554466570,1,1012107983885623296,8,8.0,Happy Birthday to Dennis Dael the biggest advocate for Academy sports at UDJ and the best weatherman in the ⁦@CHSL1926⁩! #AMDGpic.twitter.com/OTPgGeH1oE
LeedsFTBL,3080527858,1,1012079393609605121,8,8.0,Anyone interested in teaching at Leeds Middle School we have a math opening.  Coaching opportunities are also available in all sports (varsity and middle school)
RugbyAmericasN,4463819746,1,1012078400884879361,8,8.0,Calling all high school athletes in the Mexico City area! FREE College Sports Scholarship Workshop is coming your way July 11 and 12th. Join us and get all your questions answered. #RANSuperweek #RANRugby #collegerugby @AthletesUSApic.twitter.com/Ry374rMDgM
qatarileaks,869180784728518656,1,1012078239722942466,8,8.0,Foundation for sports integrity.. haunts #Qatar world cup international outrage at #Qatar hosting the 2022 world cup#QatariLeakspic.twitter.com/sfbJAxNn6x
Sebastian_nl_,1578721896,1,1007739840782327809,8,8.0,I don’t care if people barely started watching it I just hate the fact that some people talk shit about it saying it’s a “bitch made sport” but then support around the World Cup
UKMensSheds,1443174614,1,1007735166339637251,8,8.0,Welcome to @Charlie_Bethel our new Chief Officer @UKMensSheds who joins us from the world of Paralympic Sport and wheelchair basketball @_iwbf.  Looking forward to building on our successes and growing the movement across the UK.
podonovan,70205816,1,1007729400387981313,8,8.0,This evening I was delighted to officially open the new astro turf and ball wall for @killeedygaa @KilleedyCamogie which was funded from the Sports Capital Program  @officialgaa @LimerickCLG #Limerick @sportireland @Limericksportspic.twitter.com/5QP8AdyjmE
CoachE_Taylor,72786367,1,1003420310958411776,8,8.0,Full List of Sports Camps to choose from at CHCA All Summer. This week is- Baseball Tennis and VolleyballCincinnati Hills Christian Academy Summer Training Opportunities https://chcaathletics.org/main/otherad/contentID/42327007#.WxR7S3mXaps.twitter …
kiwigirl888,822968543759077377,1,1003412127015624705,8,8.0,Ive always believed knight & damehoods shouldnt be handed out to politicians sports or entertainment people but those who literally change our lives such as doctors teachers scientists etc.
btsport,124189302,1,1003406725066756096,8,8.0,Game one was... Eventful Tonight LeBron gets another crack at the Warriors before they come to Cleveland... Cavaliers @ Warriors - Game 2 BT Sport HD 1 1am pic.twitter.com/TVp0oGNMpX
ballydolphin,18793108,1,1003399888233816064,8,8.0,If only the racing community would get this upset over the animal abuse that happens every day at tracks treatment of the workers and overall modernization of the sport. Pipe dream.
LEllenberger07,2575412859,1,1003374314215919616,8,8.0,Beyond Blessed to receive my first D1 offer from Coastal Carolina!  Thankful for all my coaches in all my sports and for my family friends and teammates! #BAM @BallAtTheBeach @CoachPCovington @CurtisBalduspic.twitter.com/kvwU0IwDUm
Proactivecoach,222578391,1,1013560108696006656,8,8.0,For coaches and parents who want to incorporate character traits as an essential part of the sport experience for their athletes. Understand the process apply the concepts follow the five steps and be intentional pic.twitter.com/w85LkHhvMQ
RickSteves,14837962,1,1004867602643144705,8,8.0,In Spain bullfighting aficionados would never call it a “sport” — you’ll read newspaper coverage of fights not in the sports pages but in the culture section: http://blog.ricksteves.com/blog/bullfighting …
c_kennaugh,817818484801413121,1,1004863379213778945,8,8.0,Allowing trans women (whove spent most of their lives as men) to compete will destroy most womens sport. Is that really a price worth paying?
sports8,20620737,1,1004862136227467264,8,8.0,It’s a new day. It’s game 5 of the #StanleyCup Final.  What will unfold tonight? Biggest sports night in Vegas since....(fill in the blank)  #8NNpic.twitter.com/4Cu8kvyWZP
Phys_Lit_Wales,2368736429,1,1004852038449102849,8,8.0,Come and study MA PE Sport and Physical Literacy with us @UWTSD and see the work of  Wales Institute for Physical Literacy https://uwtsd.ac.uk/ma-physical-education/ … study with @naldaw @Goodwaygb @DylanBlain
JoshFox46,400968062,1,1004835584463069185,8,8.0,Full convo with @Charlotte49ers athletic director @rmikehill will air Sunday during sports extra but tune in to @FOX46News at 620 and 1040 today for a teaser of our convo:pic.twitter.com/KWsvRti5nx
AhmerMurad,358730722,1,1004833421699506178,8,8.0,Adidas Telstar 18 footballs to be used in the FIFA World Cup in Russia are being made by Forward Sports Sialkot Pakistan. #FifaWorldCup2018 #WorldCupRussia2018 #Football #Soccer #WorldCup #MadeInPakistan #Pakistanhttps://www.dawn.com/news/1387073 pic.twitter.com/3lErMPLU7t
tennisdothow,3245370750,20,1004845712943742982,154,7.7,If you can keep playing tennis when somebody is shooting a gun down the street thats concentration. - Serena Williams #Tennis #TennisPlayer #TennisGame #Sports
HfxCards,869683898464292870,7,1012101806212702209,53,7.571428571428571,The winner of our Daily Sports Card Draw is: @TVTimeForMeCongratulations! I already have your address from your last win so I will get your cards up to the post office this evening. New contest begins shortly.pic.twitter.com/mjrBuLq0z6
AlArabiya_Eng,22240612,2,1009941283652194304,15,7.5,#FIFA being the owner of the #WorldCup rights “is responsible for what #beIN SPORTS broadcasts in case firm and decisive actions have not been taken says #Turki al-Sheikh http://ara.tv/jkms3 pic.twitter.com/RnQUHEyuau
kokomocitytrny1,2537926632,2,1009922689107222530,15,7.5,Tonight’s Final 4 games of the @SportsKT Major City Trny were all postponed and will resume tomorrow at their original scheduled locations and times. @Sports_Journal @SportsKP
andrewbensonf1,58444150,5,1003763674098688000,37,7.4,BBC Sport - Canadian Grand Prix: Daniel Ricciardo faces grid penalty after Monaco victory http://www.bbc.co.uk/sport/formula1/44364183 …
Lemont_Softball,2831992282,1,1002685835643367424,7,7.0,Tomorrow 11 LHS sports complex we need you there as we take on Naz for the sectional championship! #GoLemont #succeedtogether
GerrardLoyal7,187611286,1,1002683427794059266,7,7.0,THAT Walter Smith interview without the shite @BBCSport branding and censoring. This man is my hero. #AriseSirWalter #WATP pic.twitter.com/iyeNuVUEMZ
midwbarrelracer,464306167,1,1002678413830819841,7,7.0,why cant there be one like my barrel horse and i dont talk shit about you because we have better things to do like clean up our first and long trot plus this sport is already difficult why would we try and make it worse js. pic.twitter.com/rgFVtlMe10
GiantsFanzine,2270740464,1,1002671415542403073,7,7.0,Funny that. When its the Giants at home with no away fans on a Thursday our club/fanbase is the problem. When the best supported clubs in SL and Championship combine to manage just 1000 more on a Friday its the sport thats the problem? https://twitter.com/AaronBower/status/1002644767388430336 …
GuideJason,61095667,1,1008497195019104257,7,7.0,The Allen Eagle competitive shooting team sweeps the SCTP regional championship in San Antonio! Next up nationals! @SSSFShooting @LFCEagles @AllenHS_Eagles @allenshooting @AllenISDSupt @KGLE_SPORTS @allen_isd @AllenEaglesFans @MidwayUSAFoundapic.twitter.com/lmCU6lvXk5
LoudyGeee,2819027364,1,1008495215315783680,7,7.0,If you dont know where this is at you dont know LA and sports lol this is the spot everytime Mexico Dodgers or even the Lakers win lol https://twitter.com/radchris/status/1008403377762459648 …
gumby61184,43658351,2,1007733823046606848,14,7.0,Wait so the Atlanta teams are dominating All-Star voting in the two summer sports? But that cant be. It just cant. Atlanta fans dont care. We barely even exist. https://twitter.com/11AliveSports/status/1007732782720745472 …
TSU_TigersTrack,317299792,1,1008490849867616256,7,7.0,Front Page of Sports Section of The Tennessean! Ed Temple on the Mount Rushmore of Nashville Sports! #BigBlueRisingpic.twitter.com/fzbuXvEq5L
ClaudesCarving,55706572,1,1008483194318942208,7,7.0,Sports Fan Turtle Wood http://tinyurl.com/ycwnvomv  via @EtsySocial #etsymntt #integrityTT #ArtSculpture #UniqueGiftPresentpic.twitter.com/Plr0iZsB8q
FightingIrish,36484419,1,1007047968321486848,7,7.0,Sport  Science = Take an inside look at how science is improving the student-athlete performance at Notre Dame.  https://ntrda.me/2keLUeA #GoIrishpic.twitter.com/k3B3ADEGsb
CCDSathletics,2665900130,1,1007047412370870272,7,7.0,Great story @AdamJBaum. Cam Alldred is the perfect example of a multi-sport athlete. Do as many sports as you can! It helps you achieve your dreams. Congrats Cam. @CCDSHirsch @KDunnette @OHSAASports @SWDistrict @CCDSCoachRoss @CoachHanhold @CountryDayhttps://twitter.com/adamjbaum/status/1007040748397752325 …
FarribaMark,987147550611386368,1,1007045743104978945,7,7.0,“If there’s two similar athletes we’ll take the multi-sport guy every single time” Big Ten assistant explains http://footballscoop.com/news/theres-two-similar-athletes-well-take-multi-sport-guy-every-single-time-big-ten-assistant-explains/ …
prog_mustard,1045455883,1,1007040280145489920,7,7.0,Thats exactly what he/they mean. Ive worked & played sports for 40 yrs. I have arthritis. Working & playing sports isnt taking care of myself? Seriously America - Republicans have to go and go away for good.
WillSlover31,543047883,1,1007029295670325248,7,7.0,You’re right. Tristan didn’t cry in his car after he lost in The Finals and beg the second best player in the world to come play with him. Draymond is the biggest fake tough guy in sports history https://twitter.com/sportscenter/status/1006744951315664897 …
Zin5ki,2521092434,1,1007017799007522818,7,7.0,Neon Genesis Evangelion depicts a speculative near-future in which a public-sector worker in her late twenties can afford a new sports car.
rugby_podcast,712780880926773248,1,1005589515291934720,7,7.0,International rugby reminds you why this is the best sport in the world. #NZLVFRA #AUSvIRE #RSAvENG #ARGVWAL #JAPvITA
RCW811,3861183134,1,1005589039808958465,7,7.0,Congrats to Mike Smith; not a better dude in the sport! All class all heart. He deserves this! Congrats from team #call811! #justify #triplecrownpic.twitter.com/noNbx8pHDf
ABCWorldNews,86141342,2,1013566845033635846,14,7.0,A sports radio broadcaster died when he stepped out of a stalled van and was swept away by a raging flashflood in Iowa officials said. https://abcn.ws/2z74os2 pic.twitter.com/VHr10MsHtz
WMLadyWarriors,997132658088931329,1,1005566153614397448,7,7.0,special shoutout to Jenna Lucas on her 1st place finish in the heptathlon this morning and then still coming to play 9 quarters of basketball!multi sport athletes = competitors! pic.twitter.com/WSedFKA9cQ
uiltexas,41388999,1,1005560164672393216,7,7.0,#UILState GAME TIME!Conf 6A Final @Reagan_Baseball v @DragonBaseball 4:30 p.m. (updated start time) Dell Diamond (Round Rock) FSSW FOX Sports GO Live Stats: http://bit.ly/1B8im5k pic.twitter.com/LCyECKgRZj
FosterFootball,1347709200,2,1006645214633709568,14,7.0,Don’t let the next two months take away what the last 5 months have done for you! SAC camps begins Monday 6/18 at 8 am. Be there and bring a friend! This is for ALL SPORTS. #ProtectTheNestpic.twitter.com/5c4zDGe3QA
BenDuBose,30223403,2,1010995320594030592,14,7.0,For all the hand-wringing nationally about declining MLB attendance figures and the health of the sport it seems theres a pretty easy solution:Win. Everything else works itself out when you do that. https://twitter.com/moisekapenda/status/1010994886777008129 …
JoeO670,211604127,1,1004495003337584640,7,7.0,$322K bet on sports in Delaware on Day 1. Some outside money but…..Delaware population - 961KIllinois population - 12.8Mhttp://www.espn.com/chalk/story/_/id/23716636/delaware-generates-322135-bets-day-1-full-scale-betting-tuesday …
westaustralian,26417909,1,1004490871499354112,7,7.0,A statue based on one of Australian sports most iconic images could become a new landmark at Optus Stadium. http://bit.ly/2HpyINh  #perthnews #AFL
Hrgal123,1334323796,1,1004484065276329985,7,7.0,Devon Rathbun & Caleb Haines of Parkview High School are named 2018 Missouri Team of the Year by National Youth Fishing Association!  Back-to -Back years!  @Parkview_Viking @TheView_Sports pic.twitter.com/PRvekH5mzo
daveyhannigan,935287092,1,1004482954159108102,7,7.0,25 years ago this week @Siggo gave me a work placement in The Sunday Tribune sports department which then included @AkaPaulHoward @PaulKimmage @BrendanFanning @wattersonjohnny and Denis Walsh not a bad line-up
newballsplease,27686041,1,1004482451140481024,7,7.0,Why is Sharapova on the back page and not Muguruza? Shes the reigning Wimbledon champion people who read the Times Sport section in print know who she is. https://twitter.com/hendopolis/status/1004479019620945922 …
TrishaOwens,301069002,1,1006669611566288898,7,7.0,Fantastic night with the @OttawaRedBlacks at the Womens Training Camp in support of the @OSEGFoundation and girls in sport @CTVOttMornLive @ctvottawa #teambuilding #cfl #REDBLACKS #RedblacksWomensTrainingCamp #bellmediapic.twitter.com/c0d1q5qrez
nintendolife,26469931,1,1006661186153263104,7,7.0,Konami Is Resurrecting Hyper Sports For The Nintendo Switch http://bit.ly/2HHq6le  #Repost #NintendoSwitch #UpcomingReleasespic.twitter.com/7Y1TVv0MCX
sd43bc,66809263,1,1006659949215342597,7,7.0,On Friday June 8th 130 students from 19 school competed in the first annual #SD43 Track Meet for Adapted Sport. Thank you to all of the organizers participants partners volunteers and those who came to cheer on the athletes! http://ow.ly/uj6Y30kt8KM pic.twitter.com/Pp6q3qBsEl
Ham_RecFC,893887326727933953,1,1006653522409074688,7,7.0,We are still looking to fill a couple of positions for the upcoming season. A first team coach and phsyio/sports therapist are needed. If youre interested then please get in touch @DPL_official @DorsetFootball @JustBmthFooty @BmthFootball @bournemouthuni @SydWessex
SkillSchoolNI,770302621957681152,1,1006644365249466368,7,7.0,We are really excited to be involved in this collaboration. For anyone aged 16-19 and interested in a career in the sports industry get in touch. Information evening on Wednesday 27th June.#sportscoaching #physiotherapy#peteaching #sportspsychology#excitingtimeshttps://twitter.com/StCeciliasDerry/status/1006640196836872192 …
schwabwrestling,40904854,1,1011757472804163584,7,7.0,Woman’s wrestling is a critical element for the growth of the sport we need more woman wrestling it makes the sport stronger
DaveoKindo_73,601215903,1,1011754691133394944,7,7.0,I have some happy and sad news. Tomorrow will be my last sportscast at WHIZ-TV. It has been an honor to be the sports director and work covering local sports and news for almost three years. I cant thank enough the players coaches fans and coworkers who made it so much fun! pic.twitter.com/O9fPttCPbd
IAAMconnected,188666035,1,1011748027462189056,7,7.0,The IAAM is proud to announce our new partnership with @LBHealth LifeBridge Health... check out this awesome event on July 10th in Pikesville offering free annual physicals and a Sports TrainIng Fair featuring Cal Ripken!http://www.lifebridgehealth.org/LBHSportsMedicineInstitute/LifeBridgeHealthSportsTrainingFair.aspx …
JohnnyObeid,152422537,1,1011741209570758657,7,7.0,It sickens me how much DC sports media and DC sports fans slander John Wall for literally the most stupidest and simplest shit
jednorthapparel,3386815643,1,1011732628326834177,7,7.0,Do this and you’ll live with no regrets. #fitness #motivational #MotivationalQuotes #qotd #sports #jednorthnation #bodybuilding #motivationpic.twitter.com/lNankWLVar
BuryRelics,922393351063769089,1,1011732310624997376,7,7.0,Join @BuryRelics this Sunday to support @BuryA4A and radcliffes showcase of the best sport in bury. Social  physical and most of all fun guys 12pm kick off !!!!!!!! Get down and support Burys best team pic.twitter.com/m1ZCSZWyqv
kcamanda,21666845,1,1011730077116190721,7,7.0,“Nobody wins a championship by themselves.” Very cool to hear basketball legend @NancyLieberman speak today at @dallasnews about teamwork and our values. My inner (ok outer) sports nerd is freaking out!
SouthWildcatsSB,715174228027437057,1,1011726342889582594,7,7.0,WHAT A GREAT CAMP! So excited for our inaugural youth camp - these kids are the future of our sport! Thank you to the kids m their parents and our own Wildcats for this being so successful! Stay fierce ladies! #GoCatspic.twitter.com/9urA0tYFef
GLA_Gladiators,742710401901694976,1,1011722343499091973,7,7.0,Many thanks to BBC Sportscene presenter and BT Sport Football commentator @RobMacleanSport who came along tonight to present the players with their end of season medals.pic.twitter.com/ZtAzXBWRm3
