user@mention,user_id,No of tweets,tweet_id,retweet_count,local influence score,Tweet
ChrisGQPerry1,274127782,1,1007018801295183872,15,15.0,Took a while with my hectic schedule but i’m officially a certified Personal Trainer through the International Sports Sciences Association. Plan on taking on clients soon and possibly opening a gym in the future  pic.twitter.com/0ccpN9ENQ1
DukeBASE,31175433,1,1005951337819967488,15,15.0,Showtime. ESPN2 Buzz Sports Radio (99.3 FM / 96.5 FM) http://www.espn.com/watch/_/id/3345257/ncaa-baseball-super-regionals-presented-by-capital-one?_ga=2.126908933.905489589.1528502230-877596022.1522204035 … https://goduke.us/2sLUQwZ  https://www.ncaa.com/game/baseball/d1/2018/06/10/texas-tech-duke …#GoDuke | #RoadtoOmahapic.twitter.com/JHbklfgJ3Q
KanganaDaily,39040070,1,1005920730511441923,15,15.0,Midday | Kangana has alloted her dates from October through December for Ashwiny Iyer Tiwaris sports drama pic.twitter.com/FvvqYzN8YI
alligatorSports,41510959,1,1004506848001748993,15,15.0,E1: Sports EditorFirst cringeworthy error of the season.alligatorSports fumbles an easy out  pic.twitter.com/blsfaPqtUu
martinmazur,69392576,1,1004481163224895488,15,15.0,A real fake news example:-Higuain speaks on ESPN -He doesnt mention A WORD of this quote.-Translation is attributed to a user @AwayFrom234_    -The quote is credited to TyC Sports not ESPN -User @AwayFrom234_ no longer exists-Thousands of RTs and journalists buying itpic.twitter.com/ondYr9IhEU
KewpAthletics,829433084,1,1006649736672301056,15,15.0,If you missed your opportunity  this spring for the Peak Sport and Spine Physical day here is another opportunity.  Please share this with middle school or high school athletes. pic.twitter.com/JYmsWH6RTw
HoopDistrictDC,26025056,1,1009942797976330240,15,15.0,I don’t know why folks boo’ing Adam Silver. Guy is arguably the best commissioner of the four major sports. #NBADraftpic.twitter.com/9LBqcGBMqY
AndroidAuth,95438524,1,1008851330176204800,15,15.0,#Dealoftheday - Forget GoPro the XtremePro Action Cam is only $69.99 #camera #cameras #SportsTech #sports #deal #discount #androidhttps://www.androidauthority.com/xtremepro-action-cam-874458/ …
Harlematheltic1,1004857770686984192,1,1008846445246631936,15,15.0,Harlem Sports Medicine is proud to announce our 2 annual Student Athletic Training Workshop. If you have any interest in becoming a Heath care provider after High School you need to come to this camp!!! pic.twitter.com/wk9mRbMMeP
PbrownNeuro,1413020492,1,1008826937740070916,15,15.0,Great to hear @RhonddaBryant talking about the #ifindoubtsitthemout campaign by @peterrobinson86 and #braininjury in sport caused by poor concussion protocols and mention of  @JeffAstleFdnpic.twitter.com/Uqk81PNsVA
aideen_mc_g,62836649,1,1011031086929973248,15,15.0,I’m looking to connect/collaborate with fellow sports scientists/ researchers who are working with elite female field hockey players. Any of my followers know anyone off hand?
AdamsDray3,804532373731713024,1,1012120943622119425,15,15.0,Dear baseball gods I have been waiting 11 years to watch OSU play in the championship series again. Year after year I watch them struggle in all other sports. Baseball is all we got. Please don’t fuck this up for me
taylahtomokino,4887149000,1,1012111535341166592,15,15.0,This has to be my favourite column I’ve done for @NewsroomNZ these women are incredible athletes but are also incredible characters off the field who have carved great career paths for themselves.  Thinking about & planning for life after sport is crucial https://www.newsroom.co.nz/2018/06/27/131212/sportswomen-take-the-law-into-their-own-hands# …
aaronfitt,125762072,1,1012081281318969345,15,15.0,As the college season winds down it’s time to give thanks to the people who make this sport so much fun to cover. Here’s the 2018 #AllFitt team — a list of the players I most enjoyed covering this spring:https://d1baseball.com/news/the-2018-all-fitt-team/ …
PositiveCoachUS,47761088,1,1012078118314471424,15,15.0,#ParentTip As our children get older and more athletically devloped the decision of whether to begin sport specialization arises. Here are some helpful guidelines to ensure the right choice! https://devzone.positivecoach.org/resource/book/deciding-whether-your-child-should-specialize-single-sport …
AJENews,18424289,1,1003411028263297024,15,15.0,Television channels belonging to Qatar-based beIN Sports have gone dark for thousands of Emirati viewers after piracy complaints. http://aje.io/kxzjc
YahooSports,7302282,5,1012817539787821057,73,14.6,In this weeks Poppin Off Reggie Miller dethroned Ray Allen as Yahoo Sports pop-a-shot king . https://yhoo.it/2MybRlu pic.twitter.com/NJA1xWJFI3
onajea,380626869,1,1002670822195163140,14,14.0,Graduated with.....a 3.4MVP in 2 sportscaptain of 3lettered in allIts been a good 4 years. #2k18grad #2k18Graduatepic.twitter.com/ZfAX0i7mLm
playersvoice,889741357052448768,2,1012120617213046784,28,14.0,.@NickKyrgios has fallen out of love with tennis in the past. He has made no secret of that.But an incident during the @DavisCup - and its aftermath - has led him to a new realisation about the sport and his place in it. :http://po.st/Kyrgios-Nick pic.twitter.com/i0JEaYvzRB
haaretzcom,24506246,1,1007021131604381696,14,14.0,What makes Gaza different for some is that attacking Israel is their favorite sport said US Gaza envoy to the UNhttps://www.haaretz.com/us-news/un-denounces-israel-for-gaza-killings-rejects-amendment-against-hamas-1.6174963 …
jnrkay_x,73156174,1,1005595327813115906,14,14.0,Original sketch by @ebube7 colors by me #collab #illustration #vector #abstract #soccer #sports #design #hyveworld #ed #ghana #nigeriapic.twitter.com/QzWEjH6o48
w6vyleon,1601596346,1,1005560795663515648,14,14.0,Remember the Titans is the best sports movie of all time. If you disagree I’m at work rn but I’ll willingly clock out to give you these hands.
MJPotts17,40346966,1,1005559117220581376,14,14.0,Big fan of BT Sport apologising for strong language in the corner when theres two guys literally splattering each others blood around the ring. #FlanaganHooker
davebeaton4,2410955820,1,1006683626128465920,14,14.0,Thanks @CamGuthrie and @CathyDowner for ‘beeing’ good sports and championing pollinators in the @CityofGuelph.  Kudos to Samantha #Guelph’s Community Stewardship Coordinator for bringing this event together.pic.twitter.com/eb07Kf062n
jeneadenelle,3845728213,1,1009570291540885505,14,14.0,hunting for sport is so ugly why cant u yee yee mfs just play soccer
EarleyScott,363204412,1,1009567924372336640,14,14.0,3 games on Monday. 10 7on7 games on Tuesday. 3 games on Wednesday. 8 7on7 games on Thursday. You give your multi-sport skill kids the day off to rest and most of them still show up to practice lift and learn more. I smell a special year 4 The Rams!@Coach_Agnello #family
khattabamr,321454624,1,1009565874678829063,14,14.0,Ramos proving what that he has class and that this is just a sport and rivalry doesnt mean that.....Nah I cant. Fuck him. Biggest cunt in football. https://twitter.com/barcacentre/status/1009551054806179843 …
mikethomasmt8,17453406,1,1009560089290772481,14,14.0,Happy to welcome @ChristianArcand to the full-time weekday lineup as cohost/Sports Hub Headlines on the @adamjones985 show!    He will try to tame the Sports Vulture starting Monday night 7pm-Midnight.
CoralDeVille,1515952453,1,1009542818283565057,14,14.0,Giraffes are now on the “red” list meaning that they are near existnction. It is absolutely unfathomable that people kill these or any animals for pleasure or sport. It’s fucking disgusting.  pic.twitter.com/SwjjEKacz3
AHayatu,509806145,1,1008820690433306624,14,14.0,Sports should be headed by a PHE teacher.Aviation by a pilot or any ex-cabin crew member.President by a Zoologist with bowler hat. https://twitter.com/iameneji/status/1008819146488938496 …
ThePOSShow,712729231172579328,1,1010654857076854784,14,14.0,Two red hot episodes this week:Episode 60: Interview with @AshaRangappa_ Episode 61: Festivus for the Prez-of-US. Good stuff! #Podernfamily #podcast #politics #sportshttps://itunes.apple.com/us/podcast/the-pos-show/id1294520756 …
KnadInfo,1264987956,1,1010648226633011200,14,14.0,Deaf community in Kenya continue to struggles to improve themselves today we had presentations from interpreter and Deaf sports. We look forward to a united front @WFDPresidentpic.twitter.com/pNahmivAaF
SidelineScouted,877546321904848896,2,1003375440688500738,28,14.0,Huddersfield are interested in signing AC Milan forward André Silva (22) according to Sky Sports news. pic.twitter.com/xn4777FXsp
Cynegeticus,58696782,1,1012818251124916226,14,14.0,Barcelona close to selling Brazilian centre back Marlon to Southampton for a 12 million euros fee according to Sport: https://www.sport.es/es/noticias/barca/barca-vendera-marlon-southampton-por-millones-euros-6916272 …
MarshallPCSM,4874331373,1,1012797910218608641,14,14.0,Congratulations Dr Meredith on completing your sports medicine fellowship today.  Well miss you at Marshall!! What a fantastic year we had!!  #triedtokeephim #sportsmed #lastdaypic.twitter.com/bnO7W87j4O
YelizPrior,583061670,1,1012108018190864384,14,14.0,Can my followers please share this request from one of our #masters students at the @HSRC_Research to spread the word to potential #research #participants to consider taking part in her study into #sports #participation in #adolescents with #UpperLimbAbsence ? @SalfordUniNewshttps://twitter.com/LilMsResearch/status/1008698231646294017 …
irumanyika,301451329,1,1007737589653176326,14,14.0,Good news for the sports fraternity. These have been added to the Tax exempt imports under the 5th schedule. #KnowYourBudget18 with @URAuganda #Budget2018 #UGBudget2018pic.twitter.com/XJZfl4edDg
Mabbe17,2322897354,1,1003405255680372736,14,14.0,No lie one of the worst things about being a girl is when the pad in your sports bra is messed up and you gotta stick your hand in the tiny sleeve thing and fix it
FactsInYourFace,718799630,1,1003375798487789569,14,14.0,The world’s fastest street-legal car is the Bugatti Veyron Super Sport – It can reach speeds of up to 276 MPH (431 KM/H).
jaysdrama98,848382524485238785,1,1013530687218049024,14,14.0,Best sports:10. They9. Are8. All7. Amazing6 And5. You4. Can’t3. Rank2. Them 1. Hockey
thekapman,22445483,1,1013525359575425031,14,14.0,While I don’t like a World Cup knockout game decided by penalty kicks the Croatia win over Denmark was incredibly intense. I’m all in that this sport at this level is AMAZING. Yes I said it. I have loved watching the World Cup! pic.twitter.com/SUCuy1KbjW
hannahmacleod6,233600234,1,1004835031414726661,14,14.0,BOOM! Congrats to @sjuggs15 & Richard for winning the illustrated sports book of the year award. More recognition for a truly special moment in the history of British sport. Women’s teams are truly inspiring a nation  #31 #TeamBehindtheTeam @WomenSportTrust @GBHockeyhttps://twitter.com/sportbookawards/status/1004828666214436865 …
SpecialOlympics,19598173,1,1004830355960918017,14,14.0,“Play Unified allows us to come together in one sport on one court. We’re more similar than we are different. Thank you @ballerabby24 for brining #PlayUnified to @LifeAtPurdue! Full story  http://bit.ly/2M3fBvV . #ChooseToIncludepic.twitter.com/YfyPBr84GN
fswisconsin,19085082,2,1005581830257455104,27,13.5,Whitnall wins the WIAA Division 2 softball championship! Stay tuned for the Division 1 title game coming up on FOX Sports Wisconsin and #FOXSportsGOpic.twitter.com/wu0TaaoWu1
BhamTxSport,779704501431328769,2,1003742722614841344,27,13.5,We are delighted to be going to @WHBTG 2018 with the biggest contingent ever! Over 100 people have registered to represent Birmingham Adults Transplant Sports Team for events from track & field to golf darts & the #DonorRun2018 @SportBirmingham @TransplantSport @DonorFamilyNetw
genny_ss,323490297,2,1003773725135818754,27,13.5,And without any doubt itd be very good for the society to see how a woman can be a mother and at the same time succeed in sport. What its not acceptable under any circumstance is for women unlike the men to have to decide between one thing and the other.
ChrisHudgison,22596468,3,1011712556287787008,39,13.0,Peyton is going to help me with some big news: I’m returning to Jonesboro Arkansas.Honored to be @Region8News Sports Director. #TheOchoReturns July 16th.pic.twitter.com/aEjEkl8wCT
BradleyGelber,205424262,1,1007033239641477126,13,13.0,We are lucky in WNY that despite all of the talent lost recently at TBN there are still a lot of great options for sports content locally.If you enjoy it make sure to support it.
BigSkyFB,2667250386,1,1007030889468096513,13,13.0,Another day Another preseason award. We have  #BigSkyFB players listed on the Athlon Sports Preseason All-America Team! #LetsGohttps://buff.ly/2l7T4lh pic.twitter.com/CleYVUfkct
lannomedia,283051255,1,1005571476664274944,13,13.0,What a week of Speedway of Nations.Phenomenal sport entertainment & pure theatre. The best-ever coverage from BT Sport with the brilliant @TheQuirkmeister @scottnicholls78 & @Simon_Stead The finest commentaries yet from @nigelpearson & @Kelvin_Tatum Top job all around pic.twitter.com/ZuGD967TSm
Jonno_Reilly,23463031,1,1005556916528058368,13,13.0,Genuinely dont get why BT Sport want to apologise for language when its my decision to watch two blokes batter fuck out of each other @BTSportBoxing #FlanaganHooker
CorruptedGabe,723322794331631616,1,1005914531585929216,13,13.0,I was literally jumping out of my seat for just regular clears and shots in that final. That was the most invested I’ve been in a series in any sport or esport. Rocket League is here to stay. #LANdon
topclassgeneral,2579418335,1,1005903682494443522,13,13.0,Smyrna sports is still being disrespected smh .. everything y’all said we couldn’t do we did and then some. Still don’t get shown respect  only motivates us though !
PayneInsider,27638884,1,1004465656165695490,13,13.0,Summer Send-off Podcast is LIVE! @ToddFuhrman and I breakdown the #BelmontStakes NBA and NHL Finals and give our first public thoughts on the Legalization of Sports Betting + @MarkOHaire joins for a comprehensive #WorldCup Preview!https://soundcloud.com/bettheboard/summer-send-off-sports-betting-legalization-discussion-world-cup-2018-and-belmont-stakes-picks …
Prospects_Watch,3056931256,3,1009929979524734977,39,13.0,John Shannon on Prime Time Sports also believes if Tavares gets to the interview stage on June 24 expects only 4-5 teams to be called to Los Angeles to make their pitches.
bslayer241,840593240411762688,2,1012806708266139650,26,13.0,FOX: oh we have great shows with talented people and solid fanbaseFOX: you know what lets cancel them all because football is better. Especially when we already have a sports channelIf only this was just a mood#SaveGotham #GothamSeason6@HBO @TheDCUniverse @netflix
RyanWhitfieldNE,242899386,1,1011719964070465537,13,13.0,@Trags of @CLNSMedia met up with @MLL_Lacrosse commissioner Sandy Brown ahead of this Thursdays All Star Game. They discuss the future of the league expansion and the sports growing popularity. http://bit.ly/2KmUBis #lacrosse #MLL
lisabeare,347648640,1,1009554012990066690,13,13.0,Today Parliamentary Secretary for Sport and Multiculturalism @KahlonRav and I met with @viaSportBC Sport Leadership Council. We discussed the future of #BCSport focusing on how we make sport and recreation more inclusive safe and affordable. pic.twitter.com/2gOSQ2TWcZ
ClemsonDRad,979234489,1,1009926725793468418,13,13.0,Two Sports Information legends side by side !!!  Sammy Blackmon enjoying his well deserved retirement  party !! pic.twitter.com/39BZPhcYAi
Tariq_NPH,92435716,1,1008854956974247936,13,13.0,Cut the ribbon... Big congrats to @BramptonBBall on unveiling of new court at Brampton Sports Centre! Facility looks  #BramptonStrong @NorthPoleHoopspic.twitter.com/z9tqsFDHA8
AlexaBlissWorld,959326675094921216,2,1003390556637159424,26,13.0,Ric Flair : Back then Sports Entertainment was just called Pro Wrestling AJ Styles Charlotte Alexa Bliss : Woah! yeah right pic.twitter.com/eyMchUyHVS
byAngelicaC,191674162,1,1008815228111544320,13,13.0,Te gusta Mi #kitmundialista de @AngelSportsCo my sports brand  #rusia2018pic.twitter.com/L7vSg4mZJk
nopalita_,824192584742486016,1,1010654042706472960,13,13.0,USMNT fans insist that soccer is a mans sport but their mens team didnt qualify for the World Cup this year and the womens team has won three WC in the past so.....
Obibiniboafo,123803745,1,1010638653603942407,13,13.0,Last night with the crew at @ASAMOAH_GYAN3 s BJ Sports Bar launch inside Osu. Had a good time with his band #rapmuwudini #ebinomklick #zylofonicpic.twitter.com/BgcWX0xWCD
BIC_09,22206686,1,1012820807586807809,13,13.0,Tomorrow Will be a sad day in Ann Arbor and at @umich when Moe’s Sports Shop closes its doors one last time after 100+ years of business. #thankyouMoes #goblue
PGATOUR,14063426,1,1012120124592041984,13,13.0,Its just a flick of the wrist. In both sports.Learning golf from a pro.Learning Frisbee from a pro.@BenCraneGolf traded places with @BrodieSmith21. #LiveUnderParpic.twitter.com/VEXhPNAoG6
heytheredeann,3032694033,1,1012077278057123841,13,13.0,#TimelessTrivia: Alice Paul loved dancing and sports. In her high school and college years she played softball basketball hockey tennis she also ice-skated when she could. #SaveTimeless #Timeless @AmazonStudios @sony
carsonbeautiful,700392033622605825,1,1007769462626451456,13,13.0,Okay so... guys... so... this pic is ...hum...  how can i said ? just WOW !! Ive never seen Carson like this ! this pic boost me to make sport @carsonluederspic.twitter.com/R4cFYXi0mD
thedailybeast,16012783,2,1007763450548883459,26,13.0,The @FA the governing sport body in England is endorsing special LGBT #Pride flags and scarves at the #WorldCup in Russia. From @TimTeeman:https://thebea.st/2JJYkKZ
SportsNDN,1170514242,1,1003424125266874369,13,13.0,As pointed out by one of our followers: @TivertonSports won division championships in the following sports — girls volleyball girls basketball softball boys tennis cheerleading and unified basketball. It was indeed the Year of the Tiger.
JeffSkversky,68881642,1,1013559150738116615,13,13.0,Nick Foles tells @6abc he has never tried to outdo Carson Wentz; his relationship with his fellow Eagles QB is too important1-on-1 with @NickFoles tonight on Sports Sunday on @6abc at 11:45pm@6abc#NickFoles#Eagles#FlyEaglesFlypic.twitter.com/25suCtDWEg
MariusVizer,2888876465,1,1004845853188771840,13,13.0,Society should believe in sport as a beneficial cause and aim. The daily program of children should integrate the good correlation between learning and recreation. pic.twitter.com/R1BkrZRUxq
FranktheTankpod,909572725101912064,1,1004839351086469121,13,13.0,400 ratings and 100 reviews on iTunes 2500 twitter followers 40+ episodes Top 150 in Sports and Rec. Podcasts and t-shirts flying off the shelves. Thank you to everyone who has helped @NjTank99 and Allow Me 2 Be Frank get to this point.pic.twitter.com/Bd45Jwwc2e
TransferNewsCen,309396798,7,1013547878428631041,85,12.142857142857142,West Ham have made a £27m bid for Nice forward Alassane Plea. Fulham Newcastle and Tottenham are also interested in the Frenchman. (Sky Sports) pic.twitter.com/qTr3eTOqaG
ABDULRAHMAN_G10,1647821300,1,1008488251336876033,12,12.0,People of the Middle East are fed up with the way football & other sports are used to inject political views in such disgusting way. Definitely @FIFAcom  & @FIFAWorldCup is part of this propaganda by  @beINSPORTS_MENA#رياضة_بلا_سياسة#SportWithoutPoliticspic.twitter.com/dHbp7HH1wM
tonethirty,797363246487347201,1,1008484903506173953,12,12.0,Excited to announce my signing to Jewell! Thank you Father God for giving me another opportunity to play the sport I love while getting my education paid for! Ready to put everything on the line these next two years! Let’s get it  pic.twitter.com/8AhCaHejiL
saveEMUsports,978361187925680129,2,1004468364167843840,24,12.0,We fight every day to get Eastern wrestling back along with the other sports. We have to plan on it not being restored in time for 2018-2019 so our athletes make responsible decisions based on what AD @scottrwetherbee did to their career. We are in this fight for the long haul.
princesspleats,2776512383,1,1008472544406638594,12,12.0,Catherine is beautiful and smart. Went to the best schools and is sporty. Played team sports her entire life.  She’s a great mother and a huge support for William. He hit the jackpot
TaoofStieb,20785838,1,1007031000549871617,12,12.0,The expletive “horseshit” belongs to baseball. It is truly the sport’s greatest contribution to the English language.
laloalcaraz,42891240,1,1005588562421506048,12,12.0,I just watched the #BelmontStakes and I would like to congratulate the #TripleCrown winning jockey of #Justify Miguel Sanchez judging by the picture I see on the sports bar  TV
MirrorFootball,16902662,1,1005926658430373891,12,12.0,3) Hector Bellerin branded a hipster as Sky Sports presenter fails to recognise Arsenal defender at Canadian Grand Prix https://www.mirror.co.uk/sport/football/news/hector-bellerin-branded-hipster-sky-12677756 …pic.twitter.com/NvRIZ7EdaK
_UnderTheRadar_,160073971,1,1005911291939045376,12,12.0,NEW #UTR  | 3 SPORT STAR - Trevor Gill 19 | San Fernando High (CA) Football -Track - Wrestling  @Trevorgill22  :http://youtu.be/Atuj_gYUIew
HowardMortman,13262862,1,1005903238258929670,12,12.0,DC SPORTS CHAMPIONSHIP VICTORY PARADE:Federal employees deserted their office buildings and hearing rooms having been given two hours off with pay to watch the festivities.-- @Redskins ... February 2 1983 reported on @CNN by @KeithOlbermannhttps://www.cnn.com/videos/sports/2012/12/07/redskins-1983-super-bowl-parade.cnn …pic.twitter.com/mBhVXuMv6v
KatrinaNation,59159771,1,1006636699311591425,12,12.0,‘Athletes Aren’t Roulette Chips’: Bill Bradley Speaks Out on Gambling in Sports via @thenation @edgeofsportshttps://www.thenation.com/article/athletes-arent-roulette-chips-bill-bradley-speaks-gambling-sports/ …
NYDNSports,21445580,2,1012800254088024064,24,12.0,Top 10 rivalries in sports 10. You 9. Cant 8. Rank7. Them 6. Because 5. Every 4. Rivalry3. Is2. Special1. #Yankees vs. #RedSox  Oh baby. This should be fun: http://nydn.us/2yz7jt7 pic.twitter.com/BwYoKyl1rg
NUMERO__DOS,599310827,1,1009582529739882496,12,12.0,#WhosWhoAtTowsonU Chris  Maryland TU 21Towson Football Sports management / business communication major   DMs always open  pic.twitter.com/lW5ahrSMBc
TrabsMatt,264444497,1,1009573893261185025,12,12.0,A notable week for @erin_coykendall of @Ranger_Sports continues as she gets invited to the newest U19 Team USA tryouts. @MorganSchwab1 of @FairportGLAX @FCSDSports also got invited today.https://twitter.com/USLacrosseMag/status/1009528979571773440 …
ftimes_sports,39366481,1,1009543922866114560,12,12.0,From todays Times: Jarrod Smith enjoyed success in sophomore season with Franklin baseballPhoto courtesy Franklin College Sports Informationhttps://www.ftimes.com/common/story.php?ID=2810 …@hotdogsports @frankfortbb @FCGrizAthleticspic.twitter.com/3nKpAP7LuX
KTVU,15652540,1,1003782309823148032,12,12.0,VIDEO: KTVU Sports Director @MarkIbanez2 remembers @49ers legend @DwightC87 as a modest athlete who had a personality that people were drawn to #dwightclark http://bit.ly/2Jnkemf pic.twitter.com/CGVuxx8INj
Motor_Sport,26037957,5,1003745459402395648,60,12.0,And the winners (yes two worthy winners) of the @ChrisWardLondon Challenger award in motor sport are sports car driver @JodyFannin and rallycross racer @paige_bellerby
TechLuxuryGH,844805304470548481,1,1003741716548145152,12,12.0,New in Box Apple Watch  Series 3 38mm. GPS. Space Gray with Black Sport Band.================Only GH¢ 1499================0209158937 pic.twitter.com/9gTAfY2Y3Q
AGWeights,2712581750,1,1008858171958444032,12,12.0,HS athletes: The idea/belief that you will do what you want when you want in a weight room will not get you very far. May as well start being coachable now and do the little things if you plan on doing big things in your sport. Look at the attention to details  https://twitter.com/joeybergles/status/1008721307528122368 …
Hannah_Bevis1,1853081186,1,1008821024295710721,12,12.0,LRT: If you think that wanting to cover womens sports is somehow less than wanting to cover mens sports youre part of the problem.
TylerCorbit,770428622230417409,1,1012816665543958530,12,12.0,I love sports and rap music. Here is a compilation of me throwing rap lyrics into sports casts. I will act like my producers didnt yell at me later. pic.twitter.com/SWfhN9gMOu
rouleur,131102467,1,1012796613323055105,12,12.0,The way he pedalled was a lie. It spoke of ease and grace like a bird taking off or a dancer in a sport of lumberjacks. Anquetil Alone http://bit.ly/2Kf6tae pic.twitter.com/vkZvMJntNe
Landry_Classic,1528318724,1,1012098668198055937,12,12.0,When you play a team sport like football you dont have the right to negatively impact the season for your teammates. Not showing up to summer workouts violates that and makes you selfish! Dont be THAT GUY!
apnnewsindia,2492684167,1,1012077476015570944,12,12.0,Ace #tennis player #SaniaMirza recalls the contribution of her parents when she took up the sport and how they dealt with peoples jibes & mocking. pic.twitter.com/nljhGxLVqq
RachaelSteil,1160895626,1,1003402990684958720,12,12.0,Body shaming in athletes has often triggered life-threatening eating disorders and/or a lifelong destructive relationship with food and their bodies. This will not be tolerated in sports.http://www.runninginsilence.com/mistreatment-and-body-shaming-in-coaching/ …
