user@mention,user_id,No of tweets,tweet_id,retweet_count,local influence score,Tweet
JamaicaGleaner,40954616,1,1011034179553972226,3,3.0,Sports Minister @Babsy_grange says Fraser-Pryces statue will be erected in Statue Park in October. The statue is at the wharf here and will be cleared next week. It will be erected in Statue Park close to the Bolt statue Grange said. http://jamaica-gleaner.com/article/sports/20180624/maquette-reflects-sfps-strength-determination … #GLNRSports
CioAmaro,714480767120838656,1,1011008819739152385,3,3.0,Wary of hacks teams get serious on cyber security | Sport  | Pindi https://buff.ly/2InKjgq  #Infosec #CyberSecurity #CyberAttack #Hack #Breach #Threat #DDoS #CyberWarfare #Malware #Ransomware #Cyberwarning #Phishing #SpyWare #Tech #Technologypic.twitter.com/t4rRfjEoID
FishUSA,21477874,1,1012079410491674624,3,3.0,FishUSA Captain and Guide member Mario Chance of Reel Action Sport Fishing caught this great 12lb walleye while trolling a Michigan Stinger spoon on Lake Erie.-#fishusa #americastackleshop #fishing #fishingrod #walleye #boat #lake #fishingboat #awesome #retweet #favoritepic.twitter.com/VVeGRoiqCN
OfficialHHHCSD,702275869444857858,1,1007759725289713664,3,3.0,Congrats to our HHH athletes named All Long Island for Spring sports by @NewsdayHSsports: HSW Boys Lax–C. Mule; HSW Softball–J. Weinstein; HSE Baseball-M.Hogan; HSE Tennis–A. Srivastava; HHH Boys Badminton: K.Karott A. Tan Z. Cohen & L. Wild. #HHHCSDhttp://ow.ly/6Ofe30kwezJ pic.twitter.com/UD8pXPy4U1
Miami_Waves,2925526211,1,1007758802094116865,3,3.0,Miracle Sports All State Teams are out and the Waves girls made a huge showing!1st team 2A INF Jocelyn Alonso P Mac Bergstrom UTIL Sarah Young 2nd team 2A DP Morgan Wells. 1st team 3A UTIL Grace Kirwin.  2nd team 5A OF Maddie Wells. 1 st team 9A OF Rebecca Wells.  Represent!
LouisianaKnight,741768626,2,1008481889240453120,5,2.5,14U Black with 12-6 win over NWR Chargers 14U.  Aiden Moffett goes 3-3 Cardell Thibodeaux 1-2 with 3 runs Kade Woods 1-2 w/ 2 RBI Logan O’Neill 1-2 w 2 RBI and Tyler Wolfe goes 2-2 w RBI.  Nice weekend boys going 3-0 @2d_sports pic.twitter.com/7QTyhNX01A
zumba_zoe,771867505,2,1008852345109860357,5,2.5,Let’s bounce into action with Zumba Gold Fitsteps & Aquavibe. It’s fun! It’s exercise in disguise  TUESDAY10am  Zumba Gold Central Community Centre Lindum Street (opposite Bus Station) in the Sports Hall1pm AquaVibe Riddings Pool6pm Zumba… https://ift.tt/2JOpYWT pic.twitter.com/rWzoWp4Unq
BBallInsiders,2222250451,2,1010620029388218368,5,2.5,Sources: Carmelo Anthony Opts In with Thunder: Oklahoma City Thunder forward Carmelo Anthony has opted into his $27.9 million salary for next season by not exercising his early termination option league sources told Yahoo Sports. Anthony… http://dlvr.it/QYHwnX  @bballinsiderspic.twitter.com/en2GFPy6br
GodAmn3sia,1396212493,2,1009905966823993345,4,2.0,T6 HGE FUHJCKING KINBCEL DELTEFRTD IT WAT ER POLO IO9SA A PGHYSFDOICAL;LY DEMANDING SPOR6T ADNAH UYS3EYE NEEE S TO FUCK UOOF F MY FUCKING BVIU5T OIN SHOWS THAT WAWTWER POOIO9O IS A FUCKING SPORT THAQTY SHOULD BE TAKE NSERIOUS IBNCELLLLLLLLLL!!!!!!!!!!!!!!!!!!!!!!!!!!!!!!!!!!!!!!
TalkingScars,2238038616,2,1012093746664493056,3,1.5,2019 Hyundai Santa Fe Priced from $26480: Hyundai has released pricing information for the new Santa Fe that arrives this summer. The crossover starts at $26480 an increase of $550 over the outgoing Santa Fe Sport. For 2019 Hyundai has… http://dlvr.it/QYl2W7  Automotivepic.twitter.com/P26qG5iJuD
PottiTeam,1755776473,2,1012793258198564864,3,1.5,Football Cufflinks Football Accessories Football Dad Gifts Football Mens Gifts Football Jewelry Football Coach Gifts Sports Dad Gifts by PaintedbyCarol On Etsy from PaintedbyCarol https://ift.tt/2jRg2xr pic.twitter.com/HwlKp3F9vX
SunflowerSpa1,983512020963266560,2,1010989323179778048,3,1.5,Book NOW for a 60/90 minute massage and you will get an additional 15 minutes of Massage at SUNFLOWER SPA 850-208-1334 #massage #in #pensacola #bensacolaeach #gulf #breeze #florida #massagespa #spa #sports #beach #water #sale #relaxation #deeptissue #hot #stone @SunflowerSpa1pic.twitter.com/ggPgdu4ify
nucfootball,24067286,5,1007773822228017157,6,1.2,I am always amazed by how willing athletes are to say well I went to enoughI competed enoughI went to enough camps I went to enough trainingI play enough sports....NO compete again & again...train & then compete because the more you compete the better you get at competing pic.twitter.com/Kmla3HwShV
bowcycle,28230444,3,1006639130615296001,3,1.0,2018 Yamaha Tracer 900 CONQUER ROAD With the new 2018 Tracer 900 Yamaha has taken its popular FJ-09 sport touring platform and upped the ante with even greater comfort performance and value.  #yyc #yamaha #motorcycle #yycmotorcyclehttps://pin.it/qibaet256y7puc
Woodsy1069,49215344,3,1012120888446242818,3,1.0,Live on beIN SPORTS at 9 p.m. PCT From Red Rock Casino Resort & Spa Las Vegas NV (June 26  2018)- Roy Jones Jr. Promotions and Red Rock Casino Resort Spa team up to bring the excitement of hard hitting powerful and undeniable battles back to L… https://twishort.com/bmenc
