user@mention,user_id,No of tweets,tweet_id,retweet_count,local influence score,Tweet
elonmusk,44196397,1,1005582744980606976,3360,3360.0,19 years ago when my 1st company got bought I had to decide between buying a house in Palo Alto or a McLaren F1 (best car ever imo). Was no contest. I bought F1 & a small condo that was much cheaper than the car. New Tesla Roadster will exceed all gas sports cars in every way…
ARmastrangelo,26520948,1,1007763374120275970,1370,1370.0,I dont carry a firearm for hunting for protecting myself from potential attackers on the street or for sportAll of those reasons are perks of having the #2AI carry a firearm to dissuade government from becoming tyrannical; to remind government that it is SUBORDINATE to ME
Saber_Says,909664162946666496,1,1012116791785656320,567,567.0,Shirou: Saber!Saber: *cough* m-master...Shirou: Saber stay with me we have to win...Saber: The opponents are beyond my strength...Shirou: Never give up Saber we can win...Shirou: WE CAN WIN WII SPORTS TOGETHER!*Wii Sports Theme Song kicks in* pic.twitter.com/jciMVqsXmI
GTBaseball,112816422,1,1003777828905631745,384,384.0,With the  pick in the 2018 @MLBDraft the @SFGiants have selected Georgia Tech’s Joey Bart Joey is the highest #MLBDraft pick in #GaTech history and tied for the highest @GTAthletics pick in a major professional sports draft! #TogetherWeSwarm #ProJacketspic.twitter.com/VekQ9hUOAI
GetOnSwag,3131557841,1,1003757324501176321,207,207.0,180531 Mnet M!Cowntdown [ JIMIN #JIMIN #BTS #지민 #방탄소년단 ]KOLON SPORT - NOMAD palm trees robe approx. 140 usd pic.twitter.com/VIni7BBRej
CardsFromAttic,850435801687183362,1,1006685974695501824,173,173.0,Who wants a batch of mixed sports? #AtticSalesRookies autos & relics. These are the four lots I listed earlier. I will sell all the lots for $100 delivered. Everything pictured is included. 90+ cards.RETWEET for a chance to win an AUTO & RELIC #PrizePack. Winner picked 6/14pic.twitter.com/rLgrCHYu9J
MikeGarafolo,12513132,1,1002669352884293632,128,128.0,Carson Wentz’s @AO1Foundation tonight will present a check for $520k to Mission of Hope Haiti for the construction of a sports complex in Haiti. Wentz also announces a food truck titled “Thy Kingdom Crumb” will drive around Philly giving out free food to those in need. pic.twitter.com/7ZdsR72HLI
AndyOstroy,123281100,1,1003786656669978625,125,125.0,The United States president isnt welcome at weddings. Hes not welcome at funerals. He cant go to the WH Coresps dinner. The Kennedy Center Honors. Championship sports teams dont want to be with him at the WH. Hes toxic. A pariah. A scourge on America & the world.... #Trumphttps://twitter.com/jaketapper/status/1003777598906863616 …
nicole_mendes_,1064720095,1,1003368286569029632,124,124.0,“There is no one Holy like The Lord;there is no one besides You;there is no Rock like our God.”                            1 Samuel 2:2 •Win or lose I praise you Lord. •I love this team. I love this school. I love this sport. I love our fans. I love my God.
politico,9300262,1,1007033316929867776,61,61.0,What makes Gaza different for some is that attacking Israel is their favorite political sport Nikki Haley said.She also said that one-sided politics condemn Israel but make not one mention of Hamas who routinely initiates violence in Gaza pic.twitter.com/Obmc2JSNox
FootyAccums,263257931,1,1006638203946881030,58,58.0,Manchester United is the world’s most valuable football team in the World.They are worth $4.12 billion up from $3.69 billion last year.10 most valuable Sports teams:1. Dallas Cowboys2. Manchester United3. Real Madrid4. Barcelona5. New York YankeesCredit: @Forbespic.twitter.com/pxDfXiPQUF
Pirates,37947138,1,1013548047857483776,57,57.0,File this under Hashtag Good Tweet:Pirates rookie Colin Moran has 2 grand slams this season.....Per Elias (Sports Bureau not Diaz) the only other Pirates rookie to hit more than one grand slam in one season was Wally Westlake with two in 1947.  pic.twitter.com/YJzN9uV4lM
OtiAdjei,32858257,1,1004863796949803008,56,56.0,Kurt Okraku has told @nyannthierry on Sports Unlimited that the GFA excomm will seek audience with govt to try to resolve impasse. I imagine govts line will be just walk. Tell your boss to quit.That statement from the FA this morning suggested they just wont. #3Sports
PunishPence,841381342885625856,1,1003385183771480064,53,53.0,“In May Trump and Mike Pence recognized National Physical Fitness and Sports Month” HRC wrote. “And yet they still refuse to recognize #Pride month for #LGBTQ Americans. Why are Trump and Pence so insistent on erasing us?”https://www.teenvogue.com/story/trump-white-house-2018-pride-month/amp …
SecretMovesMMA,26061173,2,1003757406885744641,95,47.5,Im so torn. I love Whittaker. I also love Romero. I dont think Yoel has too much longer in this sport. Itd be nice to see him as champ before he walks away but Whittaker is awesome & Id be great for the MW division to return to somewhat normalcy.
ChelsTransfer,310672436,2,1005557540254617600,76,38.0,According to La Gazzetta dello Sport the Giallorossi are refusing to meet Florenzi’s wage demands of around €4m per year. #Juventus and #Inter have already shown interest but now Chelsea have reportedly approached #ASRoma to ask after Florenzi. #CFC (footballitalia)
IowaCubs,23598711,1,1013563591897776128,36,36.0,So saddened to learn about the passing of Larry Cotlar during last night’s floods. Larry was a fixture in the Des Moines sports community for decades. Whenever he came to the ballpark we grew to expect a smile on his face and a good conversation to be had.Rest In Peace Larry.
55krissi55,240684576,1,1011000699285581825,34,34.0,#imagine if UK was bombed we had no electricity no water no hospitalsno schools no food. Imagine we jumped on a boatwith our children 2escape bombs & arrived at France asking for help & France turned us away or left us in Tents for many months/years.#sport 4 #Refugeespic.twitter.com/MfcdW5kSih
EricChumbler,36378495,1,1009920157257551873,33,33.0,Here is the up-to-date McCracken County High School ALL-TIME Sports Record through 5 years as a school:• 882 Wins• 348 Losses• 71.7% Winning Percentage• 3 NATIONAL Championships• 10 STATE Championships• 37 REGIONAL Championships• Outscored Opponents by 6111 Points pic.twitter.com/AZqW01x4F7
peteroche,122745488,1,1004472666051489793,31,31.0,Ok folks dont ask 2 often but if people can RT and keep an eye out for a bike like this (Boardman MX Sport Bike - 49cm) stolen from Tesco Poleberry @ 6:30 pm this evening. 2 scumbags with cutters cut the lock and took it. Belongs 2 my young lad. Any help appreciated. P pic.twitter.com/wlzDCc6yJm
UA_Athletics,27082579,1,1011714202380185600,29,29.0,The 2018 Crimson Tide Sports Marketing schedule poster is on sale now! Order at least 100 posters and you can add your logo to the bottom. Individual posters are available for $5.Email: ua.calendars.posters@gmail.com for your order form!#RollTidepic.twitter.com/eXp9gEu80W
Shefit,48525283,1,1011715844055937030,28,28.0,I have finally found the HOLY GRAIL of sports bras! The Shefit Ultimate Sports Bra is incredible....They’re the first brand I’ve found that I can run & actually feel supported. @AshAlexiss is making us blush calling the Ultimate the Holy Grail of sports bras!  pic.twitter.com/isIMnPPPXS
ItalyMagazine,17616232,1,1010647457762631680,28,28.0,A Tuscan island where one would love to be exiled. Elba Island offers stunning beaches great hiking diving and water sports and numerous charming towns worth exploring. Hop on the ferry from Piombino to your next Italian paradise https://bit.ly/2tc8sBT  #VisitTuscanypic.twitter.com/nLifW1C00K
ArmstrongTroy,445450236,1,1003751984879554566,26,26.0,A Lad should just walk out with a can in hand average shape and say  I love pints  Im spot on  a dont cheat  love sport and love me marras.  Who wants it? If ya dont then fuck of with them lads who eat chicken n rice n pout. #loveisland
tokenpay,870761709274902528,1,1013525367347470336,24,24.0,Yes sports betting is a HUGE part of our business. Our TokenGaming division is very active in LATAM market currently in sports (World Cup right now especially). CrytpoBet will allow account funding in $TPAY $XVG & $LTC with the integrated $EFIN exchange and denominated in mBTC.
richard_conway,16241871,1,1003751252499582976,23,23.0,The review will see talks held with safety groups EFL Premier League + fans. Whitehall source: “The Sports Minister hasn’t shut the door to fans keen on standing sections being introduced but it is important that all the evidence + viewpoints are considered extremely carefully”
Ex67T20,766092631961133056,1,1012109677998628871,23,23.0,Boycott all Anschutz Entertainment Group (AEG) venues services sports teams and festivals. When you pay Anschutz—a longtime friend and benefactor of Neil Gorsuch—he pays McConnell Hatch and Grassley PACs. Maybe he has a name in mind for the next Associate Justice. @Rosiehttps://twitter.com/ex67t20/status/1012105729191350284 …
AbramsonFL,82441598,1,1011033096681029633,22,22.0,Totally overlooked when I bought my house: how awesome it is owning a big mango tree. Mango season is filling my evening sports void. Grabbing impossible to reach mangoes with a basket attached to a pole = real Florida living.
UQPoche,968999499988312066,1,1011031898611539968,22,22.0,#UQ Poche Affiliates in the news - Sports historian A/Prof Gary Osmond on the story of Cherbourgs marching girls Aunty Sandra Morgan: It put Cherbourg on the map and thats something we can look back on with pride. Read it here: https://ab.co/2lz6Z4e  @UQ_Newspic.twitter.com/B1SmLY01vK
DanielleDwyerTV,81770955,1,1007759127148408834,22,22.0,This story is one of those this is why I love sports today ones. Reece Mutchlers glove broke shortly into day one of baseball camp. Thanks to the quick thinking of Central Catholics Justin Schiets Reece got a new glove and continue with camp. Heres their adorable story: pic.twitter.com/J0taXoVaSu
pyanity,529562425,1,1009909738614779915,21,21.0,A couple of guys who’ve done a world of good for Clemson athletics Tim Bourret (right) presents Sam Blackman with a jersey at a gathering to honor Sam wrapping up his 36-year tenure in Clemson sports information. Bourret is also moving on after 40 years with the school. pic.twitter.com/GX0L9IiV8h
dawson_johnsonn,2729941578,1,1012843878574014464,21,21.0,What’s the most dangerous sport?16. You15. Can’t14. Compare13. Them12. To11. Each10. Other9. Because8. They’re7. All6. Dangerous 5. In4. Their3. Own2. Way1. Cheerleading
kcg__,61705587,1,1009576138438467586,19,19.0,I will NEVER understand the pleasure of killing animals for sport.These exotic creatures could potentially go extinct and for what?You flew to THEIR home 1000s miles away just to kill them?For what purpose?Their lives have more value than to be your target practice. Whack asf https://twitter.com/crawfordkacee/status/997652033665683457 …
Kristian_Walsh,22246665,1,1013532863000662016,19,19.0,Fans being happy when their rival team loses is OK. Fans enjoying a player who they don’t like suffering a bit of misfortune is OK. Fans not being elated in victory or downtrodden in defeat is OK. It might be irrational but it is ultimately an irrational sport. Let everybody be.
_pivx,4020178512,1,1008497845253570560,18,18.0,#PIVX + KKS Rawa Katowice - Champions! They won against the current champions of Poland. Now headed to Warsaw to represent the City. Congrats guys! Way to represent the sport and PIVX! #PIVXsports #community #PIVXambassadors https://www.facebook.com/KKSRawa pic.twitter.com/Rh4iMSSRdX
_HelenHollywood,1559783886,1,1012099187914301440,18,18.0,A couple little Explores today.... here’s some shots from this beautiful overgrown graveyard  #exploring #abandonedplaces #graveyard #nature #photography #church #portrait #england #youtuber #vlogging #OOTD #sports #fashionpic.twitter.com/YidccdcI6v
FCBarcelonaFl,130154420,6,1007727675614683136,106,17.666666666666668,Inter Milan are interested in signing Barça player Aleix Vidal this summer. Inter want to negotiate a loan deal with a buy option and would be ready to pay 10 million euros in the future [la gazzetta dello sport]
AndrewKingMLS,180664630,1,1006657550937444354,17,17.0,Austin City Councilwoman Alison Alter is very unsure about PSV’s proposal. She cited a survey where economists overwhelmingly agreed that economic costs outweigh benefits of new sports teams.“Austin is exceptional in many ways but I don’t think we defy the odds of economics.”
dev9t9ok,951563980702699520,1,1010667956114731018,17,17.0,#WorldCupWithSeele Seele isnt just a blockchain its the blockchain of the Next Generation 4.0! Seele will become the leader in the industry as the same as Football is the most popular and best sport on our planet! @SeeleTech https://seele.pro/  #Seelepic.twitter.com/vWB47S9uXO
PhilSzostak,47679345,1,1007766266583498752,16,16.0,“My pitch [for #Qira] was related to my youth in 70s suburban Britain when skinhead girls would sport the ‘Chelsea Feather Cut’. That combined with a graded skin colouration was as weird as I wanted her to go.” - #StarWars costume designer Glyn Dillonhttps://instagram.com/p/BkDPYIoFYiU/ pic.twitter.com/K0AulNEWZN
cjponyparts,89528523,1,1007044078301827073,15,15.0,Have you heard about the new #2019GT350 updates? Recalibrated MagneRide Suspension revised 19 wheels sticky Pilot Sport Cup 2 tires a new spoiler with optional Gurney flap and much more!RT if you want one in your driveway!GT350 vs GT500 --> https://cjpony.parts/2LJDJTp pic.twitter.com/h2T1pAVKDl
Trojanpak_2019,1658422242,1,1006636495132905473,15,15.0,Dear class of 2018...PEACE OUT y’all will be missed but #thelegacycontinues and it’s time to show the valley how it’s really done Waddup 2019’s Everyone showin out to every game this year fall sports already grindin bouta catch a #7peat #watchout #soon2b7 #19’s
ReadMoreBible,2353221863,1,1012823885912342529,15,15.0,Entertaining people in church DOES NOT WORK!Entertainment gets BORING & people will move along back to their Netflix & Sports.Church needs to FOCUS like a laser beam on Jesus. He said ”learn of me.”Helping people to LEARN through #scripture about Christ NEVER gets boring.
NorthTexan,28860427,1,1011738398233649152,14,14.0,#UNTalum Joe Greene will continue his support of #UNT this Friday with the Nibble & Mingle Fundraiser benefiting the Agnes Lucille Craft Greene Memorial Scholarship. Get tickets for the event that boasts sports icons and amazing culinary creations. https://bit.ly/2tdAVXH pic.twitter.com/jSle3F293C
JohnMcCarthyMMA,788197512,2,1011013354746331136,28,14.0,There are differences between the two. Both are MMA promotions. The UFC has the largest roster of fighters in MMA. Bellator allows fighters to compete in other combative sports like Boxing & Kickboxing . Bellator allows sponsors while the UFC regulates Reebok pay #AskBJMhttps://twitter.com/chandlerhilton/status/1011001559474491392 …
CoachFerrell1,337812163,1,1012117410906853376,14,14.0,Brazosport HS (Texas - 4A) has a varsity Asst football defensive position available: DB or OLB (3-4) plus2nd Sport.Tx Teacher Cert required: Teen Leadership or Math are available. We have excellent facilities and excellent pay. Send resume to Michael.ferrell@brazosportisd.net
da13thsun,49503851,1,1007768358182408192,14,14.0,I know dudes scared of prison & will do county time.Th County is like a concentration camp & prison is like real life to stimulate your minds with law library Religious library music sports exercises everything to make you better if you utilize whats there.
DennisGucci,306123365,1,1007727404754833408,14,14.0,@OtiAdjei  is correct @Cristiano  isnt the first to score in 8 major championship Ghanas @ASAMOAH_GYAN3  has scored in 9 2006 World Cup2008 Afcon2010 Afcon2010 World Cup2012 Afcon2013 Afcon2014 World Cup2015 Afcon 2017 Afcon@MailSport @ESPNFC @BBCSport @FIFAWorldCup
numbrrzz,551385464,1,1003409579143770113,14,14.0,Just shook hands with Doug Ford in Oshawa and the Golden Arches-I asked him if he got his sport jacket at Holt Renfrew- “I’m a Walmart guy”- he answered union members question bluntly- he is more impressive in person- no handlers “protecting” him either- Doug is what Ont needs
WoburnYearbook,1135537766,1,1005589927126499328,13,13.0,Congrats 2018 yearbook staff -TWO Best in New England Awards– Outstanding staff performance and Advisors of the Year!!   Four Showcase awards Outstanding sport page design divider concept & design graphic design treatment page design.  @WMHSTanners @WoburnSchools @HJYearbookpic.twitter.com/vp7SXSBUNI
vcpirategolf,818893703800422400,1,1003769613333626880,13,13.0,@JoeyHerrera28 honored as Ventura College Male Athlete of the Year at last nights Ventura County Sports Hall of Fame. First golfer to receive award since Jim Johnson in 1986! Great career at VC Joey! pic.twitter.com/mzL7laOGLC – at Ronald Reagan Presidential Library Treasures of the Vatican Exhibit
ukshaolintemple,135435627,1,1008824162717224961,13,13.0,Check out this kick great height. Can you kick this high? .#highkick #highkicks #kicks #taekwondo #karate #taekwondokick #karatekick #martialarts #sports #wushu #koreamartialartspic.twitter.com/Sci53tt7yZ
Limited66702616,756519785018626048,2,1009540598586642433,25,12.5,Autographed #JackEichel Authentic #Buffalo #Sabres Home Jersey (AJs Sports World COA) @ ONLY $350! #AUCTION ENDS TONIGHT 6/20-11pm!http://pristineauction.com/a1579872-Jack- …#BuffaloFire #BuffaloSabres #SabresNation #Bills #BillsMafia #BuffaloSabres #NHLDraft #NHLTonight #GoSabres #StanleyCuppic.twitter.com/5phQPRuQ9J
ZwebackHD,1382690611,1,1002686378923253760,12,12.0,For anyone that hasn’t followed Sky Sports went after Sterling for a gun tattoo he has on his leg. The harassment got so bad Sterling had to explain that its symbolic for him as a reminder to never pick up a gun bcz his dad was killed by gun violence in Jamaica. SMH.  https://twitter.com/zwebackhd/status/1002646345482735618 …
LFCknowledge,92574521,1,1005592450965147648,12,12.0,It is my understanding the deal has not fallen down because Liverpool tried to renegotiate the terms of the deal. Liverpool did not attempt suggest or offer to renegotiate any terms for Fekir. (Phil McNulty BBC Sports chief football writer)
EnjoyInterNews,931940660,1,1005577968226308097,12,12.0,RMC Sport: #Juventus #Napoli #Roma and #Inter could well show interest in #Fekir after #Lyon released a statement terminating negotiations with #Liverpool. The player had a medical with Liverpool but the talks had been “definitively terminated at 20.00.”pic.twitter.com/jIm0RpiKMD
AlexKennedyNBA,23065057,1,1005559098929278983,12,12.0,Instead of going from site to site looking for 2018 NBA mock drafts just read this one article! @HoopsHypes aggregate mock draft averages out where each prospect is projected to go based on mocks from ESPN NBADraftnet The Ringer SI and CBS Sports: https://hoopshype.com/2018/06/06/nba-mock-draft-consensu-big-board-luka-doncic/ …
airmax_power,808528151458566145,2,1012834731916963840,24,12.0,20 days on Twitter 1K followers now is time for 2 weeks off  #vacation #socks #gay #fetish #kink #dirtysocks #Nike #NikeTuned #TN #sweatysocks #sport #fitness #muscles #Adidas #shorts #feet #fitness #bottomboy #gym #workout #soccerpic.twitter.com/b4J2hRauuB
HawgHatJoe,4755747517,1,1012822465616273409,12,12.0,TQ Jackson @TQJ3_Needs to feel some Razorback WoooooPig Soooooie! Currently rated the No. 2  prospect by East Texas Sports Network. He has had an OV at THE University of Arkansas and loved it.  Whats NOT to love.A BIG OLE WOOOOO PIG SOOOOOIE to TQ ! http://etsn.fm/east-texas-25-no-2-t-q-jackson-wr-jefferson/ …
TheNightGallery,190403384,1,1003380805832454152,12,12.0,Sports item circa 1974: Battling Maxo accompanied by his manager and handler arrives in Maynard Kansas for a scheduled 6-round bout. #ZoneIntros #S5E2 Steel -- starring Lee Marvin and written by Richard Mathesonpic.twitter.com/78INDhDe2z
StevenKelsey13,954369255633539072,4,1003387815957336064,47,11.75,Lol MJ played college ball that doesnt count as wear and tear? and i wont debate with you about offense LBJ is playing unbelievable on the offensive side of the ball but the dude is playing little to no defense basketball is a 2-way sport LBJ plays 1-way MJ 2-way
CivvyKarla,785171743031848960,1,1009909785041481733,11,11.0,Right troops off to bed. Dates for the #veteran sea camp are set at 8/9 Sept it’s a weekend. It’s free to Veterans. Anyone who needs a break from the norm. It’s in West Kirby. No kit needed no cost. Just banter sport and the sea.  Night All pic.twitter.com/ko5GfTksru
DrDiscHamilton,314057284,1,1011030280008855553,11,11.0,#ArkellsRally Night #2 at the soft open to Odds (@oddsthebar) 164 James St S the new sports bar joint venture between Max & Nick of @arkellsmusic and The Other Bird group! Digging into the Dennis Rodman nachos (with pork belly!) and enjoying the warm friendly vibe! Mark at DDpic.twitter.com/44KBy6E2Ru
ERHSFB,975837216860786688,1,1010982088999358465,11,11.0,Schedule Change Alert The Knights will drop the Black and Gold game on 8/10 and have accepted an invite to play West Orange in the referee clinic on 8/11 @ West Orange HS. Time: TBA. The Knights are 5-0 all time vs West Orange. @ERHSKnights @erhs_cheer2 @DC__Sports
JrMoe_,545022186,1,1007772354230005760,11,11.0,I don’t hate Cristiano Ronaldo. I think anybody who hates CR7 Messi Ronaldinho Maradona Pelé and all the phenomenal legends ain’t a real football fan. But if you say Ronaldo is better than Messi you have to be talking about another sport. Period. #PORESP #POR #ESP #WorldCup
Namouniho,1495775742,1,1007755976185958401,11,11.0,Being in a car with my mum and dad is a nightmare. Today I found out my dad doesnt know how to use a sat nav or drive in the city my heart was in my mouth and then theres my mum fam doing being sport commentary in the backseat. BALAK ZEBRACROSSING BLA3KAL FERROJ
ConsuladoEspMel,1581925075,1,1008498164591017986,10,10.0,Fernando Alonso  wins Le Mans 24 Hours to get closer to triple crown!  The 24 Hours of Le Mans is the worlds oldest active sports car race in endurance racing held annually since 1923 at the Circuit de la Sarthe Le Mans France  pic.twitter.com/EMssb5Sy2x
BearArchery,69807727,1,1005577813804675072,10,10.0,Archery is more than a sport or hobby. Its a lifestyle and passion that teaches us lessons in ethics responsibility respect and an overall involvement with nature and the environment #BearArchery #PassItOn #Archery #FredBear #ArcheryTraditions #Bowhunting #YouthArcherypic.twitter.com/Q08XXy0SdW
zenzurzb24,771502055668256768,1,1006669085692891136,10,10.0,HELLO LOOK POSITIVE WHATS #SPORTS adv DIRECTLY CONNECTS2LOVE CHOICE #MO IS A MODEL OF PEACE BLESS KEEPGOING #MOSALAH #WORLD NEEDS U MORE U R A #SYMBOL of CURE 4 #LOVE #PEACE #HOPE THATS WHERE FAKE RECKLESS HATE IF HOW #MEDIA #PORTRAY VIEW IT NEGATIVELY DEVELOP #POSITIVE #lGetREALhttps://twitter.com/RobHarris/status/1006214490067800065 …
t_jaey,204721666,1,1011732574182486022,10,10.0,@BBCSport @FIFAcom @OtiAdjei #VAR is a perfect system. Aim is to assist refs. Doesn’t take decision away from refs but gives them an advantage to review an event and make better decisions. A bad referee will still make wrong decisions even after a billion reviews. VAR #Goals
IntFSPT,2370481098,1,1011718208989093888,10,10.0,IFSPT Symposium on Sports Injuries in collaboration with the Panhellenic Physiotherapists Association Sat June 30 8 am to 6 pm at the Olympic Committee Amphitheatre in Athens Greece. The symposium is being offered free to all IFSPT members. http://Isosi.psf.org.gr .
QuintusCurtius,1634208277,1,1008814242831699969,10,10.0,How kids in 1982 spent summer:  playing sports working part time job working on their cars.How kids in 2018 spend summer:  taking computer courses music lessons for instrument they hate cram courses soy courses Chinese classes.  Glad Im not a kid today.
BardishKW,2696723713,1,1010633423726219264,10,10.0,The CCBC’s Annual #CanadaDayFair is a piece of home away from home & Canada’s favourite winter sport is on full display Happy to join Canadian biz from coast to coast to coast in #Beijing to promote the best our country has to offer! #PuckDroppic.twitter.com/62wgrtfCIX
CarvalhoJTElite,311974888,1,1012827634810617857,10,10.0,According to Gazzetta & Corriell delle sport Roma rejected chelsea €60m offer for Alisson & Chelsea could now go for Donnarumma. NO to Donnarumma hes rubbish on the ball & is not that good just tall would be replacing Thibo with a worse version of him.
WestmorelandSN,300730006,2,1008821831636156416,19,9.5,Hempfield wins its third straight PIAA softball championship; Robert Kennedy puts on a show in the Foothills Classic; Cali Konek has transferred again; Norwin selected to host football championship and MORE in todays Westmoreland Sports Notebook: http://www.westmorelandsports.com/news/2068 pic.twitter.com/3nWIf31iqw
PvBoiZeroni,996073291377881088,1,1008467180986351616,9,9.0,Bro I was recycling all the empty beer bottles in my Mexico jersey & my neighbor I’ve never met screams out “MEXICO MEXICO!” He had his Serbian flag wrapped around him and says “congrats on defeating Germany that’s huge!” World Cup brings everyone together man love this sport!
MMindrumMD,957767862101438465,2,1007036515434881029,18,9.0,Major flaws (some question fraud) in journals (i.e. NEJM ) & landmark PREDIMED study. This issue in science w/ pressure to publish industry bias and conflicts of interest among authors of guidelines are equivalent to doping in sports. Medicine has a looming credibility crisis. https://twitter.com/skathire/status/1007013711444185088 …
