user@mention,user_id,No of tweets,tweet_id,retweet_count,local influence score,Tweet
Oldfirmfacts1,514906408,4,1013550593468747776,14,3.5,My @Record_Sport column on today’s World Cup TV coverage features . Fabregas/Ralph Wiggum. Ross Geller’s wedding. Hogmanay journalism. Lineker’s War on Patter. Neville explains opinions. Neville doesn’t explain penalties+ morehttps://www.dailyrecord.co.uk/sport/football/football-news/world-cup-not-so-super-12834582 …
bikeregister,164641386,4,1007746843357433863,14,3.5,Stolen Bike: A Charcoal SP Rockhopper Sport 29 - SP Rockhopper Sport 29 has been reported as stolen from London EC1V #bikestolenpic.twitter.com/O5nMM69aCu
JimB3rd,766623516615643136,8,1006641442964504576,28,3.5,Bensalem  1LaSalle      3Mid 4th inningBens:Parrish single Run(Miller E on pickoff try)Dean single 1st & 3rdAldrich E5Revell sac 2-4Lavender 1-5 FC (PR)Rooney HBPGrady 6-4PIAA baseball Class 6a semifinal@SOLsports @pclathletics@Owls_Athletics @LaSalle_Sports
CarBombBoom13,364664580,2,1010638909766856704,7,3.5,“Former NHL players Daniel Carcillo & Nick Boynton r suing the league alleging it failed to warn players about the long-term risk of brain damage from fighting.” You are still inaccurate with ur  reporting. Go & read my statement from yesterday & retract the above paragraph.
ps6811,89452950,1,1002696697473052672,3,3.0,Like really?! Dude Nike paid Naija to make that Jersey not the other way round. And secondly the design of that Jersey was done with the help of some creative Nigerians....and one question pls which sport jersey making brand in Naija would have done a good job?
tsitra360,449273633,1,1002677537250504705,3,3.0,This weeks finished sketch commission. A lot of big characters and food sports.Want a sketch commission? Stop by when I stream on http://picarto.tv/tsitra360  on Mondays and Wednesdays for sketch commissions.pic.twitter.com/a6Z9U5ySRk
ProAmSports,59218486,1,1002676050508144640,3,3.0,We are having TGIF drinks in the #YEG #ProAmFanCave and we are using our slick new Remote Control #Zamboni cooler.(with Bluetooth Speakers)Well most of us are have a  Pro Am Sports Zamboni Cooler TGIF Drinks https://youtu.be/g3Fd_QS6Bt4  via @YouTube
capsunitedfczw,470927687,1,1002675231650205696,3,3.0,Black Rhinos ‘Luv Dat Chicken’Black Rhinos dismissed visiting Chicken Inn following a 2:1 victory in a Castle Lager Premier Soccer League match day fifteen played at the National Sports Stadium on Friday.... http://sportbrief.co.zw/2018/06/01/black-rhinos-luv-dat-chicken/ …
hellmann_nick25,2315775859,1,1002668284909678592,3,3.0,My sister Sam: The Cavaliers they have that one famous guy right? James?Me: yeah that’s his last nameHer: Tyler James? James James? Kevin James? Antonio James.....  I’m looking it up. #sports
JudyReiser,276015532,1,1008485692954038273,3,3.0,Sportsmania! #Sports & other #Oddities revealed in #eBook. Youre crazy too! And I Thought I Was Crazy! Quirks Idiosyncrasies & Meshugaas” #behavior #nonfiction #competition #habits #athlete #luck #game #funny #kindle #smashwords #iBookstore #nookhttp://amzn.to/TbnDRZ
LizIzWild,1292539885,1,1008474853949825024,3,3.0,A man putting other men first what a surprise.Meanwhile actual women can give up our places in sport expect to find men in our changing rooms refuges prisons. We can book place in a womans hostel & find men who self id as women in our showers. But sure mens feelings first.
BehindTheGloves,1301554231,1,1008470544784744454,3,3.0,Roberto Garcia (41-3 24KOs) vs.Martin Murray (36-4-1 17KOs)WBC silver middleweight title. June 23rd O2 Arena London BT Sport HD / BoxnationAlso...WBO European and Inter-Continental Light-Heavyweight TitleYarde vs. SekEnglish Heavyweight TitleDubois V Little pic.twitter.com/Mxsm0kh2U4
SabukAfridi,2879709882,1,1008467733036531712,3,3.0,Remember Jahangir Khan (Paks former Squash player) has won 555 matches continuously & ws unbeaten.Thats a world rcord of winning games continuously in any sort of sport! He is the king of all sportsAnd aj kal ap log Federer aur Ronaldo etc se impress ho #PakistaniTujheSalam
methodracewheel,111134456,1,1007037251681783808,3,3.0,All new #Bronze 15x7 VT-Spec Rally Wheels coming soon!These beauties will fit 5x100 and 5x4.5. The #MRW501 comes with a +48mm offset for more of an OEM fitment while the #MRW502 will sport a more aggressive +15mm offset.#methodracewheels #rally #wheelspic.twitter.com/6nErqv8vPK
NBCDowdMan5000,820048440122077185,1,1007034938158452736,3,3.0,News sports concerts countless ceremonies film fest awards fests on wknds guest speakers CES grad video NBCs 1st film fest mentors chaperones classes collabs w dpts etc.  Milestone year for nbcVP! @Northern_TV @nbc_hsprincipal @nbc_msprincipal @EmerMatt @nbcsuperpic.twitter.com/LqRok171UK
BGSPE1,862161602,1,1007017822256615427,3,3.0,Successful day at Rivertime Regatta at Bisham Abbey where our students did BGS proud by leading 318 students from Special Schools in Bucks Berks Oxfordshire Hillingdon and Northants. A competitive bell boating sports leaders comp to end the day!! pic.twitter.com/EAMXnn8vqH
BeccaWVGirl,753838376,1,1005597925848862726,3,3.0,Let me remind you what that homeless scarf wearing no bathing jack ass people say Dakota is riding sports in his stinky stretch pants.  I wouldnt insinuate shes lucky if I were you unless youre impressed and satisfied with a micro penis. pic.twitter.com/6klUMQSvLw
_equain,54306706,1,1005591419958984704,3,3.0,I’ve witnessed the following all in the last 3 years:2 Triple Crown horsesA Philadelphia Eagles Super BowlA Cleveland sports championshipA Washington D.C. sports championshipA Chicago Cubs World Series winNothing makes sense anymore.
Spruce_Meadows,132705035,2,1013544585916641280,6,3.0,Wow - an exciting day for the Deslauriers family! Mario Deslauriers  and Bardolina 2 wins the Pan American Grand Prix presented by Rolex and daughter Lucy  and Hester place 2nd. Super day of sport! #SMChampions #SMPanAmerican #FamilyUnitypic.twitter.com/N00VUcy6lN
RacingDaily,503429423,1,1005583869087768577,3,3.0,The Israeli Culture and Sports Minister Mirian Regev from the conservative Likud party is being accused by several Israeli officials and football fans of politicizing the match by moving it from Haifa to JerusalemAnd there you are. They r literally looking to incite trouble
HockeyNight_OTT,1370653910,1,1005583209801895936,3,3.0,Let’s not forget that there is still Pro Hockey being played and not only does it involve a Canadian  team it involves an Ontario team; Toronto Marlies. The Marlies are in the #AHL #CalderCup Finals against the Texas Stars (top affiliate of NHL Dallas Stars) #GoMarliesGo
mmafightermgmt,1000466618047193088,1,1005932115047976960,3,3.0,Follow MMA Fighter Management Inc. on Facebook Instagram & Twitter!  @mmafightermgmt ———#mma #kungfu #karate #bjj #fitness #muaythai #taekwondo #boxing #aikido #follow #ufc #fight #wmma #news #jiujitsu #sports #wrestling #judo #grappling #kickboxing #martialarts #workout #gympic.twitter.com/rmOaa263rU
StarTimes_Ng,420462653,1,1005906432347209729,3,3.0,Amazing offer to watch all 64 matches live!Hurry now subscribe to #StarTimesApp ON Sports package for N450 only instead of N1500 for the first 40000 users. Offer valid before 14th June.Get App now: http://goo.gl/SqMymW Also available on Google play store & IOS app storepic.twitter.com/NyvDDt95hG
ProfKRichardson,912961818057953280,1,1004498053443801089,3,3.0,Men with long hair competing with women in sport. There’s biological difference between male & female bodies. Men are built differently to women. Women bear children. In a competition to give birth men can’t even compete. What a shame this blatant disregard for reality normalised
speedwaydigest,231433733,2,1011759792237391873,6,3.0,Kyle Busch Sweet Home Chicago: When it comes to the patriotism among sports fans the passion that NASCAR fans have for their country is difficult to beat. With Fourth of July on the horizon Kyle Busch driver of the No. 18 Skittles® America Mix… http://social.nascarne.ws/QYd6yP pic.twitter.com/qTaaOA86Mr
impromelbourne,21836735,1,1004490717874487296,3,3.0,Theatresports™ is capable of inducing laughter tears and sport event style screaming.Learn with Patti Stiles who was taught Theatresports™ by Keith Johnstone at its birthplace the Loose Moose Theatre Company. #improv #impro #theatresportshttps://buff.ly/2xNeUDN pic.twitter.com/Vy649j1qfS
Beto4SenateSA,999471631780245506,1,1004468821971828736,3,3.0,We are so hyped! Beriah Wall a very talented New York artist sent us these amazing hand made Beto pins and coins! Our volunteers love them we can’t wait to sport these wherever we go! Thank you Beriah! #BetoForTexas #BetoThanCruz #Volunteer #BetoArt #ArtistsForBetopic.twitter.com/7rajyQMBB7
inthe_kookiejar,3200866247,1,1006680781572501505,3,3.0,AU  Cᴀᴛᴄʜ Mᴇ Iғ I FᴀʟʟSince the accident Taehyung has been struggling to get back on his game. The ice doesnt feel the same under his skates and his body rejects the choreography. Hes hurting and the only person who can help is his sports therapist Jeon Jungkook. pic.twitter.com/SDQ8ENfY9h
Overmayor,193814597,1,1006657258292473857,3,3.0,I guarantee theres at least one guy whos really pissed that nobody got removed from Smash so he cant make an image of the removed characters dissolving with the caption Mr. Sakurai I dont feel so good. I guarantee that this person exists Im going to hunt them for sport.
FambroughAdv,722300120,1,1006654025641668613,3,3.0,An clarification on the approval of Tulane as the sports medicine provider for the LHSAAs events. Bid is for three years not two as it is with most items bid out. LHSAA Executive Director Eddie Bonine confirmed this #LHSAA @AdvocateSports
TrumanAthletics,38175224,1,1011759078882856960,3,3.0,MBB: At the half @TSUBulldogHoops leads Star Sports Basketball by 14 53-39 and outscored them 31-17 in the second quarter!Scott leads all scorers with 11 to go with five assists and three rebounds while Thomas has 10 points three rebounds three assists and a steal!
FremontTherapy,872184990670434304,1,1011736350616444928,3,3.0,Victor is our PT who is working toward a board certification in Sports to better serve the athletes in Fremont. He graduated from Creighton and is trained in dry needling. When away from work Victor can be found with his wife and 3 children at a nearby park pool or splash pad! pic.twitter.com/SReZUUc1u9
KittyCat_Cammy,3856541063,2,1011021679278088192,6,3.0,This is what NA WESTERN Loves so Team Ninja Deciding To Kneel down Give the Middle Finger To The Fan BaseAll while letting TOURNAMENTS E SPORTS SJW tell them what is acceptable Team Ninja is scare of the western Backlash meanwhile NAMCOSNKCAPCOM Deliver the Fan Service
aaronbronsteter,25122451,1,1011720965494136835,3,3.0,Khabibs manager Ali Abdelaziz tells @TMZ_Sports that a fight between McGregor and Khabib would likely take place in October in Vegas November (although hes unsure if McGregor would get licensed in NY) or December in Vegas at the end of 2018. https://twitter.com/TMZ_Sports/status/1011718577152458753 …
MissClairabelle,29705496,1,1011716990606696449,3,3.0,Protecting your teeth in contact sports is a must! Saw a cervical to incisal edge fracture luckily only the labial surface during training. Investment into custom made sports guards are essential! Less costly in the long term.@Roseville_DP made mine. Superb service.
RAMSPORTFITNESS,827521381,4,1004864450636271623,12,3.0,Go hard or Go Home. #training #fitness #sports #youthsports #pilates #yoga #exercise #nsca #nasm #strength #conditioning #athleticperformance #sportsperformance #workout #HIIT #workout #fitfam #fitlife #gym #gymlifepic.twitter.com/4FPjMhaoau
TooToughToTame,40935002,1,1009575388421316608,3,3.0,One of the most iconic moments in the history of the sport came at Darlington Raceway in September 1985. Bill Elliott became the first driver to win the Winston Million and took home a little extra change when he pulled into Gatorade Victory Lane at Darlington. #WinnerWednesdaypic.twitter.com/AmOnTSHHGN
CliffShiko,902621407,1,1009571864476311552,3,3.0,#JoyceMashamba served in Limpopo cabinet with Aaron Motsoaledi Maite Nkoana-Mashabane Letsatsi Duba Dikeledi Magadzi Collins Chabane under premier Sello Moloto & Cassel MathaleServed as MEC:Social DevelopmentSafety & SecurityEducation & Sports#SABCNews#RipJoyceMashamba
RLSsport,506482713,1,1009558488803143681,3,3.0,Fantastic day for #rlsathletics today with 4 new school records being set and we haven’t even got to sports day!! Jaden King Y7 LJ 4.79m Olivia Paoli Y8 300m 47.15s Georgia Crothers Y7 HJ 1.25m Anna Douglas Y9 HJ 1.36m. @TheRoyalLatin #proud
rmccsportsreco1,992564840588873728,1,1009550595676569601,3,3.0,Availability for all 3 Boots this weekend. No matter your sport or career these boots are brilliant for Preparation or Recovery. £25 for Hire this weekend. Available from Thursday to Sunday. Take the boots back to your house for use in your own comfort.  #Prepare #Rest #Recover
fruityoongs,959884611122810881,1,1009542038856101890,3,3.0,Lastly Jungkook is the main vocalist and dancer and sub rapper. He is known as the Golden Maknae because he is the youngest and good at everything: dancing singing cooking sports etc. He makes video edits (Golden Closet Films). He also produced Magic Shop of their new album. pic.twitter.com/auL5B30p5w
MySpecta,932547773886554114,1,1009926758018281473,3,3.0,SYDNEYA spectacular natural harbor THAT Opera House beaches galore and a thriving sports and foodie scene make Sydney one of the world’s great all-round cities an outdoor-lovers’ paradise with a flair for culture.Explore#InFive #5MinutesMadness #MySpecta #Money #Wealthpic.twitter.com/1fgL9nKjOb
TwinsDiversity,288880119,1,1009921586483417089,3,3.0,Join your Twins today in celebrating Pride at @lavmag Pride Score Thursday at LUSH. We will be sharing information about our upcoming Pride Night on July 9th as well as enjoying a fun night with all of Minnesota’s pro sports teams! #CelebrateDiversity #Pridepic.twitter.com/N9kKvA5OMl – at Lush Food Bar
WPalmerSport,433304640,1,1003776852681547776,3,3.0,An athlete’s right to clean sport translates into WADA stakeholders’ (and staff’s) responsibility to deliver an effective/proportionate anti-doping regime. This is not presently the case. Without a benchmark for prevalence how can athletes hold WADA accountable? @BeckieScott4
RiverwoodAcad,3679880182,1,1003774383125618694,3,3.0,Congratulations and THANK YOU to our high school students: Jake Torraville Carly Stratton Emma Saunders and Carmen Nippard who have volunteered with Ms. Tracylynn Smith and Ms. Tanya Smith for the last two years to run our After-School Sports program! pic.twitter.com/o6IhM4J2ci
tilly64,72160503,2,1004864912542220288,6,3.0,@nrma submission into cbd light rail argued that the city would be gridlocked and drivers were unaware of the impact it would have. Submission ignored and buried. The light rail designed to activate Sports & Entertainment Precinct #MoorePark was never about mass transport.pic.twitter.com/rVgvGiHHuG
Metalsub_,957605175862202368,1,1003759881655062528,3,3.0,We have the valves that your equipment needs. Dont hesitate to call us and we will offer you everything you need we are specialists in valves hoses and accessories. http://www.metalsub.com/valves.html  #valves #scuba #dive #diving #sport pic.twitter.com/saEvKl68Oz
YukonGale,86344211,1,1003753361479331840,3,3.0,I’m afraid that CPC’s endless barrage of skewed facts (to downright lies) and character assaults will do to Trudeau as Ontario PCs 4 year dirty campaign did to Wynn. Politics is a blood sport but the Conservative way is not sporting it’s just disgusting.
Gift_of_Kit,1000125756524122112,1,1003747996192985093,3,3.0,Since we began our quest to help sustain grassroots sport we have teamed up with major brands such as Sky Sports TradePoint and Kia to provide over £1 million of free kit & equipment to grassroots sports clubs in the UK. Tag your team and follow us to see our free kit offers!
ISD709News,903717734407692289,1,1003743927864905728,3,3.0,U.S. Bank & MN Vikings announce Stowe Elementary & Gary New Duluth Rec Center to receive $50000 thru a U.S. Bank Places to Play Grant! Funds will help build multi-sport court w/basketball pickle ball four square hop scotch community garden skate park.#CommunitySupportpic.twitter.com/0ZwLpevlmK
dejazimako007,399376841,1,1003742386676264960,3,3.0,Mon Jun 24 2013Gonzalo Higuain dad Jorge admits his son is close to a switch to the Emirates telling Italian sports paper Gazzetta dello Sport: I can assure you that an agreement with both Arsenal & Juve has been reached.We know how that turned out If its not Ornstein.. https://twitter.com/ArsenalNexus/status/1003736113025036290 …
cmfw_,477538084,1,1010661275729158145,3,3.0,Men’s soccer is a bitch sport idc idc idc idc idc
ohiodnr,103074779,1,1010647979592699904,3,3.0,Today ODNR Director Jim Zehringer was pleased to award Jack Fishburn owner of the Cardinal Shooting Center in Morrow County with the ODNR Hall of Fame award for his work in outdoor shooting sports and conservation. Congratulations to Jack! pic.twitter.com/aHyiULyIVS
PaulMSports,410202126,2,1012098361686740993,6,3.0,Prince Co was fortunate to have a number of players/coaches chasing some of the most important trophies in hockey. Turk/Stanley @_ND53 Pres/Mem @dpraught and Brad Morrissey @HC_TELUSCup So Brad Morrissey joins Sports Roundup this Sun to talk about his run @morrisseyhockey
JRreportsports,791035296368525316,1,1010624132948660224,3,3.0,Tar Takes: NBA Draft 2018: Doncic-Young trade Sexton to Cavs Suns future with AytonBy @David_Matlock56 @TarTakes#basketball #nba #nbadraft #sports #Suns #Cavaliers #Doncic #Hawks #Young #Sexton #LeBron #Mavs #Ayton https://thejrreport.com/2018/06/23/tar-takes-nba-draft-2018-doncic-young-trade-sexton-to-cavs-suns-future-with-ayton/ …pic.twitter.com/ytojnxRr0P
rnm29461,2447282868,1,1012837281500225537,3,3.0,@Narendramodi_PM Our loving peopleSports is not for career (profession)They should be only for students.Just Politics is not for career (profession) they should be only for nationalist.Vande Matram  Jai Hind  Jai Bharat.Vishwa Bhartiya Sangh. pic.twitter.com/CGq5dm9OYi
EllySpaceMusic,744255789569806336,1,1012819872210997249,3,3.0,Follow everyone who retweets this:https://www.youtube.com/watch?v=kuhA2r4Kegs&list=UUifjAZKw-K-ZkatV0XBqHAw&index=13 …#1DDrive #1FIRST #LynDrive #follow #GhanaWithTrain #TEAMSTALLION #GainWithTrevor #Teamfollowback #IFBHomies #HelpFromFriends #cattina3 #ieFun #IFB #GainWithVin #TEAMROBIN #IFBDrive #sport #fitness #fun #love #bodybuilding
duPontREGISTRY,39770409,2,1013542854482948097,6,3.0,2018 McLaren 720SThis Nerello Red 720S comes loaded with Carbon Fiber Mirror Arms & Rear Aero Bridge Stealth Wheel Finish Stealth Pack and a Sport ExhaustView listing: https://goo.gl/dWx6cF pic.twitter.com/b9eNPnKHqT
TopRatedMMA,500355924,1,1012806706655645697,3,3.0,@RachealBlaze has been an Ambassador for Combat Sports for long time.  She has run into some health issues with her breast implants.  Please consider picking up her @GruntStyle tee to help fund the removal of her breast implants. Go > https://buff.ly/2IvpmQI #TeamMMA4LIFE #WMMApic.twitter.com/8j43AW3e6O
TheSpec,18206318,1,1010979222733688836,3,3.0,Weve cycled in high heels sport shorts winter coats and yes even sundresses. But regardless of what we are wearing we dont feel comfortable cycling in Hamilton on streets that lack safe cycling infrastructure Jamie Stuckless and Kate Whalen write https://www.thespec.com/opinion-story/8689579-infrastructure-not-sundresses-responsible-for-low-cycling-rates-among-women-in-hamilton/ …
asmaaan208,2412051054,1,1012113881823670272,3,3.0,Roman mask helmet 1st 2nd century CE. These are often called parade helmets for cavalry sports use but it has been suggested that they were also used in combat. The psychological effect of being charged by one of these masked warriors would have been formidable. pic.twitter.com/2vDh57zWXZ
volkstyles,386685820,1,1012109168625537024,3,3.0,In the last 6mo the MMA world has seen Nate Marquardt Mike Pyle Vitor Belfort Michael Bisping Chris Curtis Rashad Evans Greg Rebello and Johny Hendricks all hang up the gloves. This sport is rough. I hope they are all able to enjoy their time away the best they can
CoachToop,759477803356217344,1,1012103096238043136,3,3.0,#USMMAFootball at Fenway repping the Yanks. The Green Monster what America tradition & sports are all about. Taking it all in before the Plebes & the next batch to join the Brotherhood report for Indoc. #BeatCoastGuard #RechargetheBattery #Cask’nFlagon #Chowda #Zinging #Onitpic.twitter.com/lD8nQGEirH
PeoriaAZ,14476919,1,1012093264856600576,3,3.0,No pool? No problem! Come join us July 4th as Peoria entertains with games entertainment music and more along with world’s Tallest water slide! Peoria’s Fourth of July event will be held 5 to 10 pm at the Peoria Sports Complex. Presale tickets are available on our website! pic.twitter.com/615z7Id4bu
LimitGovt,90649509,3,1012083725931368448,9,3.0,The DOJ has just greenlighted the Disney/Fox deal—but not without first requiring Disney to divest Fox’s 22 regional sports networks. This proves the DOJ realizes the dangers that accompany mass media consolidation next we must turn to reining in @Comcast!
WMoneyball,4668735881,1,1012085313647382529,3,3.0,This morning’s show is available in podcast form on iTunes NOW!Data collection across sports (0:00)Modeling soccer w/ Luis Amaral (33:12)MLB World Cup & NBA draft w/ @Neil_Paine (53:04)MOre World Cup & Over/Unders (1:26:01)LISTEN HERE:https://itunes.apple.com/us/podcast/the-wharton-moneyball-post-game-podcast/id1159695411?mt=2 …
LactiGo,2959956608,1,1007752926272446464,3,3.0,Is Dad active? Does he like sports? Or working out?We have a great #FathersDay gift for him!Click: http://bit.ly/2t37urp  and help Dad Go Further...FasterSave an extra 10% on your #LactiGo gift for Dad.Use Promo Code FD10 at checkoutOffer expires June 19th 3pm EDTpic.twitter.com/DuAUazvMsT
worldcup2018ru2,1007198525766225920,1,1007733946602459136,3,3.0,Portugal vs Spain!  What is so special about the world best #Soccer #Futbol #Football #Cr7 #Ronaldo #fifa18 #ksi #bale #realmadrid #WorldCupRussia2018 #messi #barcelona #pique #PortugalvsSpain #sports #chelsea #manutd #soccermemes #footballmemes #Aguero #Mancity #mancitypic.twitter.com/wxje2qAbJN
digitalbookgirl,746750038110437378,1,1007733703840358400,3,3.0,Sail Cowabunga!: A Familys 10 Years at Sea by Janis Couvreux at https://amzn.to/2lanqUp  from @JanisCouvreux #Kindle #eBooks #Nonfiction #Sports #WaterSports #Sailing #Books #Outdoors #OutdoorRecreation #Sailing #Travel #TravelWritinghttps://twitter.com/JanisCouvreux/status/997173678025728002 …
Devin_Ugland,28616039,1,1007728571941416960,3,3.0,Over at Ladera Sports Center 2019s Anthony Holland Anton Mozga Dondre Bausley and Riverside ND put a drubbing on Los Al. Chase Webb and 2021 PG Justin Mitchell were solid for Tri City Christian in a W over San Juan Hills.
karateinnigeria,900301136850243584,1,1007728054741893120,3,3.0,Isssa holiday but Sensei Alfred of @NASKKarate isnt having it cos hes all about the #ShotokanKarate Master Camp #KarateInNigeria #ShotokanKarate #WeLoveKarate #iKarate #WeKarate #Sports #NASK #Nigeriapic.twitter.com/x74UdUo7pf
AggieSportsNet,776820520763346945,1,1003399781580922880,3,3.0,The Aggie Sports Network won a Golden Mike from the NM Broadcasters for the Arizona Bowl pregame show. It was one of eight awards won by Aggie flagship Zia Country on their way to being the Station of the Year. Aggies and 99.5 two winners pic.twitter.com/TANMYPsfDQ
LloydyAVFC,578808298,1,1003395865732636673,3,3.0,There’ll be some gimps who watch Wimbledon instead of the World Cup lmao. Watching Wimbledon over Judge Rinder is bad enough Truly an awful diabolical sport and I hope Murray does absolutely terrible would rather watch paint dry over my own eyelids until it kills me.
JeromeElam,433344236,2,1003378545429708801,6,3.0,Man Sentenced To 24 Years For Soliciting Child Prostitutes On Facebook « CBS Denver - Find Denver news Colorado news Colorado weather forecasts and sports reports including Denver Broncos at http://CBSDenver.com . http://denver.cbslocal.com/video/3874807-man-sentenced-to-24-years-for-soliciting-child-prostitutes-on-facebook/ …@BoysAreNot4Sale
pigginsmart1,517734120,1,1003378421236453376,3,3.0,Looking forward to seeing all of the children @GipseyBridgeSch tomorrow. Remember to come in your PE kits for sports day. Rec & KS1 start at 10.30. Picnic lunch with parents and then KS2 will start straight after lunch. Parents remember you PE clothes ready for the parents races
house_txt,957397330608533506,1,1013532572276715520,3,3.0,Can you stop calling me bucko?The golem-officer pauses. Draws itself up to its full height. Its glowing eyes flare red. Please select your preferred form of address. Available options: Bucko. Kiddo. Buddy. Sport. Bub. Junior. Pal. Buster. Slick. Sparky. Hotshot. Champ.
NCCSschools,191155107,1,1004850774260748288,3,3.0,RT nchs_soccer1: RT NCHSAA: #TBT to the 2017-18 sports year! Congratulations to all NCHSAA member schools on a fantastic 2017-18 year! #ThrowbackThursday #NCHSAA pic.twitter.com/lbYJX4yc4l https://twitter.com/nchs_soccer1/status/1004835036280115201 …
KentishFootie,891926893,6,1013527819924705282,17,2.8333333333333335,Lordswood boss Richard Styles lands former K Sports goal-machine Caine Smith.  Goalkeeper Tony Coxall striker Ricky Gundry defender Liam Dawson and midfielder Joe Matthews also sign for the club.
