user@mention,user_id,No of tweets,tweet_id,retweet_count,local influence score,Tweet
_thrivesports,1670621316,1,1005951842319306752,5,5.0,Great work by all the Thrive Sports Performance Lacrosse athletes who made a positive impact on their team.#thrivefam #strongisland #sportsperformance #laxtraining #harborfields #gardencity #ionaprep #syosset #sacredheart #csh #bethpage #chaminade #stanthonys #oysterbay #jerichopic.twitter.com/7hRPJFC5me
YahooForde,33395719,1,1005950522208202757,5,5.0,Belmont column: Bob Baffert lost his first Triple Crown race by a nose and worried hed never get another chance. Now hes the king of the sport and hanging with The King. Taking Justify from unraced in February to the Triple Crown is his best work yet https://yhoo.it/2sJ9oxe
AndyBarba22,2233842061,1,1004474672514240512,5,5.0,All Time favorite player each sport COPY PASTE EDIT..GO!!NBA - Jackie MoonNFL - Bobby Boucher JrNCAAF - Forest GumpNCAAB - Bobby Joe HillMLB - Benny RodriguezNHL - Doug GlattWNBA - Draymond Green Boxing - Apollo CreedWrestling - Nacho Libre
RESERvedlizGiz,845621076977729536,1,1006665272185499653,5,5.0,Great  occasion take the chance face many immense  #challenges requires #Unity and #Enviroment #Climatechange United we collective corrective tackle we all have part2play Pres #Putin requires #Passion What it lacks is #Leadeship Sports #Fifa #Russia2018 is blessing in disguise
reaganroy,26751981,1,1006652778175979520,5,5.0,Per @uiltexas regarding player ejections: 1) Football - remainder of game + 1st half of next game. 2) Other sports (soccer exception) - remainder of game + all of next game. Effective August 1 2018 if approved by Commission of Education. #TXHSFB #bEASTTexaspic.twitter.com/1CeE4IgDdp
ETNreisenweber,201136410,2,1012843448582524928,10,5.0,Spoke with @erie_seawolves Alex Faedo and Daz Cameron about their times going through the sports science testing with the University of Michigan. Faedo said he had a normal bullpen with a bunch of cameras watching everything while they had Cameron just run with sensors on him.
UnexpectedReply,843876908760686592,1,1009573693167525888,5,5.0,Victim #33 slid in my wife’s DM’s and stated that she’s “addicted to the sport” aka “your body is banging shawty you clearly workout”. And well since I’m a guy I knew exactly what was on his agenda and made the executive decision to intercept this Hail Mary with the swiftness. pic.twitter.com/f637M0O56J
ItalianoCalcio,132376441,1,1009541524563034113,5,5.0,Gazzetta dello Sport are reporting that Inter and Roma have reached a deal that will send Nainggolan to Inter. Roma will receive €24M + Davide Santon + Inters promising youth player Nicolo Zaniolo.
smallhistory,2458795916,1,1009936541265874952,5,5.0,At the LAA sports at Lunenburg our champion Ralph again crowned himself with glory carrying off two prizes a beautiful silver pudding dish and tea pot. Ralph came in 1st in the two mile lap race and 2nd in the half mile. Windsor Jun 21 1898
RedRaiderAD,3396697618,1,1003777838376456192,5,5.0,Lowell Pierrette gets better every time he steps on a track! His 21’-4” PR Jump at today’s “Last Chance” Meet at Lakeland HS @lakeland_sports was all he needed to give himself a chance for a NYS Long Jump Champion! #StateQualifiedx2 #IonaBound #RedRaiderNation #PlayInTheSandpic.twitter.com/95Sr7Kne3v
TheRealMrACL,1265754078,1,1008848041468747779,5,5.0,Next State: KentuckyToday 9 members of the legislature announced theyre teaming up to explore the topic of sports betting w the goal to draft & file legislation to implement legal sports betting. Existing bills on file in both chambers have laid dormant for several months now.
Sandy_D_Rooney,944275725875429376,1,1010673088785084416,5,5.0,Mississippi State vs. #3 Oregon State (Game 11)Live:> http://espn3itv.com/ncaa-baseball Stream live sports watch game replays get video highlights and access featured ESPN programming on your computer mobile device and TV with WatchESPN. Oregon State vs. Mississippi State Live pic.twitter.com/hT6Cufnz4t
sadgaytrash,2320947182,1,1010671559869194241,5,5.0,like imagine being my flatmates and seeing me walk in dressed in pink short shorts a pink sports bra and a pink hat that says princess on it. the image of me stood there opposite the gay flag in our goodvibes living room is just the best fucking shit
ChiefNisleit,1503636217,1,1010650804577959936,5,5.0,Honored to attend SAY San Diego’s fourth annual Unity Games at Willie Henderson Sports Complex. The Unity Games were the vision of Mr. Thomas Smith four years ago and SAY San Diego helped make it happen. Great job. #CommunityEngagement.pic.twitter.com/pnlfWx1YA0
diverbetic,2391420054,1,1010633583747162112,5,5.0,One of the greatest things about scuba diving is the  opportunities to meet new people and make new friends! It’s the love of the sport that brings us all together for a common goal! #diabadass #type1totypenone #scubadiving #t1d #sdidivers #padi #buddy #divebuddy #scuba #friendspic.twitter.com/t7QCCgxaAP
PetersenWill,88986363,1,1012831738223972354,5,5.0,Several execs in Denver sports have privately expressed in the previous month LBJ to Denver had potential legs that no one on a national scale would ever see coming. It’s always been about LA and still is but the Nuggets nearly had LBJ in 2003. 15 years later they’re back.
MaestroCares,466703239,1,1012811448609800193,5,5.0,Come out tomorrow rain or shine for the MCF 5th annual Yard Sale. All proceeds benefit orphaned children in Latin America and U.S. We will be having a variety of items on sale including home goods furniture sport clothing shoes etc.....#chicago #yardsale #maestrocarespic.twitter.com/zNxk045IBa
505Nomad,3406065993,1,1012108437541523458,5,5.0,White Rock overlook (next to Los Alamos) | Great scenic overlook of the Rio Grande valley near the suburban sports park (baseball diamonds soccer fields etc) - https://bit.ly/2oJM6VV #roadtrip #travel #NewMexico #vacation #OptOutside #landscape #naturepic.twitter.com/5huUrYfnNO
hartng,39596211,1,1012097677134368770,5,5.0,While traffic is high let me earn my SA salary.Governor Okezie Ikpeazu of Abia State today inspected the ongoing pitch installation at Enyimba Stadium. Contractor Ebi Egbe of Monimichele Sports (R) says its the same technology used in #Russia2018 pitches.pic.twitter.com/UMVDMA88cf
FrameDeArt,19086752,1,1007733619689865216,5,5.0,Always honored to frame for Loren Landow NFL Head Strength and Conditioning Coach of the @Broncos and Founder of Landow Performance! @LorenLandow is the very best at what he does and expects the very best that is why he chooses Frame de Art for all his sports framing needs! pic.twitter.com/mQuQZGVL9R
JanJekielek,15719232,1,1003374142983430144,5,5.0,Mittmedia’s @rgovik:  2/3 of users who read articles written by a text robot didn’t realize they were reading posts not written by a human. (Mittmedia publishes 1000’s of automated articles per month among them new home listings and hyperlocal school sports) #INMA18
LOLKNBR,552404975,1,1013550700066770944,5,5.0,BREAKING: Kuip says Flem yelled at Hank this morning for trying to cut the line at breakfast. Kruk reports Hank also tried to pick the peppers out of his salsa. Disgusting unforgivable behavior from a veteran beat writer. What in the wide world of sports is going on?
shayshay_parekh,1932063126,1,1013531251343527936,5,5.0,How about you also make a thread about all the land you’ve illegally occupied the families you’ve destroyed the culture you’ve stolen the peaceful protesters you’ve harassed/murdered for sport and the children you’ve imprisoned https://twitter.com/omribenlulu/status/942743750417305600 …
jaxdotcom,15572679,1,1004861813786333184,5,5.0,Jamie Shelton the president of bestbet will be the 2018 Gator Bowl Sports chairman overseeing the TaxSlayer Gator Bowl the JaxSports Council and JaxSports Charities. http://www.jacksonville.com/sports/20180607/bestbet-president-jamie-shelton-named-gator-bowl-sports-chairman?utm_source=Twitter&utm_medium=social&utm_campaign=jaxdotcom-SND …
HipsterRugby,914903841354735616,1,1004852771588399107,5,5.0,International game Championship League 1 and Women/Girls’ game are as strong as they’ve ever been. However amateur game Super League and junior game are in a sorry state. Were simultaneously the strongest we’ve ever been and the weakest we’ve ever been as a sport. Odd feeling. https://twitter.com/grammarkestrel/status/1004766873303609344 …
rvkgrapevine,22012028,1,1004836439849357313,5,5.0,#ISLs mighty tackles are making #GHA feel like theyre experiencing a different sport from the one theyre used to. Entering the battlefield with #Iceland is like entering a boxing ring. With bears hangry for goals. #ISLGHA #SmiteTheWorld #ISL #AdoptIceland #ForzaIslanda
SBRadio,21823306,2,1012797835757015041,9,4.5,Former @Nike Basketball & Football Sports Marketing Director @RGlll on LeBrons Nike business vs Michael Jordans Nike business: “LeBron’s got a good business but its not Brand Jordan”. Says that @Jumpman23 is a standalone business that continues to thrive after MJs retirement.pic.twitter.com/H0b86mdf4Y
WmptMillionaire,2717441304,1,1002692058077941760,4,4.0,Fall Sport Physicals for WILLIAMSPORT students:Monday 9:00-11:30 am at Lycoming Valley.  Monday 9-11:30 am at Curtin. 12:30-3:00 pm at WAMS.   Tuesday 8-11:30 at WAMS and 12:30-3:00 at WAHS.   Wednesday 8-11 am at WAHS.
jakelaub20,345804665,1,1002672320333393920,4,4.0,All Time favorite player each sport COPY...PASTE...EDIT...GO!!NBA - Victor Oladipo NFL -  Ben RoethlisbergerNCAAF - Payton Healy NCAAB - Jordy Hulls MLB - Todd Frazier NHL - Sidney Crosby Golf - Travis ButteTennis- Genie Bouchard Wrestling- Adam Brinkman
jeffphilips1,151010098,1,1002668290697781248,4,4.0,I dont get was it NOC that took the Dream Team to Rio or NFF?Or was Dalung in charge of NOC when he was receiving all the bashing?Whats incontestable is hes the current sports minister if he gets the flak when shit hits the fan he gets the praise when good things happen https://twitter.com/donphayan/status/1002663247324106752 …
WesternRattlers,2957742674,1,1008469068108582913,4,4.0,#BuyCanadian travel in Canada! Foods arts clothing top quality craft beer/wine/whisky sports equipment investing in Canuck businesses! #BoycottUSProducts #boycotttrump #FathersDay #BorderCrisis #Mexico #onpoli #cdnpoli #bcpoli #abpoli #nspoli #pei #onpoli #Montreal #yvr
SimplyUnrealHD,820745711021068288,1,1008464762781528065,4,4.0,1998: France World Champions2002: France out in group stages2006: Italy World Champions2010: Italy out in group stages2010: Spain World Champions2014: Spain out in group stages 2014: Germany World Champions 2018: ???
amysrosenberg,19655321,1,1007017943467773953,4,4.0,Atlantic City Council prez Marty Small Sr. says sports betting legislation sucks for the A.C. taxpayer once again.We have a chance to get an additional revenue stream new revenue and were left out again. Only sports betting money earmarked for A.C. goes to marketing.
JaimeBoswell2,788116760394240000,1,1005582372719427584,4,4.0,@kstarnes_tbc @bluff_sports @hoopinsider Great 2 days of Hoops at the Flour Bluff State Qualifier.CC Ray wins it by defeating Odem. Krum over Bowie for 3rd. FB wins Consolation over Rockport and Kingsville defeats Bishop! Swarm
saveautohistory,970008674,1,1005579359338614784,4,4.0,It should be noted that starting in 1962 Chrysler offered a 300 that was not a Letter series car - mostly a Newport Sports Coupe The Interior was not leather & it omitted a lot of the Hs luxury items BUT it could be had w/the Hs 380 HP 2-4 barrel V8! pic.twitter.com/6rQP6OuDXp
ThruTheBridle,100834411,1,1005930094874038273,4,4.0,Monmouth Park “Win” Payoffs Today:R1: $2.80R2: $2.20R3: $14.00R4: $3.60R5: $3.60R6: $3.80R7: $4.00R8: $5.80R9: $14.20R10: $7.60R11: $3.60 They need more than Sports Betting to improve their product and overall handle...#awfulracing
FromThursSweat,941323180022562821,1,1005912446559772674,4,4.0,With reports of rumoured interest from the  team  has moved quickly to extend the contract of former national striker Balo Boogle Sports reached out to Balo about a possible move to Balo: Me? ? Wha you really telling yuhself? pic.twitter.com/zHivkWyPrs
JRFegan,152849161,1,1005908179530723328,4,4.0,Sports radio phone lines fill up all around Boston as the White Sox win 5-2 taking two out of three in Fenway from the Red Sox. Reynaldo López gave the White Sox 19 outs and Jones Fry and Soria closed out the rest
WarrenKembel,931426065532067840,3,1004491125070036993,12,4.0,Well well cute little rigged sports distraction. We got a sellout athlete acting his script hes called King James todays 6/6 and the 66 books Bible is named for the real King James.Theres much more to this especially 45 but...LeBron = 33 James = 33 Thirty Three = 66 pic.twitter.com/TY9Pe2BOxy
selahfootball,70317225,1,1004501549693857792,4,4.0,A huge congratulations goes out to Zak Donato for being named the Yakima herald fall male athlete of the year today at the  Yakima sports commission luncheon. An honor well deserved. Way to go Zak. Tristan McDevitt and the team were also nominated.
Buffalo_Schools,455795533,1,1004490500076986370,4,4.0,Children Overcome Police Stereotypes through Sports (COPSS) will host a basketball game at McKinley High this Friday June 8th at 4:00 with  special guests Mayor Byron Brown and Superintendent Kriner Cash as the McKinley All-Stars vs the Buffalo Police All-Stars! pic.twitter.com/HHDJ51UicY
ConcussionLF,26487256,2,1012081905175494657,8,4.0,There wouldnt be a jockey riding that hasnt been concussed its just a matter of how many times.”Australian jockey Dale Spriggs has pledged his brain to the Australian Sports Brain Bank part of the CLF Global Brain Bank. Read more:http://www.abc.net.au/news/2018-06-27/jockey-dale-spriggs-donates-brain-to-reveal-impact-of-falls/9898428 …
NavajoEquality,2321303605,1,1011759697487990784,4,4.0,BREAKING NEWS >>>> Dine’ Pride After Party will be hosted at Sammy C’s Sports Pub this Saturday June 30th in Gallup NM - COVER: $10.00 - DJ Wreck spinning music all night + Pride Drag Show hosted by the fabulous Tomahawk Martini! #WeAreSacred #Pride2018 #NavajoNation
NaturalNetwork,105869845,1,1011739695204716544,4,4.0,Help #kids stay cool during the hot #summer heat with this #refreshing #homemade #Coconut & #Lime Sports #Drink #recipe: http://www.naturalawakeningsmag.com/Healthy-Kids-Archive/Healthy-Summer-Hydration/ … #healthyrecipes #recipes #drinks #hotdays #summerrecipes #DIY #hydrationpic.twitter.com/hb2fi14N84
abby__sams,1187603414,1,1011726868083601408,4,4.0,Got another email saying Im not disabled enough to participate in an adaptive sport bc EDS (they specified that joint hypermobility aspect) isnt disabling and therefore does not qualify me for the sport Even though I have 3 other illnesses use a wheelchair & am legally disabled
SouthOCsports,573860023,1,1011715606561939456,4,4.0,Long Beach Fire Capt. Dave Rosa killed in shooting was from San Juan Capistrano & longtime member of SJC Little League as president umpire coach. There will be a memorial at 6 p.m. prior to Little League All-Star Game at Cox Sports Park in Ladera Ranch. http://ow.ly/OXdX30kG9Ne
asifahsankhan,156045820,1,1011708493668249601,4,4.0,Nice going Diego you big freak #messi #ARG #ARGNIG #Argentina #Nigeria #NigeriaArgentina #NigeriavsArgentina #NigeriaMourns #Maradona #Mascherano #Fifa #WorldCup #WorldCupRussia2018 #FifaWorldCup2018 #Football Maradona Mascherano #TuesdayThoughts Rojo Victor Moses #NIGARGpic.twitter.com/BXxMOmaALA
BearPawChris,944779755244609536,1,1009556916962451456,4,4.0,Jager Myslawchuk has hired a law firm because he’s a confirmed IQ deficient moron that ran onto the field where a violent sport is played by athletic people wearing hard plastic and polymer armour.... What could possibly have gone wrong? ......You deserved the hit dummy.
CaptainJLasc,952508481902391296,1,1009914431944429570,4,4.0,The team selection was awful from Sampaoli. Croatia fully deserved it they bossed it in midfield. Mascherano Acuna Meza Caballero Otamendi and Perez etc arent good enough. Banega and Dybala should have been in the side even Rulli in goal and Icardi and Correa off Atletico.
TGfUInfo,703374901,1,1009909751755362304,4,4.0,Check out our #TGfU Symposium: ​Using TGfU to educate our students in inclusive and developmental ways program at the #AIESEP2018 World congress. Jump online & register: https://tgfuinfo.weebly.com/aiesep-2018.html … The symposium is open to teachers students researchers coaches sport coordinators pic.twitter.com/f2XERlp2Mv
Tonyfitzmauric2,817085225415086081,1,1009902918928158722,4,4.0,Tots all sports session and junior girls football session tomorrow 4-5 Amlwch Primary School.All sessions carried out by qualified coaches and all DBS cleared from Amlwch Town a junior FCTots 3-5 yearsJunior girls 5-10 years@FAWTrust @FAWales @amlwchtownfc
PulaskiSoftbal,950782057633984512,1,1003784769258377218,4,4.0,Congratulations to all our PC Lady Maroons that made the Lake Cumberland Sports All County softball team (Haley Baugh Emilee Gowers Eva Gover Riley Hull Gabbie Countryman) and to Senior Krystin Wilson on being selected as Player of the Year! pic.twitter.com/j7XQEfmpuC
CSmithScout,916707956,1,1008831771604025344,4,4.0,C/o Jr film on Sequoyah (TN) QB/Ath John-Douglas WigginsPros: Good size & length. Arm power/strength. Great overall two sport athlete. Accurate. Vocal leaderCons: Refining of mechanics & body. Still raw but has the tools#EastTN19 #CSShttps://www.hudl.com/video/3/5346217/5a2ff6f74205d90ef00488a5 …
Feministory,237975305,1,1010653625692147712,4,4.0,6/23/1931 — Lili de Alvarez Spanish tennis player introduces shorts to Wimbledon by wearing a hybrid skirt-culotte style garment and pioneers practical attire for women in athletic competition. The silk outfit was designed by Elsa Schiaparelli #womenshistory #sports #Resisterpic.twitter.com/XC6y9I8D8I
WARFRadio,2549704357,2,1007771127525937153,8,4.0,Join us from 12.00pm this afternoon (16/06) for live coverage of the Round 6 #SwisseVFLW clash between the Western Bulldogs and Williamstown at Henry Turner Memorial Reserve in Footscray. RSN Carnival  RSN Racing &amp; Sport App  http://rsn.net.au/digital-radio pic.twitter.com/5Jy7OGgqFr
ego_biggest,4623389565,1,1010626936643772416,4,4.0,Dec 2015..Peter Nelson is the ideal choice to spearhead our groundbreaking programming initiatives as well as our commitment to world class boxing which have made HBO Sports “He has a comprehensive understanding of boxing.Michael Lombardo Pres of HBO programming! @HBOboxingpic.twitter.com/ZtyldnQZR4
pe_davis1,52916109,1,1012843253979402241,4,4.0,The Turn 1 ABC Wide World of Sports Tower view of @TheActionTrack in Terre Haute for @WoOLateModels vs @DIRTcar_Racing UMP @SummerNationals Late Models and @SummitRacing Equipment Modified Nationals vs. Scotts Custom Colors & Auto Body UMP Modifieds #SummerNationals #WoOCraftLMSpic.twitter.com/8H64gCMWXr
LSU,44156044,1,1012809635366162433,4,4.0,10. Shop til you drop! Pick up new gear at the #LSU Sport Shop next to @MikeTheTiger’s Habitat or at @LSUBooks off Highland Road.Don’t forget the John and Rose Ann Shelton Gift Shop inside the Lod Cook Hotel lobby.pic.twitter.com/onXMnCgH0l
muskrosevintage,759918767962849281,1,1012804406264283137,4,4.0,#Vintage Cigarette Card Album Collectible Cards Cigarette Cards including Animals Cars Australian Sport Transportation Indigenous Cards https://etsy.me/2IDSfKC  via @Etsy #cigarettecards #vintagecards #collectiblecards #cigarettealbum #ephemera
JoshLJackson10,51105329,1,1012802891239878656,4,4.0,Best Sports Radio Shows:15. you14. cant13. rank12. them11. because10. every9. show8. is7. different6. and5. loved4. by3. its2. listeners1. @SportsCallAU Join myself @ryanlavoie0 and @_ChristianPage for a fun Friday edition of SportsCall NOW!!
as_it_matters,992591961726029824,1,1010996543711776768,4,4.0,There’s some bad news for those looking to bring coal back. Turns out Solar is... http://bit.ly/AIM-Solar_Wind_Power …#AsItMatterz #AIM #AsItMatters #Music #Sports #Technology #tech #art #science #worldevents #events #worldwide #earth #news #newsoftheday #solarpower #energy #energyindustrypic.twitter.com/fsoAPSjnyF
EveyJacob,75116880,1,1010987922785382400,4,4.0,Its weird to me how its acceptable to still be upset about a bad sports play or a characters death from years ago but Ill still hear Youre not over [significant real person/pet you loved]s death? It was [period of time] ago!Dont put timelines on grief folks.
Raceday2011,635063782,1,1012120599785811973,4,4.0,1. No stages2. No playoffs/chase3. No green white checkereds (whoever is p1 at the end of advertised distance wins)4. Cheaper cars5. More short tracks6. More road courses7. The media stops oversaturating the sport. Theyre annoyingI know I listed more than one  https://twitter.com/jeff_gluck/status/1012094730824368130 …
hiddensalezone,792803833617481728,3,1013558868801138690,12,4.0,#7: 16” Long Bottle Brush Cleaner for Washing Wine Beer S’well Decanter Kombucha Hydroflask Thermos Glass Jugs and Long Narrow Neck Sport Bottles  http://zpr.io/6pcSy
Heritage_Sport,730432555703402496,1,1012105265557143552,4,4.0,In 2012 the Black Swamp Find presented collectors with a pristine time capsule of candy cards from the sports Deadball Era and this E98 Ty Cobb is one of the best a @PSAcard Mint 9 with none higher.  Making it one of the finest Cobb cards in existencehttps://sports.ha.com/itm/baseball/1910-e98-set-of-30-ty-cobb-red-black-swamp-find-psa-mint-9/a/50004-50134.s?Type=social-sports-twitter-e98Cobb-062718 …pic.twitter.com/JenXvajapW
OUAZKenny,974712773136465920,1,1012097957640880129,4,4.0,Every coach in all sports have that “go to” person for EVERYTHING. Without Briana Prothero OUAZ enrollment advisor my job would be a living mess. She’s a rock  Thank God for her. OUAZ is very fortunate to have her. If I had a FULL ride for life she would be my 1st signee  pic.twitter.com/7LjeuLneB2
johnmaddox,503541916,1,1007740320728088576,4,4.0,I spoke with Sports Authority and the Preds pay $2.4 million.However the current subsidy is $3.35 million (unless the $150k reduction is passed) So as taxpayers we are giving the Preds $900k to play at Bridgestone Arena.This is unreal.
JFreepicks,1004384773903650816,1,1007736945265475584,4,4.0,#MLBcard ready RETWEET or FOLLOW to receive tonights card #FREE sent via DMAnother 5U MAX play tonight! We #cashedin a #MAXPLAY last night so you dont want to miss out! Also a few 1U+ plays. #freepick #mlb #sportspicks #win #free #sports #sportsbet #guaranteedpick
FlanaganNJTV,2434421515,2,1004832723696062465,8,4.0,Lawmakers amended sports betting regs bill to remove “poison pill”- that means venues like Monmouth Park can legally open-even before the Gov signs the bill. Monmouth Park may do that-because ⁦@GovMurphy⁩ is not expected to sign this til next week at earliest ...pic.twitter.com/Y4ptPQRfuT
ipgphotography,219044151,1,1003412768421236738,4,4.0,Sitting quietly on the canal bank waiting for that first biteWall Art Gifts and Home Décorhttps://buff.ly/2IJBm2e #FineArtAmerica #HomeDecor #Canal #Waterway #Boat #Fishing #Sport #Barge#gifts #UKHashtags #UKSmallBiz #ATSocialMedia #ATEuroBizpic.twitter.com/0gbd3eizZC
OfficialCWD,935716323388092416,1,1003398362006093824,4,4.0,BREAKING: The CWD will be holding tryouts for Iconic Sports @IconicSprtsMgmt to sign new talent at the CWD Warehouse the last Tuesday or every month for the remainder of the year! Come sign up and possibly join the CWD or #BeIconic and find representation! #CWDNews
oceantocity,25187532,1,1003370205249196032,4,4.0,Did you spend the weekend being a spectator at the fantastic O2C this wkend. Fancy trying Stand Up Paddle Boardng! SUP is the fastest growing leisure sport because of its health benefits. Join Atlantic Off Shore adventures at the Leefields Monday 4th for tasters sessions pic.twitter.com/0znnWWwKEy
snowycats,93575470,1,1013569781876776960,4,4.0,Media bias in this country is stark - Murdoch papers are trash - gossip sex sport but laced with huge attacks on Labor & unions every day - papers are pure propaganda - there is no semblance of balance - Murdoch a toxic influence on our society
braves16u,764946645893210112,1,1013551058067578881,4,4.0,Two more wins today at Sports at the Beach. 4-1 win in game one over Det. Black Sox. @hitchenson77 goes the distance in game one with a mammoth home run by Colton Stetz. Game two saw another clutch homer by Spencer Kwilos. @Bquinny15 with 4 clutch innings in relief for the win.
InstoniansCC,701266871,1,1013526003979902981,4,4.0,Summer scheme begins Mon 2nd July & lasts the whole summer.Multi sports camp with an emphasis on cricket.Everyday 9.30 to 12.30. £15 per day/£60 per week/£45 for 2nd child. Open to any child going into P2 in Sept upRob McKinley will be leading the camp contact: 07936290437
CharlotteG1711,874902716031565824,1,1004867373390843909,4,4.0,I really couldn’t care less what someone does with their life wear dresses have an amine profile picture just stop threatening women stop trying to come into safe spaces women fought hard for. Stop taking over our sports and stop transing innocent children it’s child abuse!
jela9ja,4073196640,3,1013530976230739968,11,3.6666666666666665,Smart Home Deals!Amazon Echo Dot 2nd Gen for $29!Here https://amzn.to/2JQIsWc #geek #deals #tech #amazon #home #gamedev #gadgets #fashion #gaming #bots #gifts #dad #father #worldcup #smarthome #smarthouse #nerd #devices #sports #speaker #musicpic.twitter.com/1uf8sV36Vl
